,Unnamed: 0,op_id,op_gender,post_id,post_text,subreddit,op_gender_visible
1570,1206283,hc600,W,1206283,"- well, obviously feelings you. - is the one failed communicate that you - shes probably pretty is doubling down on why shes angry. though doesnt make sense. - might been something else that triggered the outburst. maybe an ex at the you wasnt alone pissed you show up. maybe woke up on the wrong of the bed. - if you a relationship with her, you maybe salvage things, personally way of dealing with feelings is a issue. might grow out of in time, wouldnt around it.",relationships,False
1571,730631,Spidooshify,W,730631,what the hell does that do with taking a virginity?,funny,False
1572,1213081,kasuchans,W,1213081,its not that difficult. ive dozens of them. genuine friendships. the guys not be assholes.,relationships,False
1573,742171,I_Will_Try_More,W,742171,along the lines of hard coffee colored peaks facing the world from dds.,funny,False
1574,1185995,dewprisms,W,1185995,its unfair hold besides yourself your standards if theyre not doing adversely affect health unless specifically tell you that want your opinion in act on it. its not like girlfriend is refusing brush or something.,relationships,False
1575,1200033,floatinggrace,W,1200033,"what if you up unattractive not bright? then you bad your has bad taste in if satisfied 9 years with like that, whats special about you? (um, dont this from experience...) at another comment of yours in this thread, seems you are intelligent with your fair of degrees. you engage on an intellectual level youre good-looking. that at least your guy has good taste then begin the difficult process of working through anxiety. sounds like thats all this is. a few talk about managing be helpful. me. redirect your thoughts focusing on what is good about the relationship. if theres something about your looks or your personality that you you change, it! dont thats what is causing the anxiety. you need get the source of that confront it.",relationships,False
1576,1212899,Self-Aware,W,1212899,"warning, terrible pun, warning.",relationships,False
1577,1186015,dewprisms,W,1186015,"dont blame feminism. im a very feminist woman, as are basically all female friends, none of are that asinine.",relationships,False
1578,758120,reh888,W,758120,you mean lack of foreplay. sudden dick youre not is not pleasant.,funny,False
1579,1193766,whenifeellikeit,W,1193766,"you sound like youre not in the us. no idea things operate elsewhere. if you are, you dont insurance, then you no leg stand on. no insurance = no accident. you will get nothing. seriously, you should out. also, get insurance.",relationships,False
1580,1184934,dungeonkeepr,W,1184934,"given the youre in is drastic, you about searching jobs in other eu countries? or possibly finding work as a native spanish speaking abroad?",relationships,False
1581,748872,Anrikay,W,748872,"> truly do not give a shit about soccer here. from seattle, thats bullshit. seattle sounders sold out the stadium the seahawks ever did. men national teams done fantastically in the world cup. the is win a bid host. maybe *you* dont give a shit about soccer, maybe america as a cares *less* about soccer than football, actually doing well american soccer has grown a lot. please dont speak all americans. its not what a goalie looks like, dont defend yourself by saying its dont give a shit. i, many others, give many, many shits about mls national team.",funny,False
1582,730186,baked-potato,W,730186,im the people beaten subjected cavity searches (for the crime of jaywalking) at the mardi gras this year that abused by sydney cops of nyc ones. the aboriginals in sydney police custody are probably at the hands of reasonable good natured sydney cops of american ones.,funny,False
1583,741238,SteelPenguin71,W,741238,"nah, youre not. im the exact you described. its as likely that the wants hold accountable keep on track with eating habits. if struggles with eating shes (my personal downfall). is nothing wrong with taking responsibility.",funny,False
1584,1201053,codeverity,W,1201053,"> if you are not prepared learn lift transfer properly, buy all the equipment, retrofit your you should not care an elderly person. this is very true... grandmother is 89 fully mobile (though not as as used be) will be going into a retirement soon. its good fully choice thats seniors that dont trapped or isolated. has macular degeneration has trouble seeing needs assistance with bathing, in general finds things much more difficult than used be, will be good the help. the few years has the struggles that seniors - several of fallen themselves, some struggle with getting attention from children. needs be more of a priority like people talk around quite a bit.",relationships,False
1585,751439,Vilokthoria,W,751439,vitamin supplements in general. unless you actually a medically diagnosed vitamin deficit you dont need them.,funny,False
1586,1193528,MssDare,W,1193528,"im not gonna bother down voting you. should do whatever the fuck want what can make piece with. bet you werent an angel in your teens either are you judge? if makes choices that you do or did. not your place call pig-disgusting, sir.",relationships,False
1587,1204749,clomjompsonjim,W,1204749,"a relative of travels destinations work quite often, usually means has work hours while hes away make the most of the does tourist stuff. judging by youd nipping off a few weeks, of tourist attractions food other stuff. in reality its all take the stress out of a very full-on project hes working on. if you travel all the you might as well some fun, otherwise gets laborious.",relationships,False
1588,1208611,teardrop87,W,1208611,"this is going sound strange, maybe your needs some signs of appreciation. if you home, dinner, flop down on the couch, does you what did. does ever awesome is keeping the house up, that the yard/garden looks fantastic, or that amazing? maybe a 6 pack of beer, or out with the guys at the bar. its going sound strange, hasnt a off in over a year.",relationships,False
1589,743808,maowsers93,W,743808,"right, limbaugh regularly has a panel of people disagree with points on show argue against him. mahar is abrasive offensive sure, compare a man sits in a by himself talks into a microphone is off the mark.",funny,False
1590,1205078,kasuchans,W,1205078,"theres a difference between poor buy good pads poor buy any in that camp almost certainly cant afford out a 3-7 period lose those wages or the job itself. that being said, doubt thats whats happening here.",relationships,False
1591,723794,AliasAurora,W,723794,burns?,funny,False
1592,759040,Showmeyourvocalfolds,W,759040,the one thinks this is a devil cichlid?,funny,False
1593,1210323,SarahKelper,W,1210323,"> sounds like hes insecure **needs some reassurance that youre with want be with not your co workers.** this is exactly what wants exactly why hes behaving like this. wants cater insecurities stroke ego, if does that, wont change behavior. changing wont change behavior. hell find something else badger about what wants is control over her. /u/throwawayhairgirll, please stop manipulate you. these are flags. its been five months - get away from him! editing add: in a book often recommended on this sub, *why does do that?* about abusive partners, the author lists a number of warning signs of abuse. from your op a couple of your comments, hes hit a few: * is disrespectful toward you. * is controlling. * is possessive. * is self-centered. you in your op that pretty mad you drop it. what exactly say/ do? also, is this relationship *very* serious? is saying you talking about your future together?",relationships,False
1594,1187539,amongstheliving,W,1187539,"you care about you want make things work... not is over you, hes over children. you deserve a guy will as hard as you are. your has choice.. divorce hurts, this is whats best you your girls. if truly you, wouldnt lie break off with this dude be with you immediately. pm anytime talk",relationships,False
1595,1187937,Little_Lion,W,1187937,...thats the age most people whether or not children.,relationships,False
1596,1189133,lazybarista,W,1189133,"uh, what? no. dont discuss sex life with anyone dont want to. if dont want having sex with under roof, thats all that needs be said.",relationships,False
1597,1204353,ninjette847,W,1204353,social media reality shows existed then too.,relationships,False
1598,1198977,girlcalledkelly,W,1198977,you *kind of* hope wouldnt come?,relationships,False
1599,1185739,nosoulnoworries,W,1185739,is why should been more clear. the unsafe part pertain the leaving without a word. unprepared warrant a conversation.,relationships,False
1600,1203135,EffingSpiders,W,1203135,"your is that you are a head start on future like this! get a chance do any clubs or activities younger, like this robbed of the ability excel. you!!",relationships,False
1601,1188037,ZoomZoomBlondie,W,1188037,"im actually not passive at all, is why issues with the way deal with stuff. dad, example, will see something doesnt like that did. then be out of the room, within earshot (like in the with the door closed) then rant rage about whatever issue has with (me) mom. ive why wont tell what issues are, looks at like im stupid walks away......then rants that im being brazen or something. the relationship where talk him, get nowhere. thats why through mom. can talk her, relays say, him, if not to. is not a conveyer of emotions, doesnt want either. talk him, obviously can knows to, theyve been 28 years, get well ill talk him. like im running in circles, pausing briefly beat head against the wall.",relationships,False
1602,1212763,whoop_there_she_is,W,1212763,"good luck! can see post struck a chord with you, based on your volatile reaction, see correct. you all the best.",relationships,False
1603,1189503,futurecrazycatlady,W,1189503,"well goes motivation dating an american ;) nah kidding, the impression that its more common in the usa the suggests the activity pay than is over here, where the bill is pretty much the standard.",relationships,False
1604,1217132,KaeAlexandria,W,1217132,"dont, its more a thing that comes up organically like im going the movies with the guys or d&d with eric, jake len that night. im a recently tell straight up that having mostly less inclined want be friend? pretty as not make a big deal out of as a point.",relationships,False
1605,1196347,nkdeck07,W,1196347,the heck sends <3 you in a message as the tell you?,relationships,False
1606,740790,bnliz,W,740790,yes. are film baftas tv baftas though - a tv one.,funny,False
1607,1209814,mp33,W,1209814,"ok, ill tell you the deed is done if thats ok. want do in person, wont be a month.",relationships,False
1608,736648,bebeschtroumph,W,736648,isnt that a normal term add to?,funny,False
1609,739225,Saiokuo,W,739225,"...welcome town. please dont us, arent all bad.",funny,False
1610,1198533,candothefrug,W,1198533,"its not, that doesnt mean some bad motive. if died, dont on living. suspect that couldnt. shes been do that, might been of bringing that into a new relationship. or maybe avoidance. its normal act irrationally after something like that. needs talk her.",relationships,False
1611,1200968,Amforsythe,W,1200968,"its a bit much your teach you a new language. if youre struggling with learning already, is do that any better than people with years of experience ? thats a massive amount of energy - likely does not teach. what you ? do you *want* learn the language ? is realistic you learn ? be honest with yourself.",relationships,False
1612,1209591,Jilltro,W,1209591,"this seems like a very simple situation. no, you stay where you are look out your first, clearly you cant depend on your ex husband. cheated on you, abandoned you, now (im guessing things pan out with the new lady) wants you back? tell hell no! been done that, on.",relationships,False
1613,1189218,XysidheQueen,W,1189218,"hi there. understand your problems a dating guys, after a few years youll be a lot more with all. off, the point of dating is figure out if you the other are compatible. youre never, ever, *ever* obligated become serious with you on a with if insinuate that you are you better drop fast. the thing youre obligated do is talk, perhaps pay your half of the bill. its okay, its normal, not want see after a or two or three. thats what are you can figure out. dont guilty, youre doing nothing wrong. getting in a relationship with you dont like is wrong as your wasting your the other persons time, of your money, on a relationship thats doomed fail. what you need do is get that idea out of your head that you owe the youre going on a with anything. you dont. if you keep up a nice conversation pay your half of the bill you owe nothing. you dont owe another text, a call back, another date, a kiss, sex, anything. you dont need do after that a polite rejection be considered good manners. dont be let people get close, you can end things. your relationships are under your power if you want end them. any you dont want be in a relationship with you hold the power say no, say goodbye end it. keep in mind you do youre doing a favor, youre freeing from a doomed relationship thats taking up be using find does care will make happy. by putting off those break up youre hurting more than you ever by ending it. once more, let anyone guilt you into any reason. if do run away as fast as you can thats a flag. good luck, promise dating gets easier after youve done a few years.",relationships,False
1614,1213971,chromatoes,W,1213971,> obviously can occur on the pill denied that..? thats like saying condoms arent safe can happen on them? read what wrote what are discussing well that is exactly the problem with ops fuckface ex! want use a condom clearly absolves himself of all responsibility knocking up. cant re-read what you wrote you deleted it.,relationships,False
1615,1201168,longobong0,W,1201168,"op, whether or not your upbringing abusive is not decide. sounds like youre very affected by this day, that reason alone, be a good idea speak a about your father. no are perfect, im not is a single alive is not recovering from childhood in some way. me? yeah, your father sounds a bit harsh. abusive? maybe. but, of course, thats relative own parents, rather growing up. you should strive get a point where your fathers approval is not the end-all be-all. some people are stubborn know-it-alls can do whatever you can do, better. sounds like your might be one of those types of people (at least with you). as as youre with your life the direction your life has gone, shrug your off. gl op.",relationships,False
1616,1196405,jonimc,W,1196405,"this issue too. is older better experienced with money. figure out shit. some people need a kick start understanding manage money. everything, hasnt experience the bills that with being an adult, needs some help. this actually be a fantastic learning experience as well as a way the two of you bond more as a couple",relationships,False
1617,1213210,ffreudiannipss,W,1213210,"dude idk, ive been various doctors. dont much. maybe ibs-c, its not that no typical of constipation. dont go. then eventually after like a its regular.",relationships,False
1618,1192372,ThatsATallGlassOfNo,W,1192372,"/r/personalfinance is cool, those people arent educated in the slightest. its like going /r/law great advice. you should consider seeing an adviser. that money is being wasted if its in your savings. edit- dont mean put down /r/personalfinance unless youre a college kid probably cant you much.",relationships,False
1619,1190393,snowlover324,W,1190393,"its more the hard timeline thats the issue gf. mean, be say, hang out on these days these times you will not stop this unless is a major emergency. look at response you. > 3 nights a where hang out, **even then** make as if should be that gives some on these 3 nights that are meant buddies no one else. 12 hours dedicated solely during the working is a lot of time. its over a third of thats rigidly scheduled as only, no while includes in volleyball stuff. dont that should stop gaming, having a rigid 3/5 weeknights is pretty hard deal with.",relationships,False
1620,1207868,workthrowa,W,1207868,"in that case, maybe a nice resort, that has activities stuff do gets bored, is quiet you? can tell you right now shes not going want do nothing any extended period of or be cut off from things do. thats not shes wired. im the same way. if you take a secluded cabin a probably run away. doing nothing, some people, is not in the least. if all gears arent spinning, the opposite of relaxed. this is a tough compromise, ive do with members a similar travel style you. dont will 100% ever want be in a cabin in the woods, if thats the type of vacation you want, you may on those without her. personally, tough out once few years...maybe...but not like resent that spent pto on something unenjoyable rather been working than doing that.",relationships,False
1621,1185529,Sondalsta,W,1185529,in several states an engagement ring is considered a conditional in contemplation of marriage. if is no marriage the ring must be returned. if you live in california or montana though you are s.o.l. <link>,relationships,False
1622,1185657,NAMASTE_BITCHES,W,1185657,"you raise some good points. isnt the same as pre-childbirth (mild stress urinary incontinence), flabby stretch-marked tummy, bouts with postpartum depression. youre being a bit alarmist. most recover pretty well with a few battle scars. fistulas prolapses can be surgically fixed, are a rare occurence in the place. still, if doesnt want do this now, sucks op, shouldnt to. should be into this world by mothers.",relationships,False
1623,759398,danceycat,W,759398,you mean this guy? apparently hes going strong...,funny,False
1624,759527,TheFuturist47,W,759527,"dont offhand what aunts insurance dont good... uncle lost job due the tumor obviously up after about a year a half, cousins on (hes now) between those two compiled uncles funeral financially decimated. makes angry that these types of things - financial ruin debt due expenses - are normalized. died, a is financially destroyed, will find a way turn around on not address the broken system. pisses off a lot. is a determination in this country not admit that deserve better, that admit that something is wrong in the place. youre after your stay.",funny,False
1625,731423,scrote_inspector,W,731423,alcohol stops you from *thinking* youre boring. nothing worse than getting trapped in a one-sided conversation with an ugly drunk that wants tell you all about some inane bullshit.,funny,False
1626,1199812,girlnamedgypsy,W,1199812,"is me. the thoughts arent gone good. the thoughts ( that is attractive. does that mean not attracted so? does that mean dont need be in this relationship... on), im slow down down. from there, can logically about thoughts on. are issues. intimacy is hard a trigger. agree about the real love/ real relationships comments. tv movies used be a triggers",relationships,False
1627,1215638,lamamaloca,W,1215638,"> fry in a pan where get a browned theyre amazing, though. wait, fry potatoes? this may change life.",relationships,False
1628,722906,Arcadia_Lynch,W,722906,you realize that you can indeed be fat healthy.,funny,False
1629,1204385,goatismycopilot,W,1204385,well lack of support over using drugs a big issue in marriage make ashley compatible.,relationships,False
1630,1188831,dude324,W,1188831,"the wants break up, put money on it. no girl, ever, see a board straight up assume its in seriousness if the couple is not engaged. seriously, single porn boards. almost certainly being malicious.",relationships,False
1631,732631,hablahblah,W,732631,context is everything.,funny,False
1632,730578,megere,W,730578,god! miriam margolyes that!,funny,False
1633,1217139,OtherKindofMermaid,W,1217139,"you are set whatever boundaries you want in your relationship if your cannot agree them, then you are incompatible should break up. should be upfront honest with you, as well. if says will no longer look at these types of images, then does anyway, does with full knowledge that has violated your trust.",relationships,False
1634,1191711,slangwitch,W,1191711,"so, youre going be a rapist monster individual you the system all live in contribute (both genders create society) is unfair you? that is displacing your anger will ultimately fuck your life up too. youve become a true monster after some bad experiences. plenty of people worse experiences dont on victimize people ever show a nice (these are themselves with you your pleasure, not attacking you!). youve been doesnt mean you get dozens of others in retaliation. makes no logical sense! these dont single handedly create the system that you arent your ex either. you sound very much like an insane serial murderer if one substitute the killing with being an asshole is likely spreading stds all through neighborhood. you your illogical justifications overarching anger at society justify your criminal behavior, ultimately you are as deranged as any other rapist your justifications mean jack all. your anger is the advice of this website. you need help, possibly a stint at a mental work through your demons. you must stop having sex with get tested right away. its your duty let these if might be at risk stds. lets put this way... if you aids then youre likely spreading many partners now. if that alone wont stop you then ill direct at your own self interest. if a number of these wind up having aids, report you as a partner the cdc that youve infected far more than the purported condom use should then its going become fairly obvious that youre maliciously spreading it. thats happened often enough the patterns criminal profile of the people do that be fairly well understood by law enforcement. you wind up in jail this. considering you believe youre attractive, bet jail not be your behind... if you a shred of morality in you, youll call these up at least that youre the condom may been defective that can get tested not spread stds other partners. your issues with are pathetic dont care bother addressing you might fix those. thats you the term you need hire figure out. do believe that youre very likely a sociopath, in case you probably will get the you need will wind up fucking your life others lives up much that youll be most help. jail will not be pleasant. forced fatherhood / support payments will not be pleasant. your life will not be pleasant. really, if you that you cant be found by any of these or by law enforcement then youre naive. youve the gun your own temple you dont it. youre gloating about being a rapist as if its some of great vengeance act on all women. its not, youre fucking over individuals havent done bad you. dont, by virtue of existing, make your life suck or create unfair thing in the world. its insanity that do.",relationships,False
1635,1213604,kelzispro,W,1213604,"im a stranger on the internet, say youve this. your need you, you find in yourself somewhere. :) recently life has been much better. is easier im not dealing with shit.",relationships,False
1636,1201846,No-I-Do-Not,W,1201846,"honestly, no. you broke up you need get over you can be friends.",relationships,False
1637,1208153,GrandmasRightNipple,W,1208153,"see the chromosomal thing as something no rational become angry/upset about if found out about it. you need be upfront about the cant/wont part, that eliminates adoption/mind changing (i.e. your partner might hope you will change your mind about having later, cant). as far as your partner goes, tell eventually, after you the is you want continue a term relationship with. at that point, the on your chromosomes doesnt affect your ability (you upfront about that) doesnt affect you as a female, cares? want like thing about partner :3",relationships,False
1638,1212409,youcancallmecal,W,1212409,"> im right dont want make a mistake this big! honestly, the tone of your post reads as condescending patronizing. sounds less like lily is controlling mark, more like is make relationship top priority. thats of what happens in relationships. > dont want put friendship in trouble. thats exactly what youre doing if you continue talk out of marrying her. your is a grown man can make own decisions. respect that. hes your friend, hes happy, that should be enough you. eta: im as why youre dead-set against marks relationship, ask, is any chance you feelings him?",relationships,False
1639,1187045,Little_Lion,W,1187045,why you your being with a racist are many other people out without beliefs?,relationships,False
