,Unnamed: 0,op_id,op_gender,post_id,post_text,subreddit,op_gender_visible
734,1200471,Meatros,M,1200471,"sure arguing - *so got deal?* she thought they were, what, $50 tickets?",relationships,False
735,738597,Zomg_A_Chicken,M,738597,i recommend and accessories.,funny,False
736,752185,TheScamr,M,752185,"well, when nerf charisma happens.",funny,False
737,1190875,jsh1138,M,1190875,then? bf right to his feelings and do whatever she wants? what? just tell me and ill happy to address it right,relationships,False
738,747971,UnorthodoxViking,M,747971,i love it. show this?,funny,False
739,754921,GhostlyFireCunt,M,754921,"nightmare mode when youre childfree. they have kids, lie about their kids, want kids future, lie about wanting kids secretly hoping/assuming youll mind.",funny,False
740,730730,Neebat,M,730730,forgot eggbeater.,funny,False
741,726735,Reaperdude97,M,726735,hes color finder gotham needs...,funny,False
742,716838,ninety6days,M,716838,"single stupidest thing ever posted here, seeing justification for was racist actions side.",funny,False
743,731266,argv_minus_one,M,731266,"since youre apparently curious, my karma breakdown (> 100 karma) follows: | subreddit | | comment |----------|-----|----------- | politics | 0 | 9518 | fffffffuuuuuuuuuuuu | 3 | 9450 | | 0 | 6885 | worldnews | 0 | 6531 |news |9 |5953 |askreddit |0 |4508 |linux |0 |3171 |adviceanimals |0 |3116 |programming |-4 |3067 |pics |6 |3045 |wtf |7 |2977 |gaming |289 |2402 |todayilearned |0 |2297 |funny |0 |2113 |science |0 |2049 |offbeat |0 |1739 |trollxchromosomes |0 |1616 |childfree |0 |1581 |geek |4 |1448 |environment |0 |1301 |self |0 |1192 |skyrim |0 |1115 |fallout |0 |1068 |reddit.com |0 |1041 |tf2 |0 |843 |aww |0 |658 |gadgets |0 |436 |java |0 |431 |iama |0 |426 |wikipedia |0 |351 |firstworldanarchists |6 |267 |humor |0 |245 |fossworldproblems |0 |211 |steam |0 |205 |scifi |0 |145 |fnv |0 |144 |pcmasterrace |0 |141 |catpictures |0 |114 |scala |0 |101",funny,False
744,737722,oranjeeleven,M,737722,gif? gif?,funny,False
745,727135,Barsattacks,M,727135,ah thanks...i have random button...was all fun and until /r/nosleep...,funny,False
746,733470,Rikkushin,M,733470,>failure to use turn indicators living and ran because know,funny,False
747,1189077,dangertime,M,1189077,"i just said another comment, but rehearsal dinners usually fall to wedding. it unlikely op could call aunt and like, and my mom told to invite my because she wants my to secret. she come to wedding? creating drama right before (or day of?) wedding. ops like to feel hurt op attends her. skipping out wedding and dealing with mothers idiocy later date like compromise order to make long girlfriends feelings priority. aunt and cousin have important things to worry about confirmed guest doesnt show. edit: weird comment was agreed with but says thing nearing zero range.",relationships,False
748,742013,traizie,M,742013,"even count smartphone games, theres still ds and 3ds which blow gameboy out water",funny,False
749,735226,staffell,M,735226,but...thats exactly happening...,funny,False
750,1205133,arcxiii,M,1205133,"letting him sleep couch. he needs to sleep, he go to bed. he all shared spaces and make prisoner own home. to break habits letting him nap living room. he falling asleep ask him to go lay bedroom. talk to him and let him know something needs to before reach breaking point.",relationships,False
751,1206148,crazzynez,M,1206148,"haha i wish i could get bedroom apartment for price. 1200 at, long beach",relationships,False
752,1206162,ColbyStein,M,1206162,"milk, cash up, and store.",relationships,False
753,749907,wtmh,M,749907,only endowed actually gave *get out ugly free* card.,funny,False
754,721110,war3rd,M,721110,"i think tomato was actually poisoned, had it poisoned specifically to rat was eating tomatoes, and to defense thieves, changes. i people to steal my veggies my garden, and ever had. they do and die, i had zero intention harming them, else, even trespasser.",funny,False
755,744929,Nogginboink,M,744929,"damn, just described last week for me. you. (and hell, have upvote.)",funny,False
756,737692,CaptainSombrero,M,737692,"never heard it, and i highly parents do it...",funny,False
757,753887,ThexAntipop,M,753887,"show me rights reached front page,",funny,False
758,1200839,another30yovirgin,M,1200839,didnt see reddit!? /sarcasm,relationships,False
759,738555,iTeiresias,M,738555,her right boob much bigger her left one. professional shizzle would have shopped them to equal.,funny,False
760,759607,Rikkushin,M,759607,care why did go out to argue about it? why it diverse?,funny,False
761,1214165,swartt314,M,1214165,">the thing is, women pick up mindset. i see thrown around lot, but 100% sure how supposed to work. maybe thick, but never looked someone and thought, desperate. awkward, shy, nervous, sure, but getting mindset like mind reading to me. behaviors would indicate desperation to you?",relationships,False
762,745927,Psyladine,M,745927,still it judge was able to do those voices.,funny,False
763,1188690,JudgeWhoAllowsStuff,M,1188690,"i know i could someone through months depression, after dating them for year. i would human, bullet to dodged.",relationships,False
764,755941,Osiris32,M,755941,"coastie. thanks for do. up oregon, and guard for work they do our rugged and treacherous shores. semper paratus, indeed.",funny,False
765,760695,Kuonji,M,760695,carelessness malice. minimum.,funny,False
766,721141,masedizzle,M,721141,just little racist?,funny,False
767,752549,kingeryck,M,752549,"bond, bond",funny,False
768,731416,geetar_man,M,731416,"shut up, comment thief. home doesnt have that. aeno33 takes all reposts and reposts them. tag guy.",funny,False
769,1208244,NDaveT,M,1208244,and yet they didnt go to store to get their own. picky about thing. expecting hosts to cater to pickiness and complaining when they rude to extreme.,relationships,False
770,1215940,SCphotog,M,1215940,"we... others, crave and new. hes feeling hes becoming domesticated and life adventure hes had... even he didnt have... was there. with gone... all would have could haves he have planned single man, even with but child have gone away now. theres natural remorse that. sadness, i think normal. perfectly to love and child... gain happiness with do have simultaneously craving something different. mutually exclusive, i think appropriate phrase. ...and then theres future, weight and burden for folks. issue, there one, his to get it. do... and dont. counseling to start. even he doesnt go... it doesnt mean it, for even just session two.",relationships,False
771,1211765,nothrowaway4me,M,1211765,"behavior response to something happened life, do have nasty baggage childhood? address that. unhappy with life/city live in/current etc. address those issues. i to exactly like untill i realized my nastiness was just unhealthy expressing dissatisfaction with my living conditions.",relationships,False
772,726629,Danielcdo,M,726629,*football,funny,False
773,729435,LEGITIMATE_SOURCE,M,729435,washing my we speak,funny,False
774,1194631,Psimitry,M,1194631,seriously. i think would ever have thought son bitch! he planned his wedding ahead mine to upstage it! and hes going to steal our color scheme! bastard! only thought op have had was wedding 26 days before mine? sweet - open month.,relationships,False
775,1197469,Herdnerfer,M,1197469,"sometimes realize how something going to affect until it happens, she obviously didnt see how much sleeping with someone else would hurt her. she didnt like it, she doesnt want it anymore. so relationship it. (id go with ending it, like arent field)",relationships,False
776,737381,REDDIT_GOLD_SANTA,M,737381,geez :/,funny,False
777,726475,TheSharpestTool,M,726475,i literally fell back laughing and my my chair. jerk.,funny,False
778,743010,Silvaeri,M,743010,"spelled it wrong op it supposed to prix* fixe (i spell correctly either), which offered fixed price. basically applying to alcohol.",funny,False
779,727982,opoipo,M,727982,">alle killen! >killen >llen use vocabulary to skateboarding imbecile. german, i applaud, arent and happened plainly mistake, then i do applaud.",funny,False
780,1190251,snobord,M,1190251,did also lie to boyfriend about friend date?,relationships,False
781,717416,kane2742,M,717416,memes and catchphrases reddit always remind me small child mentally-challenged person who thinks hilarious to repeat thing and over. i understand how so people *not* annoyed (as shown upvotes things get).,funny,False
782,752409,Thaddel,M,752409,y-you have entire villages for people?,funny,False
783,717326,MEatRHIT,M,717326,"wondering they inheriting things to bmi. sure how inheritable personalities and traits are, things like willpower greatly how easy it to stick to diet/fitness plan. things like they up us v us similar. id also like to see adoptive parents bmi too and see there was statistically genetic parents bmi and adoptive parents bmi, then heritability kinda bunk one. i apologize for i had said before thread.",funny,False
784,1186532,jsh1138,M,1186532,"shes obviously sex to try to you, just like she was witholding sex to try to to do something didnt want to do single women with 4 kids would grateful just to have who didnt think was too much baggage. fact indicates she unrealistic view situation just speaking well. with counselor just underlines manipulative person who pushing situations advantageous to her, and lying to whole time i think divorce right move man. i know with kids and all but i think youre thing for you. soon divorce through take sil out to dinner. she sounds like only whole",relationships,False
785,734352,SouthernAirTemple,M,734352,theyre upset about their hats.,funny,False
786,1200028,predalienmack,M,1200028,"she offered to pay me back for drinks night, so i think i tell her her make difference.",relationships,False
787,729550,egnaro2007,M,729550,"almost... yellow and black rarely have chocolate, there to chocolate ancestry",funny,False
788,1192878,onafarawaybeach,M,1192878,extreme extroverts. just weird hermits.,relationships,False
789,753788,Foliagus,M,753788,"people do for anything though, guaranteed. about have random person commenting about it, guaranteed. ....are asking people to censor reddit because children reading it??",funny,False
790,719753,unbalanced_checkbook,M,719753,"all dublin and exported. i suppose it tastes fresh, but claims tell tests. edit: apparently i was wrong. it website misleading: > all guinness® sold uk, ireland and ireland historic st. jamess gate dublin.",funny,False
791,721332,Deksloc,M,721332,"like steak, tampons to marinated. *give them time.*",funny,False
792,737349,GtEnko,M,737349,and (blackbird),funny,False
793,719057,marburg,M,719057,i was wondering those went. i youre supplying them with syrup.,funny,False
794,1189983,elementality22,M,1189983,"gifts shouldnt expectations. it wouldve he got but shouldnt expecting it. did ask him to get something, did wanted anything, do know he actually doesnt have extra for much? he went to birthday dinner, spent time with and family birthday. i would him one. mad, but going to him getting something and anything he after fact going to up and feel like obligation thing.",relationships,False
795,730659,maxxramman,M,730659,"listen to rap, do",funny,False
796,718100,Ingenium21,M,718100,"after much googling, i have found single article mr. stating he said anything remotely like this. &#3232;\_&#3232;",funny,False
797,1215163,nowhereian,M,1215163,"assuming she her name. never okc, but have username there?",relationships,False
798,747901,GooglesYourShit,M,747901,"wow, it so realistic! just like my moms!",funny,False
799,736533,32OrtonEdge32dh,M,736533,"no, up with reruns. difference.",funny,False
800,743007,Silvaeri,M,743007,nomad?,funny,False
801,742329,BaconWrappedEnigma,M,742329,inferiority showing.,funny,False
802,758245,HBlight,M,758245,time. swim really wakes up when have had too many.,funny,False
803,723268,KingOCarrotFlowers,M,723268,"reminds me sketches friend mine did back: <link> there was also with winnie pooh, but i couldnt locate it...",funny,False
804,743950,wolf2600,M,743950,came to this. lulz.,funny,False
805,1204428,Anthony10298,M,1204428,it really hard for to tell when to make move. taking things step too quickly for her liking ruins early relationships. try want affection things holding his curling up next to him. help him get hint,relationships,False
806,719076,L0nd0nCa77in9,M,719076,sans makes it ok.,funny,False
807,742769,GAMEchief,M,742769,/r/retiredgif holy mother boob grab huh,funny,False
808,729905,thepulloutmethod,M,729905,hurdurr murcas hurrrr,funny,False
809,740153,Imalurkerwhocomments,M,740153,didnt actually sue for heimlich maneuver when they broke rib?,funny,False
810,738308,Secret_Wizard,M,738308,behold my robes? y / n,funny,False
811,758198,9DAN2,M,758198,"koon, r/mildlyracist",funny,False
812,1195671,AnonRedd1975,M,1195671,see my comment about depression. help seeing doctor to rule out treat depression.,relationships,False
813,739927,CrapInACan,M,739927,never go full retard,funny,False
814,749872,LoganPhyve,M,749872,grinder... kind metaphor,funny,False
815,729923,Osiris32,M,729923,i would happen he actually made bid for minister.,funny,False
816,724464,Jokersniper69,M,724464,we duck hunt texas...they have adapted,funny,False
817,718166,Solor,M,718166,"flak i think coming me incorrectly titling post, and users thinking i personally am generalizing entire towards women, which wasnt my intention.",funny,False
818,1185864,ta1901,M,1185864,> it to for taken to hang out with girl one? america. too tempted to do something with girl. and girls sometimes tempted to steal him too.,relationships,False
819,754077,TheGuyYouKnowThatGuy,M,754077,really though. how judge something havent had to evaluate it? theres and overpriced. high-level with wine for people could bucks. go to and get for $60. but meal. and 1-starring for low-price silly.,funny,False
820,738069,positron_potato,M,738069,> always death only 94 % everyone who ever lived died. i like those odds.,funny,False
821,741706,majinspy,M,741706,really michael reference. specifically to song black white. sorry!,funny,False
822,1197023,ezinc,M,1197023,id it still bullet dodged because much set stone and it only months. easy to walk away with emotional trauma. when have business/kids/houses/years tie together. right he just gtfo,relationships,False
823,1217296,_Woodrow_,M,1217296,"i guess? i know. i was just trying to describe to handle and clean up. my and i to do i clean thing, but after kids just turned each us working until everything done. who who what. i truthfully think to do it long have partner who carries their weight.",relationships,False
824,753419,3DGrunge,M,753419,basically ankle and body weights... people use them running.,funny,False
825,723788,HIFW_GIFs_React_,M,723788,/r/adviceanimals,funny,False
826,730233,heartosay,M,730233,":( me jelly. i posted elsewhere, -9.5 and -11.",funny,False
827,746456,WiiCat,M,746456,i got this.,funny,False
828,748532,Kolbykilla,M,748532,"she died pretty quickly after released to hawk, owl because domesticated birds have clue those animal do to them.",funny,False
829,737258,adamantjourney,M,737258,it? well... trolls to and good. we have guys. makes me sad 0/10 son lurk,funny,False
830,1194391,redlightsaber,M,1194391,">you absolutely assault someone with words attempting straw man? because i didnt it wasnt possible, just wasnt it. >for example, he raped me. accusation false, assault. words stress and upset, and knew it was actually, no. thatd libel. go get penal code and out. only verbal exchange assault **threat** (to physical integrity) done. things crimes, but coded law. so allow me to repeat myswlf once again: fact youre to **actual** rape (which even thing assault, but i just realised youve making progressive jumps) ridiculous, alarmist, hyperbolic, and much why whole thread so off-putting to me, realisation alarmism, ridiculous correctness, and oversensitivity have trumped sense. thing glad of, and my lies, i usually encounter sorts attitudes (at within my spheres), so id like to conclude people who want to so alarmed and offended aither live to me (im us and i undertand reddit is), restrict to life online.",relationships,False
831,733017,kingeryck,M,733017,then he mightve choked to death.,funny,False
832,746202,Wyboth,M,746202,">its for health, nope. >bad for insurance prices, see above. >and for others. why? >unless have medical which prevents fit problem. which people do, but doesnt people telling them to lazy. but medical problem.",funny,False
833,755777,DronedAgain,M,755777,laughed hard. ...,funny,False
834,740599,Dlrlcktd,M,740599,"damn, so rumors true.... complaining, t-track and enjoying free time.",funny,False
835,721236,Pucker_Pot,M,721236,it makes about women video. kind life do have to make to up shaking 6-year-olds face?,funny,False
836,729042,Quarkster,M,729042,"back blast would push it backwards. it caught out. edit: back blast would push tube back through drag jet passes through. because internal pressure acts to surface, and for tube all balanced (aside drag). rocket only pressure acting end, resulting pushing it forward. it moves, rocket pushes forward tube via contact friction. contact friction drag. i teach stuff. take criticisms to /r/askscience",funny,False
837,751483,BigBizzle151,M,751483,she steal lemons.,funny,False
838,760455,jlevy1126,M,760455,"100 and still cracking people up. right, it works in. make it to immortality.",funny,False
839,723188,seanrm,M,723188,"actually, i am college. so hah. summer job.",funny,False
840,750274,PussyWhistle,M,750274,"> particularly funny charismatic, ops always get downvoted comments. true. everyone op love op hate bandwagon.",funny,False
841,735750,Admiral_Cheese_Balls,M,735750,brendanwicz didnt help either. so glad he was chris and ben.,funny,False
842,744121,Psyladine,M,744121,"> policeman making over-wide left turn, and then proceeded to argue with him she had right way. lady like fighting vietcong. even with numbers and law/logic/arguments side, they just have to win. i wouldnt surprised cop just his and let her go.",funny,False
843,746859,lbutton,M,746859,"force... it was pure sword sword, sure.",funny,False
844,733324,Autocracy_Now,M,733324,theyre about it.,funny,False
845,723340,artacuno53,M,723340,this?,funny,False
846,1199558,ManicMuffin,M,1199558,i mean just assuming since she after days (is he getting paid monthly?) then he would to pay bills.,relationships,False
847,750070,OHMAIGOSH,M,750070,everyone with shift worker?,funny,False
848,738586,Mr_bananasham,M,738586,i laughed i,funny,False
849,748955,DrZurn,M,748955,makes me really uncomfortable.,funny,False
850,732966,smasters908,M,732966,something something axe something penis something,funny,False
851,736599,IAmABlasian,M,736599,i seriously love videos all time for me problem. :),funny,False
852,735674,DeadlySight,M,735674,"> up stable, never know addiction like. stable? my parents were divorced and i up with my alcoholic drug mom trailer. stable? managed to never use drugs my life, smoke, and drink rarely. surprisingly hard to decisions, up home otherwise.",funny,False
853,757367,emPtysp4ce,M,757367,cat.,funny,False
854,1190065,emptyhunter,M,1190065,">which makes him wrong, my opinion. explain. there rational justification for why so. remember, his did affair because he cheated. his did it her own accord. there hypocrisy here, but there small fling and conscious lasted 5 involving people closest to you.",relationships,False
855,734713,lookattheduck,M,734713,i do.,funny,False
856,724258,Tycolosis,M,724258,last sums up reddit well.,funny,False
857,1211344,2-4-decadienal5,M,1211344,"people have different needs. maybe his world, he wouldnt have asked to come to surgery and fact would have preferred werent there. so only to needs to talk about them. did make it clear to him really wanted him there? btw, talk to surgery *right now* about home. allow to do youve had anesthesia.",relationships,False
858,1199712,codayus,M,1199712,"okay, here. first and serious: **holy communication breakdown batman!** like, wife. youve got really important going and youre telling her stuff. threesomes whatever so important youre thinking breaking up, she to know. secret ultimatums *game playing*. with shit; open have together. second: to jumping around lot. like, she tried kissed guy, and was okay, but she also kissed girl, and okay, shes kissed girls before, and okay, want threesome, and she says shes okay with it, but shes really anything, she said shes okay with sleeping with people her, but youre okay with that, kind are, but then theres rumours work, so youre not, and i even know more. step back, breathe deep, and have now, and think about do to solve them. to snow white work, threesomes and sex parties for you. really really want life, which maybe careers? people talk; fact life. complain about caring about her reputation, but then freak about yours. only hypocritical, but pretty linked. her friends know, their husbands and boyfriends will, and then colleagues will. okay, then sex life you, private. it okay, freaking out about it. (edit: also, driven jealousy and maybe revenge, which super problematic well. thirteen in, and *now* want threesome? how much sexuality, and how much mad she doesnt kiss girls front you? sounds like latter, which doesnt mature to me.) ultimately, and to talk honestly, share how each feel about it, make concrete plans, break actionable steps, and then progress regularly. all secret squirrel about this. have sat and told her outright how important it it? have listened to her arugments? have *both* agreed yes, course to try initiating threesome with her friends? did she when she was going to do it? because it doesnt really like she ever knew was plan, and youre blaming her for following *your* plan didnt share with her. all. up dumping up with partners **thirteen years**, and it comes surprise to them (and it sounds like would), then **you** have fucked up my book. tl;dr: couples counselling.",relationships,False
859,744944,Ginger_Slayer,M,744944,tried. all we could ask for.,funny,False
860,718769,ctesibius,M,718769,"are, but there who have come directly to - ghana, gambia, nigeria and so on.",funny,False
861,732965,IgorsEpiskais,M,732965,"i figure out last sentence, it to there!",funny,False
862,731163,Highest_Koality,M,731163,jufy much time year smarch.,funny,False
863,734410,Xenophyophore,M,734410,&#3232;\_&#3232; sure got idea extra carcinogens. why cigarettes they smoked.,funny,False
864,744027,X019,M,744027,"i totally agree with you. crazy rapture idea new, but hold to it.",funny,False
865,757754,gmanz33,M,757754,to,funny,False
866,719810,WTFisBehindYou,M,719810,"how much population speaks english there? considering ditching out us for and exploring with my girlfriend. to learning german, id love to pick up another language but just never it. only ever taken latin which about un-german get :p",funny,False
867,741122,darksiderising,M,741122,"i realize and purely colorful use language, i thought it useful to someone to out vagina sphincter.",funny,False
868,1191338,crazyeddie123,M,1191338,">because he make her with it. fair. his mother exactly.shes his mother, his child; hes got control her op does. and op doesnt have to with it; op refuse to talk to woman, and should. bf could do would create viable relationship his mom and op.",relationships,False
869,751771,StrewwelChris,M,751771,i still hear it every time ring tone plays.,funny,False
870,743961,Iratus,M,743961,"depends who ask. half budists and half atheists would agree, rest wouldnt. yes, i out my anecdote-sprinkled ass.",funny,False
871,733409,xanros7,M,733409,heads up. it would greatly appreciated could make font bigger. just helpful advice! :),funny,False
872,723718,Zammin,M,723718,why would touch? never doppelganger!,funny,False
873,747571,login_2,M,747571,i truly fear things... but i despise life like dolls,funny,False
874,736812,Mostfunguy,M,736812,"saw dentist today, headline was weiner immense pressure",funny,False
875,735085,sweetafton,M,735085,3 *billion*? wow.,funny,False
876,732907,cobaltcollapse,M,732907,why?,funny,False
877,739708,DrDiarrhea,M,739708,would funnier picture was canadian.,funny,False
878,717065,Netcob,M,717065,"first time i watched, i didnt snoopy background...",funny,False
879,740775,ZhanchiMan,M,740775,how did those attacks?,funny,False
880,750164,TheBestNarcissist,M,750164,"dental student. remember we have to buy practice well, which 400k added on. investment, doubt, but it like 200k student loans. it just takes time to pay (so scary for while).",funny,False
881,718215,GAMEchief,M,718215,"pb&j always awesome, period.",funny,False
882,1214233,ProjectDirectory,M,1214233,"true, she control him and she shouldnt have control him. she she control and herself.",relationships,False
883,751967,zjaksn,M,751967,my pomeranian likes to sleep my so it like wearing davey crockett raccoon hat.,funny,False
884,731544,NCWV,M,731544,"> would make opinions credible. i to have opinion. > ill content laughing out loud myself when i fart maybe when reach adulthood, youll feel differently.",funny,False
885,719895,seek_0,M,719895,"azian -- up to stings. like you, i had my leg (well, foot, ankle, and calf) go numb -- you, it stayed for months. stings are, id take scorpion bee sting day.",funny,False
886,757446,youreallmeatanyway,M,757446,*there,funny,False
887,719036,Lazar_Taxon,M,719036,which witch?,funny,False
888,732244,hithazel,M,732244,"but youre reddit talking about how bmi test all wrong when applied to you, sure bodybuilder, but youre just overweight person who likes sophisticated excuses.",funny,False
889,722926,torknorggren,M,722926,waaay too much for shite.,funny,False
890,760871,mobius153,M,760871,> hijab* niqab* op correct.,funny,False
