,Unnamed: 0,op_id,op_gender,post_id,post_text,subreddit,op_gender_visible
1254,1204914,LyssaBrisby,W,1204914,"guess if theres nothing physical in the way... be that your relationship has shifted a more familial one? mean, sibling or parental familiarity is a death knell passion, young, the with is more of a comfort relationship than a sexual one. maybe the relationship has run its course its branch out; maybe its not a any more. thats sad, okay. alternatively, maybe this is something happening inside you, emotionally, that can bear some examination. do you respect him? admire him? of out in a crowd? finding ways see as a unique, strong, desirable can be something you do internally, as well as as a couple. travelling together, taking a class, doing something shake up the routine see as a stranger would: a catch. recommend writings by perel, specifically mating in captivity, a book about sustaining passion; if this is something specific you (rather than a sign of a genuine problem with this relationship), then its worthwhile address now, rather than repeating the pattern with other relationships.",relationships,False
1255,745511,nerdscallmegeek,W,745511,you say nothing related that paragraph in your comment replied then you call a cunt not knowing what happened in your relationship? really? if you dont want people making assumptions about your tactics then give the full story of bitches be dont wanna fuck amiright guys?!,funny,False
1256,1206716,Amberleaf29,W,1206716,"oooh, yes, im the same way! tourettes, no coprolalia. the kid should be by now if can suppress or turn into other tics, honestly, at 12 doubt cares much about the actual anyway, if wants can probably figure out what do that hes not a disruption. doubt wants be loud either, by now hes probably figured out ways deal. op will talk the about it.",relationships,False
1257,1196354,nkdeck07,W,1196354,"ah, thats a problem one that can be fixed. you cant not feelings you can certainly a specific of support on your own. what do you mean by take care of feelings? if you can put that into words its a lot easier take that specific action.",relationships,False
1258,718658,duglock,W,718658,sure. a christian say that. you must be one of the smartest people ever met.,funny,False
1259,1213887,sorc,W,1213887,"> cant bear being with a controlling, manipulative, cheating liar. ok, say is not cheating, seems be on about that anyway, lets say is that leaves you with a >controlling, manipulative wife. - do you want that? your marriage sounds like is in way deeper trouble than a test saying hsv1 fix. as whose are divorced: if you do not make a shit show out of that is on the parents, thats the thing you owe your kids, having divorced or going through your divorce is not that bad by all means better than like the reason that two people stay in a toxic relationship. please consider this, staying the is a idea.",relationships,False
1260,1189414,RedInHeadandBed,W,1189414,sounds selfish. wants this threesome be about you else ruins him. sounds like you should stick your guns about this. cant say more than that. good luck!,relationships,False
1261,1184478,TheRosesAndGuns,W,1184478,"you do the wrong thing. hes looking at porn no matter much says that doesnt any urges kids, quite obviously does or wouldnt look. also, you let destroy the hard drive, the form of evidence you that hes been looking at being raped/sexually abused groomed. hes been seek out images/videos like this not a quick look, them. downloaded keep on a hard drive. im not be harsh, apart from the usual response, why the fuck you leave? you want with him? watches being abused, that is not a safe environment be in.",relationships,False
1262,1196058,selfishstars,W,1196058,">your method of control is relevant here im actually that more people arent bringing this up. that knowing what happened with regards control is relevant what advice id give, its shady that op is refusing address it. while im not going accuse op of lying about being an accident, theres a big difference between control failing (in case, ops reaction is pretty unacceptable. should realize that no control method is 100% this happen), if engage in a type of control that isnt very effective is irresponsible if dont want (e.g. if all theyre using is the pull-out method or rhythm method, again, this mean that ops is acting unreasonably), or if op off control or changed control method whatever reason without keeping in the loop (in case, id be much more empathetic reaction. if wasnt intentionally get pregnant, hes entitled be with keeping that of from him).",relationships,False
1263,1204375,rubiscoisrad,W,1204375,yep. dragging trash out the curb doing dishes such. poor gal.,relationships,False
1264,1201023,pamplemouss,W,1201023,do you at least off the diet youre out of the house?,relationships,False
1265,1189058,PotatoMuffinMafia,W,1189058,about journaling. being that question a defining moment me.,relationships,False
1266,721868,devenant,W,721868,thats where op looks dates.,funny,False
1267,1209943,punkpixz,W,1209943,"im steph what heard. only, bet the merely talking about gets a new end up spending a heck of a lot less with comes close that can be hard them. though is entirely possible the thinks that jen does feelings you friendship or that jen does actually them. that being this issue comes from insecurity jealousy on stephs part. the way this is going resolve itself is that either work in issues or you give into demands. on a note, intentionally omitting something you will probably cause a problem, like you being invited listen a band by jen going....that is lying. get why you it, by doing you shot yourself in the foot seem like you are hiding something from your girlfriend--which is probably making that lack of trust insecurity has worse.",relationships,False
1268,728111,adamandatium,W,728111,"its huge. yeah, helps out box.",funny,False
1269,1197430,littlelibertine,W,1197430,"thats fine, as whos been in a bdsm relationship, its not cool do that without your partners consent. dom/sub relationships are intense if theyre nonsexual are certainly emotional. its a special of relationship that will make a lot of partners uncomfortable, is entitled tell its a deal-breaker.",relationships,False
1270,754597,beckoning_cat,W,754597,3rd rock is hysterical. like somehow work real life conundrums into slapstick.,funny,False
1271,724667,awkward_peach,W,724667,"well in your defense, stick arms are really... stick like.",funny,False
1272,1208171,goatismycopilot,W,1208171,about why you quit your job connect yourself a man gets serious about in your words basically any responsibility.,relationships,False
1273,742416,Thestolenone,W,742416,"a that marked one of grandchildren across forehead, a sort of right of passage or baptism. once wasnt normally a scratchy type of cat.",funny,False
1274,1189946,HereComesBadNews,W,1189946,"> dont understand can a relationship with knowing that protected him... hes and, stupid as sounds, some people from family, if theyre abusive or worthless. not everybody, of course; ive known plenty of people abusive families, left, back. others like theres something missing without that relationship. from what youve me, hes not going get approval...and arent worth it. hes probably going need some realize that are not going give the affection appreciation desires.",relationships,False
1275,756348,abisiden,W,756348,israel isnt islamic...,funny,False
1276,1206116,Cejarrood,W,1206116,"you can be friends, you need find yourselves alone. thats not what you want hear, the best thing do you is no contact a couple of months. is going hurt, yes. prolonging dragging out will much more. at the end of two months, you should a better idea of you are what youre capable of. then, if works out, you can rebuild a friendship. will work if you no contact. no texting, no calling, no mutual about other. focus on yourselves, not on other. rebuild your world without the other in it. be alone support the other. again, thats not what you want hear, ill be if you actually take advice. its generally the best most mature thing do getting out of long-term relationships, no matter amicable the break-up.",relationships,False
1277,732602,bannana,W,732602,"ok, explain the miley me, do or say something stupid or do people not like new look? or is the sport du jour?",funny,False
1278,1189225,Nievvein,W,1189225,"well... has own decision, your relatives maybe your grandmother, has pushed into religion? why not explain that you dont believe in a god why you dont. well, maybe not why, or maybe dont in depth hes 5. dont be answer let its a decision can make himself.",relationships,False
1279,733258,Moxiecontin,W,733258,"moxies a new england of thing, ive seen anywhere else. live in virginia, its of a in the ass get, delicious. dont pay attention the kardashians! remember, kim pariss famous, copied paris then the level. also, the kardashian kollection of at sears is crappy, cannot forgive that spelling. refused a in life.",funny,False
1280,1194734,tillwehavefaces,W,1194734,the real problem here is that dont invite you hes with that. that be the problem me.,relationships,False
1281,747399,AnyelevNokova,W,747399,"can confirm: ive the cops about a noise violation, told, sorry, more important things do. explain that id over in-person, as as knocked the guys inside yelling about finding guns. so... yeah... im at 2 holding a toddler, the guys whom im tell please shut the fuck up are about stoned are locate weapons. the cops give a crap. unless directly threatened with violence, witnessed violence, or witnessed drug use, want come. usually no issues with the police; seems that this particular call is the one grind over.",funny,False
1282,1202091,smashes2ashes,W,1202091,a threesome with two chicks is not at all enjoyable doing girlfriend. yep thats the case. /s,relationships,False
1283,1185978,acetrainerjames,W,1185978,becoming financially independent is the most important thing you can do now. if your disown you then youll need support yourself. assume you wouldnt be get a job without your finding out. if you can manage that then you can tell your mind own business.,relationships,False
1284,1208142,we_got_caught,W,1208142,"what should do if are in close proximity, work together? do the same job is often in area. should ignore her? dont her, dont want perpetuate this drama any further, nor do want grovel take as a friend.",relationships,False
1285,1186361,okctoss,W,1186361,"sounds like hes bully you into staying with him. needs respect your choices, the fuck out, give you time. if wants force the relationship continue per usual, thats what *he* wants (you want out. needs shut up respect that), hes being a self-centered asshole.",relationships,False
1286,1194091,AgentKittyfeets,W,1194091,"no problem. hope things get better you, though!",relationships,False
1287,733432,YELLING_IN_YOUR_HEAD,W,733432,ive a blender,funny,False
1288,1204369,so_just_here,W,1204369,"> why sorry, get the timeline right response holds in that realises that is a bad idea & backed off. almost ends well op. let this go.",relationships,False
1289,740052,lifeunfolding,W,740052,ivgt short.,funny,False
1290,1214132,whenifeellikeit,W,1214132,"the disease model is very problematic about this, aa focuses heavily on the disease model. u/deseretrain very well. having rely upon a higher power control (and theyd prefer be god, the majority of the successfully recovering addicts in the program end up believing in god rather than finding some other higher power), believing that one is cured of that one single drop will a into a bender, the requirement attend meetings forever, generally multiple times per week, stay sober by proselytizing (sponsoring) others are all ways that personal accountability are downplayed. participants naturally do not want blame themselves failings, while are some genetic factors at play in addiction, are in a number of other preventable conditions. im many people relief, point is that are better ways, that dont encourage people attend daily or more meetings in achieve sobriety.",relationships,False
1291,744878,Laurasaur28,W,744878,"inherited a genetic condition where dont the two on either of front teeth. after out, with holes in mouth. teased mercilessly at school put fake on the braces. beautiful, though in middle school going through the stage. after many years of a retainer, worked fake teeth. less than take out ate, thus making the holes visible again. began covering not speak if possible. the with semester of college. somehow scraped enough money implants wouldnt be with the forever. the surgeon a russian guy named vlad (im not joking) in an dangerous area. the very well, experienced pain, clad wasnt at all. a while gums heal, the crowns look pretty good. not great, pretty good a budget surgery. flash forward a few months ago, a new dentist. hes a professor at ucla hed be awesome. im hes very smart, spent the dont look good enough. implants yellow should been chemically whitened the surgery. well, fuck you, dude. afforded that. looks fine. im what have.",funny,False
1292,1197794,miope,W,1197794,you can the alone with support or you can stay with your boyfriend. seems that are the choices youd now. yourself what you want,relationships,False
1293,1186599,thenameisdezzy,W,1186599,tell you feel. dont stay with if you want mess around in college,relationships,False
1294,717423,handygrl90,W,717423,wont load me.,funny,False
1295,1207566,ivythepug,W,1207566,"finding a job, say, be a priority. so, if possible, maybe drive from interviews if the bus system isnt handle it. look over resume, perhaps do a fake interview prepare it. can you lend some interview appropriate clothing? this is assuming doesnt any. say dont find the jobs apply to, though, as you want be independent. where is your currently staying? at a shelter? do provide her? she, realistically, prepare work/an interview properly? think, ideally, if your can prove that has matured can keep a job, your might want look at allowing live with paying a flat fee rent/food/etc. if theyre with this. itll keep responsible, give the opportunity save up money or perhaps switch doing a part job while continuing education. set up rules that follow (must a job, no drugs, has do x chore, etc). edit: you you pets. like, dogs? do need walks? do you trust enough pay a small fee walking your pets? edit 2: dont forget about being supportive emotionally! can be hard be supportive in situations like this (ive been with older do nothing bitch out past actions), be meaningful your youre proud of something better herself.",relationships,False
1296,1183722,CalamityJaneDoe,W,1183722,"you say get married, what are you proposing? are you saying, hey, this means a lot spend $50 at city hall? or are you saying, this means a lot want an engagement ring a with all of involved a 300 guest list that will take a year this sound mean on part im sorry that, im looking context, why is this important? youre 25.",relationships,False
1297,1187343,Eldarn,W,1187343,dont anyone here wrong? as hell,relationships,False
1298,1218074,nylajx,W,1218074,ever you join goes or any plans introduce you come?,relationships,False
1299,1204542,karachimqm,W,1204542,">side note: this is the muslim man ive dated, is common a muslim man seems serious about religion (praying 6 times a day, fasting ramadan, memorizing quran verses) against religion- by having sex, example? muslim here. pray 5 times a not 6.islam allows muslim men marry jewish women.do you meet parents?many times muslim break up with partner are nit brave enough against wishes",relationships,False
1300,1186239,Crazee108,W,1186239,"> has some serious moral obligation call the cops on own girlfriend in these situations also, avoid possible accidents. cause shes not a danger herself, other people on the road! knowing *that* alone, id drive. =/",relationships,False
1301,1194397,waffletoast,W,1194397,> get tempted cheat all the thats a problem. will you cheat on your wife? you cant get if you legitimately its a realistic future.,relationships,False
1302,1183808,japaneseknotweed,W,1183808,"hes uptight? about control holds a premature 1 old baby, be of wedding? huh.",relationships,False
1303,1214152,BeckyDaTechie,W,1214152,"will say this much: a drunk. hes a drunk. not moving a town get the hint that dont want be part of alcohol cycle. if you leave, lay plans get *away* not out of your place, dont leaving those plans are concrete. in the mean time, if starts like youre distancing, unstable people will turn a scare (or baby) keep control of the that lets keep drinking, then youre on the hook 18+ years. be careful.",relationships,False
1304,1205115,Jilltro,W,1205115,"this exactly what going say. youre attracted as a whole, look you despite all the wrinkles, gray or missing hair, etc.",relationships,False
1305,1188896,micheesie,W,1188896,">and a poster over on srs boot god. will stop listening you now. no, 18 is considered where live.",relationships,False
1306,1197644,meanttolive,W,1197644,"see that you deeply care about you want get the rightly deserves. do you see where shes from, too? sucks be in a position where you want help, you see a clear answer, seems like your partner is refusing the right choice. what you consider be the right choice, what considers the right choice, are different. im not going if youve ever survived a sexual assault; will tell you that many survivors ways of dealing with it. 14, some douchebag away control of own by fingering without consent. now as an adult, shes reclaim ownership of own by dealing with thinks is best. its difficult you see in this im you you support no matter what, you need *show* you support by not make see your point.",relationships,False
1307,1195476,OneTwoWee000,W,1195476,"thats not the point. isnt house, do not get dictate rules the owners! the gf the pay a hotel pull this power play bullshit.",relationships,False
1308,745714,memento_vivere23,W,745714,"the classy thing do be burn all photo/video evidence of your that makes you look trashy. remember this works? what is trashy is whats important your opinions explanations dont matter because, like, opinions are the that matter. duh.",funny,False
1309,1202562,saltedcaramelsauce,W,1202562,"you will almost certainly not follow this advice, here is: break up with now. is no working through this. find with enough character wont cheat on you. youre 23. are plenty of non-cheating guys out there. one of those.",relationships,False
1310,755014,ibbity,W,755014,actual paul revere significantly less foxy than this might indicate,funny,False
1311,734348,4rt3mis,W,734348,"you that be something at some point. hey by the way jr, you the mrs. are a kid - the kid is born hell look thats normal.",funny,False
1312,742302,lizit,W,742302,"its bad about the work you create else, if theyre being do it. while you shouldnt *have* bad, its a good sign of empathy others, the idea of leaving out a brighten some is surely a nice outcome! :)",funny,False
1313,758960,fifthchevron,W,758960,on snapchat dude: [send pic of self with underwear on] me: [no response] dude: wanna see it? me: no dude: [sends dick pic anyway] me: no?? dude: ok. wtf????,funny,False
1314,1198756,lila_liechtenstein,W,1198756,"your draws doesnt like or is - you blame *her* this??? wow. you need support stand up her, not tolerate your being disrespectful. your fiancé is not being childish if doesnt suck up people openly her. you are being very illoyal.",relationships,False
1315,1199901,No-I-Do-Not,W,1199901,"compromise on kids, needs be with wants you need be with doesnt. youre right youre not this relationship may not be worth anymore.",relationships,False
1316,1197698,rifrif,W,1197698,moved... the best thing put in a new school make friends. not known anyone else if or homeschooled me. why not out the public school first? a try! great talk new trusted a teenager.,relationships,False
1317,752351,clockworkgirl21,W,752351,that sign forced on a roller coaster.,funny,False
1318,1194138,AgentKittyfeets,W,1194138,"ive thats the toughest times, theyre dependant on you. youve a good outlook!",relationships,False
1319,1198513,No-I-Do-Not,W,1198513,"one, control or not, stop using condoms. youve been 4 months. keep on with the condoms. if this hurts you much, youre going confront her.",relationships,False
1320,1190186,okctoss,W,1190186,">but the most part dont enjoys parenting the way do, parenting will be imbalanced that reason -- do it, does has to. dont should be imbalanced that reason. frankly, dont matters why either of you parent - the sake of child, its important that you do, equally, period. >i dont solves if make a point of going out does keep score do. needs learn that you work, you need friends, you parent. one parent has sacrifice the other can out, that ought be equal. will, suspect, be more egalitarian about leaving you is forced understand that comes with the price of being alone parent an equal amount.",relationships,False
1321,1192758,Jangetta,W,1192758,"as a whose with a dead mother, sorry your at not seeing the joy this them.",relationships,False
1322,742440,dripdroponmytiptop,W,742440,"if guilt, id be moaning about why get a history month, or im discriminated against, etc. do you what guilt is?",funny,False
1323,732757,Snugglebuggle,W,732757,thats what that...i want one of these its expensive.,funny,False
1324,1208224,Jilltro,W,1208224,really? no idea doesnt affect your credit elsewhere.,relationships,False
1325,1192751,okctoss,W,1192751,let clarify: you dated two years are not you feel. that is wasting time.,relationships,False
1326,747490,that-writer-kid,W,747490,"solidarity, trans-guy-friend. im youre awesome.",funny,False
1327,1217525,nicqui,W,1217525,"open your say you need take the with you or board them, **i not them.**",relationships,False
1328,1202251,pillboxhat,W,1202251,"what dont you understand? can you not understand that get is then actually being pregnant. not enjoys something spreading its organs out, taking up space in belly etc.,",relationships,False
1329,1197774,OneTwoWee000,W,1197774,"> heres a negative example of what might actually be on the you, one that has turned upon here from time. your new your wife are of a mind that this is going be a threesome without you being present, or that carla has no intention of sleeping with you with jane karl while youre as a 4th (is that possible?) wheel. or what if karl jane all the intercourse carla or karl are with you *kissing* carla? you cheated if you dont get a full swap? op, these are things consider.",relationships,False
1330,1212845,whoop_there_she_is,W,1212845,"okay, a lot is not going solve your problems. its clear that you care, why does that matter you arent being a good through your actions? im sorry dude, getting being forgetful are not good excuses being shitty. make seem like you dont care, like you arent willing put the effort in. relationships take serious *effort*, that involves going *out of your way* *consistently* prove that you this respect her. that means- yes!- initiating conversation regularly responding within a reasonable amount of time. that means making plans following through, taking (whether you pay or does is up you guys), activities events, buying flowers, texting youre reminded of or you want show you care. means being a 100% devoted partner, showing it, forever. if youre not capable of that, youre not a relationship. are you mature enough do all that more?",relationships,False
1331,719894,bebeschtroumph,W,719894,"having a bad a few years ago, the starbucks nearby used the of money get a frappichino. put in the holder a second, start about slam on the brakes some soccer (with in the car) pulled in front of with out looking. spilled all over car, of weeks.",funny,False
1332,1206018,redshelle,W,1206018,wasnt insinuate that you being manipulative. explain that you cant expect do what you want you say that whatever is is important you. you should express something is very important you. advise you not expect agree with what you want whenever you make that statement. you start having that expectation is becomes manipulative.,relationships,False
1333,1193571,AgentKittyfeets,W,1193571,"exactly. not all battles need that of reaction. gone why do you that? that makes uncomfortable, do you mind deleting it, please? (though the humor of laughing going delete that you can recreate with me! its all about you see things, you react them. imagine later on, wants a kid, you dont? what happens then? or vice versa? the small battles show a slice of what will happen in the big ones.)",relationships,False
1334,1214844,nicqui,W,1214844,"attempt clean, lol, thats why the passenger seat clear. thats what considers presentable... you can down.",relationships,False
1335,1194922,Splinter1591,W,1194922,part of being a is being comunicate people if cant/dont do,relationships,False
1336,750372,msobelle,W,750372,its a new motivational poster teamwork.,funny,False
1337,1206636,kweryful,W,1206636,"you be willing let be the sole money handler in your relationship? shed all the decision-making authority in saving, 401ks, paying debts, paying bills, where live, what cars buy/sell, vacations, veto power on jobs, sole authority on all your accounts. you pay your paycheck, give you a monthly allowance. frankly, sounds a lot more financially stable than you.",relationships,False
1338,1187212,InfernalWedgie,W,1187212,"do you the of hang out with you, maybe get sometime (i.e., can you on a date?)?",relationships,False
1339,1189199,dewprisms,W,1189199,bigamy is morally wrong if all are not consenting.,relationships,False
1340,751942,glitzyjan,W,751942,guess its better than a dick.,funny,False
