,Unnamed: 0,op_id,op_gender,post_id,post_text,subreddit,op_gender_visible
0,1200978,MexicanSpaceProgram,M,1200978,"it really comes to circumstances which broke up and relationship (if any) afterwards. had exes things ended with, after time had passed - my so and i went to ones wedding ago. >have dating magnificent and beautiful girl i could have ever asked for. so, youre happy now. who gives ex who shes it with? happy with youve got and move - sounds like she has. > ex dating friend/ co-worker. never understood why for people. jesus, ex - who gives shit, and yours? parted terms, i all to them. not, then to bloke.",relationships,False
1,747542,urmyheartBeatStopR,M,747542,"s.korea, japan, & have tons boy bands. i think direction boy band. so i they theyve disappeared? i think much english countries and them asia.",funny,False
2,721771,MadHatter69,M,721771,those eyes.,funny,False
3,727114,on_the_redpill,M,727114,shades (its my fault maximum),funny,False
4,737662,oranjeeleven,M,737662,nope.,funny,False
5,1184758,FrenchFuck,M,1184758,whenever he comes back sleep with him. friends with benefits!,relationships,False
6,725685,Sw1tch0,M,725685,"those people ignorant. and i am blaming women for this. evolutions fault. it dictated men for physical woman order to determine she was fit to mother. today, pointless with medicine and practices. however, men aesthetic driven, women respond appropriately, and they looks. their fault, but doesnt take away fact to worldly woman. and then when actually one, they usually radiate beauty.",funny,False
7,739784,Flynn58,M,739784,song ice and fire and dress description ever made.,funny,False
8,1192001,colakoala200,M,1192001,"> to him quarter to call somene who gives fuck. line getting dated. too bad, i always kinda liked it. :)",relationships,False
9,744611,roadhand,M,744611,i wear 13e and always work it when shoe size comes up. ... and know with feet ... let it hang air for moment they make face. then slowly: socks.,funny,False
10,738271,thebravelittlenublet,M,738271,"do serve/sell liquor. canada, least, everyone id-ed when buying liquor.",funny,False
11,757678,Muffinizer1,M,757678,i legitimately (not sarcastically) have phobia salad dressing. though genuinely disgusts me.,funny,False
12,759449,AlexHidanBR,M,759449,i he habit to pay for everything and she doesnt like it. i think girls like it too,funny,False
13,758862,high_side,M,758862,"rocket exactly, retired equipment, unable to reach mars... dammit op, laughing hurts my soul.",funny,False
14,739016,NWVoS,M,739016,"even though she with school, she still face charges authority to have sex with them, which constitute rape person age 18.",funny,False
15,759447,i_forget_my_userids,M,759447,have handled anything besides $1 notes last decade?,funny,False
16,759680,Vall3y,M,759680,how programmers see costumers,funny,False
17,749360,Hungry_Lion,M,749360,theyre both vampires obviously.,funny,False
18,722166,syscofresh,M,722166,*program jesus christ...,funny,False
19,725718,kittenlover27,M,725718,"mcondalds manager/employee ever one. in-fact 2 minutes i took to wrote i wasnt sitting trying to think anology to use. i disagreement with me fact paterno and sandusky held importance life minimum wage employee their played often others, their actions have bigger society. i agree to to certain extent. direction i was tryign to go with i care too much about athletics, so paterno and sandusky with anyone, i still think them way. sandusky for raping, paterno for hididing evidence. also, i get annoyed hearing repeatedly. there horrible things going around world, and amazing things going around world. i think time stories, and time stories like this. about victims. i feel sorry for them what. and they have hard time they never hear about news, they hear it every day.",funny,False
20,733629,IroN_MiKe,M,733629,itt: people thinking they because they like douglas adams.,funny,False
21,727325,Viend,M,727325,y u karma,funny,False
22,761028,jezus317410,M,761028,"still do, tho they to lil days. only week 2 until get it now.",funny,False
23,748299,aHarmacist,M,748299,could speaker output modified? i buy prius and make it like tie fighter?,funny,False
24,746720,browman25,M,746720,i had full tank prior?,funny,False
25,757715,kingeryck,M,757715,wheres shaking her saying i told you..?,funny,False
26,755765,dietbroccoli,M,755765,it safe to assume still are?,funny,False
27,1186854,elementality22,M,1186854,"i have and lesbian friends and their complaints when it comes to dating all people wanting to experiment. they want to date them, they just want to use them to scratch itch and then done. know feelings for maybe someone else to try out with. it with him just complicate things, he even agrees to it, and friendship. have to tell him trying out men, sex life and elses business. maybe just talk to him about feelings and sexuality and see it there, him for sex to see like it not, maybe have for good, clean for first time, maybe offer to help out himself.",relationships,False
28,716815,jaxspider,M,716815,imagine kind achievement youd unlock?,funny,False
29,741373,NillaThunda,M,741373,all i could think was kevin,funny,False
30,760997,londongarbageman,M,760997,japan?! do they games?,funny,False
31,753810,IVIaskerade,M,753810,it for phase two.,funny,False
32,736920,I_smell_awesome,M,736920,seeking info also check here: title | points | age | /r/ | comnts :--|:--|:--|:--|:-- a)easy b)fashion c)unfortunate | 334 | 4^mos | wtf | 59 wild clubbin night ^**b** | 1855 | 5^mos | wtf | 216 fashion? | 76 | 2^mos | funny | 24 moments captured supermarkets really crack me up. | 60 | 5^mos | funny | 23 potty-time pants ^**b** | -1 | 1^mo | pics | 5 thing now? | 1669 | 2^mos | wtf | 683 bar. her dance card full. | 2 | 2^mos | funny | 10,funny,False
33,716448,LieutenantClone,M,716448,i think she targeting wrong audience. she?,funny,False
34,732456,igloo27,M,732456,"my really and it get all down, but i still ejaculate during sex?",funny,False
35,727942,HIFW_GIFs_React_,M,727942,"yup. title | comnts | points | age | /r/ :--|:--|:--|:--|:-- eat vegetables! | 3^coms | 10^pts | 20^dys | wtf we all know girl who likes horses little too much. | 15^coms | 243^pts | 3^mos | wtf after photoshopping this, i wondered i have with my life. | 503^coms | 1688^pts | 1^yr | wtf my favorite face swap | 16^coms | 196^pts | 1^mo | funny sure repost, but wtf face swaps seen. | 74^coms | 1153^pts | 4^mos | wtf terrifying faceswap [x-post r/funny] | 8^coms | 198^pts | 7^dys | wtf awkwardly arousing? | 2^coms | -1^pt | 1^mo | wtf *source: karmadecay*",funny,False
36,739063,zzyyxxqq,M,739063,"how intellectual someone is, about how jokes are. i think even smartest people would call shitty.",funny,False
37,749087,voxpupil,M,749087,she to mao?,funny,False
38,747109,tyrayhern,M,747109,was it?,funny,False
39,1186940,ed_lv,M,1186940,"wanna do it way, create g-mail account, and send him necessary evidence. i see how he trace to anonymous g-mail account.",relationships,False
40,1207118,blackrat47,M,1207118,"details paranoid. but because mollycoddled society. fact he he criminal. armed criminal. us, non-criminals own unsecured guns. uk, literally possible. found out someone were dating had well-used guillotine their basement, pretty sure youd happy either.",relationships,False
41,1188915,RatioFitness,M,1188915,shes given me blowjobs before. buts maybe 1 year (not necessarily my birthday).,relationships,False
42,730461,macallen,M,730461,"lol, i enjoy artist. they drew that, theyll too :)",funny,False
43,739315,5n1p3rhaa,M,739315,"windows vista 4 was funny fuck. i love moss (no homo), show definitely come back.",funny,False
44,1201326,doublehyphen,M,1201326,i was her i would just report card lost card (important: lost _after_ last purchase made with it to suspicion fraud) and take $120 loss person owing me pay up. i have lost card having to file report so i know it to do sweden. edit: could just also explain to bank. i do think they would care much.,relationships,False
45,754626,poly_atheist,M,754626,we hire minorities so we have to worry about it hostile environment.,funny,False
46,1214945,Nutrientpolecat,M,1214945,*man* dating highschool nutty. do go to school with girl?,relationships,False
47,760223,Thrawn4191,M,760223,"i figured i would go back to beginning our little adventure to thank you, was fun.",funny,False
48,1192381,Hexaceton,M,1192381,"> i theyre going to hooking up. why always scenario, downvoting argue with op and oh well, (s)hes dick, him/her and move eventhough i would feel comfortable all with situation, get me wrong, but i really think they going to reproduce like rabbits something. legit, and those friends i see why there would problem. plus: i know they live, but i reckon equally hard to affordable and apartments everywhere. found apartment and already (a week before move in) signed contract, *not* go lookout for flat, because trust issues. feel free to downvote, but explain why.",relationships,False
49,720065,Popcom,M,720065,"someone jw, i call",funny,False
50,749411,wavecycle,M,749411,american?,funny,False
51,1193515,HodorASecond,M,1193515,"* she had wine, but come on. yeah, pretty much. she really adventurous, she have mental issue? i mean, there to just.... there. * (my mom) would talk about her loose behaviors. mom going to schooling *adult* partner? tell me doesnt explode, because it sounds like righteously *horrible* idea. * she apologized profusely... so... problem? why did she do it? how could information even *remotely* appropriate? grown up talk. wants to know about her her ex canyon, but apparently shes proud. * did i just miss something during my whole relationship? tell us about her adventurous side. she adventurous, naive, something right?",relationships,False
52,739159,SleepyCommuter,M,739159,plot twist: op male.,funny,False
53,1188646,olov244,M,1188646,"bf doesnt sensitive enough for you. doesnt privacy past, his friends and family and he doesnt to stick up for you. i would have sitdown with him to see how he really and he willing to stick up for to his friends/family, not, i wouldnt stay with him",relationships,False
54,752938,dutchguy94,M,752938,jumbo...?!?,funny,False
55,755821,kellykebab,M,755821,"pretty narrow, uncharitable view heroism.",funny,False
56,742743,subcypher,M,742743,shh... shh... shhhhhhhhhh...,funny,False
57,756882,RandomRageNet,M,756882,and i have different definitions clearly,funny,False
58,752802,from_dust,M,752802,"inb4 discussion columbus discovery america, his racism, and lackluster qualities.",funny,False
59,721483,Kelsig,M,721483,"bisexual, but yeah.",funny,False
60,716955,DJBJ,M,716955,he did.,funny,False
61,716867,starphish,M,716867,called faster internet. i had problems.,funny,False
62,745352,xtphr,M,745352,and 10-20 minute massage do wonders for right up.,funny,False
63,742405,lord_voldything,M,742405,i am 30 old. and scared bejesus out me.,funny,False
64,1213662,psimwork,M,1213662,"wait - understanding - wanting boyfriend? friends? because attractiveness shouldnt youre just seeking friendship (though honestly, seeking out specifically gender for friendship raise eyebrow).",relationships,False
65,739192,chuckymartinez58,M,739192,forget our beloved aunt. [1:02],funny,False
66,755815,EvanHarper,M,755815,insufferable tbh,funny,False
67,1214971,PurplePlurple,M,1214971,"yea... couldnt try to distance have right here. youre making justifications and excuses for behavior. youre 19, i get it, but own op. i have faith repeat offender, but got growing, and resolve, to achieve to make reality.",relationships,False
68,1198929,LeMachina,M,1198929,"glad like it :) kinda weird, like me sometimes i suppose haha",relationships,False
69,728969,Con_Carne,M,728969,i miss show,funny,False
70,738929,csreid,M,738929,scared. out just gains putting to sleep so they move peacefully. they wanna surprise you.,funny,False
71,724832,gerusz,M,724832,they with strong laxatives.,funny,False
72,760668,issius,M,760668,"never stopped me before. doors for opening, ill go through i please.",funny,False
73,759078,Quarkster,M,759078,yes <link>,funny,False
74,1211930,PurplePlurple,M,1211930,"all i is, i didnt get married treating my like and i did she would *pissed*. emotional and inappropriate to treat someone like shit. again, young adults, i am exactly surprised to see someone his age like such ass, but doesnt mean waranted. he doesnt feel sorry for treating and thinks appropriate, i would reevaluating relationship. me. i understand he frustrated, but his unforgiving attitude only makes and frustrates well, more. hes hes gonna really up acting douchcanoe kid longer. up to how long tolerate - change, he makes it happen do.",relationships,False
75,725917,Psythik,M,725917,"estimation, id *much* closer to 15000x",funny,False
76,1204474,whatswhat61,M,1204474,"patterns arent hard to recognize. healthy, normally functioning 20 year and 52 year completely different life stages and have and little room for attraction. just because society created age consent doesnt mean inherent strangeness and imbalance age-gap magically go away when person turns 18. people involved such relationships often have observable underlying problems, enough recognizable trend. op himself basically admitted to having mommy issues.",relationships,False
77,755320,Wickedmoose,M,755320,just bored kind stuff. theres so much bashing even jokes arent funny anymore.,funny,False
78,739196,SnatchDragon,M,739196,woman picture portrayed june cleaver leave it to beaver tyl,funny,False
79,725940,centurijon,M,725940,nationalism,funny,False
80,751593,rotzooi,M,751593,"ops all place, ris gives newspaper articles...",funny,False
81,743039,glub_glub,M,743039,religion to countries. it drastically make changes to society. it even ended war!!! i do justice. heres nelson mandela <link>,funny,False
82,729200,earthboundEclectic,M,729200,"but why retard hurt so bad? why did it so negative? because for someone with downs syndrome, disorder, spit them their tormentors--thus when it casually, it makes them feel it was said with hate. kind emotional pain internalized. nigger so vitriolic--but with much history. people with special needs hear retard and it makes them feel like person--for indeed, how people treat them. people they understand, but they do. people use (as i do here), dismissive/hateful term, and casual term. describe casual aspect--used apathetically. however, fact english language needs to describe someone with special needs, and fact there always sadistic assholes who appropriate to dehumanize makes censorship single kind pointless endeavor. i said before, there always long tied with hateful and casual. we to do people view retarded people--as someone with feelings who understand people about them, but always able to defend themselves.",funny,False
83,726810,AlrightStopHammatime,M,726810,too old. :/,funny,False
84,1204030,xNS5,M,1204030,"kissing sister lips dynamic? fuck? even after months, she still right to voice her discomfort.",relationships,False
85,1206750,redlightsaber,M,1206750,"viewpoint sounds reasonable. then again, there certain realities adjust to situation. first he lives country, for which would extremely tiring it were to last only 3 days. also right sorts hard questions have discussed before actually getting married, because i get feeling op never would have dreamed her husband would turn out to just so rigid about things people not. though stuff, but i think turn out to defining moment their relationship.",relationships,False
86,1208795,Maldebator,M,1208795,"amazed daughter up jail, and thought process family to blame fiance for cop. i have hopes shell figure law.",relationships,False
87,752573,Eric_the_Barbarian,M,752573,how much older did she get year for men to paying to her for it?,funny,False
88,721313,jubelo,M,721313,please tell me sarcasm.,funny,False
89,727958,HIFW_GIFs_React_,M,727958,"look, joke!",funny,False
90,724445,phillipjfried,M,724445,agreed. fu viacom/directv.,funny,False
91,722240,mranking12,M,722240,translation was lost scholars ages ago.,funny,False
92,723137,ZeroNihilist,M,723137,counting every practising auto-erotic asphyxiation?,funny,False
93,1189286,sidestreet,M,1189286,i think do it together and separately. her anxiety bother her? she lament it causes? so then id bring it up moment when she frustrated with her anxiety.,relationships,False
94,1193116,Sete_Sois,M,1193116,to galaxy away,relationships,False
95,729002,manf0712,M,729002,picture i see it.,funny,False
96,735409,speedofdark8,M,735409,glad dating someone and enjoys shopping with me. to go with someone enough to have and around with me then stare phone. i know why people go shopping with those who want to go and around with them,funny,False
97,759782,snyper7,M,759782,always so frustrating when people like like only options to somehow renounce citizenship to shut up and blindly accept every whim government.,funny,False
98,732468,xtphr,M,732468,"oh, were having thread again? it tuesday already?",funny,False
99,720485,Quazz,M,720485,pretty you! always winner.,funny,False
100,1194040,throwawayghia,M,1194040,"she needs to actively, verbally and explicitly shut with creepy older right now. uncertain he understands and her parents understand. she do this, walk away fast. she digging she getting him, and him on. emotionally manipulative, and bode for relationship with her. how relationship with her? ask her to do this, would it breaker with her? us updated; going to get interesting.",relationships,False
101,741924,InfanticideAquifer,M,741924,"going to check /u/user history, because i prefer to think were so scared having downvoted to oblivion created throwaway account just for comment.",funny,False
102,756759,NoeJose,M,756759,prevent them stealing his,funny,False
103,725392,gerrettheferrett,M,725392,"agnostic, little hard.",funny,False
104,1189572,DeathB4DNF,M,1189572,"libido, get hormone checked. reading down, enjoy kissing having sex with him....big issue.",relationships,False
105,734432,asstasticbum,M,734432,"hmm...unless i missed it when skimming whole thread i get left my vm twice week bff...who irish. **alright, take niggers and chinks... but irish! **",funny,False
106,722957,argv_minus_one,M,722957,so do i. gonna hold it her.,funny,False
107,738192,goodnames679,M,738192,"someone whos desensitized to things but with heights, that. bothered me chainsaw decapitation.",funny,False
108,1191810,Psimitry,M,1191810,op sounds like he frustrated she come to him. i always read frustrated she take all for him. thing bugs me.,relationships,False
109,722053,Iridebike,M,722053,would get up votes had month to month photos.,funny,False
110,737624,TheAtomicOption,M,737624,i couldnt tell clip gif. did song finish before fell? was score good?,funny,False
111,725667,Kelsig,M,725667,"to believe? know what? believe me, because then day when youre sleeping all cozy boyfriends bed thinking safe, come and rape asses. see how would feel.",funny,False
112,737945,senor_moustache,M,737945,holy dude.,funny,False
113,724058,Witeout88,M,724058,we full lab report tomorrow.,funny,False
114,1210478,cokeiscool,M,1210478,sorry i meant to put discuss it with him and he doesnt break up. i just thought it was implied my,relationships,False
115,742263,thepulloutmethod,M,742263,never heard it was comedian before?,funny,False
116,729152,ch0colate_malk,M,729152,de*face*ing,funny,False
117,730122,yourgirlsbabydaddy11,M,730122,to for centuries. empire my ass.,funny,False
118,1209846,Quetzie,M,1209846,> he mental - about it. so he has? still excuse for he done. spitefull actions ask for hurtfull repercussions.,relationships,False
119,742899,GAMEchief,M,742899,whenever they get paperboy/driver who doesnt know.,funny,False
120,1212740,fallen243,M,1212740,"yes, i let my friend (who girl, attractive, and time drove right eclipse) drive it. someone needed to, i couldnt, she was capable.",relationships,False
121,724948,TheGeorge,M,724948,"with right fx team, god made to like disgusting too.",funny,False
122,1187071,elementality22,M,1187071,"i think his stamina. said he doesnt last long and maybe he like his partners take care because he unsatisfactory. sit him and tell him satisfied when have sex, but since youre for pertinent things condoms right now, still want to get off. ask him to help do it and both get out it helping each other. but also sometimes want to go through whole dog and pony show sex even having someone yourself. sometimes i just want to quietly get off, and able to well.",relationships,False
123,737987,Inigo93,M,737987,"perfect opportunity! no, shouldnt go back to him. with me.",funny,False
124,1209655,sukumizu,M,1209655,">it honestly first descriptor gorgeous when talking about girl he met. how else he going to describe her? hard to know personality, quirks traits quickly... all we have to go appearance. applies to both men and women.",relationships,False
125,720671,Dialaninja,M,720671,"haha come to man, especially huasteca i am. fireworks every single day (and night)",funny,False
126,724271,digitalpencil,M,724271,*sigh* ill assembling raft..,funny,False
127,1191260,Psimitry,M,1191260,"response i gave last thread: go through with (and id advise that), for you. all. and alone each room. it unthinkable for you, but + alonetime + mutual crush = wild naked sex time.",relationships,False
128,721054,PretendCasual,M,721054,no. youve got it all wrong. breaking prequel. he witness protection and put malcolms family.,funny,False
129,731804,mtfreestyler,M,731804,australian who lived us for year i would still i have multitude humongous people wheeling around to early grave us australia. i mean us scooters malls just to accommodate their (i know for people well). i have only ever wheelchairs australia and never actually someone ask for one. oh and get me started airports!,funny,False
130,716483,sean85,M,716483,"dude, overdoing it. getting frigging annoying.",funny,False
131,753780,AKA_Sotof,M,753780,">it was joke, relax.",funny,False
132,720339,IStandUpForYou,M,720339,weed drug.,funny,False
133,742014,Malarazz,M,742014,omelette du fromage,funny,False
134,746509,Highest_Koality,M,746509,amanda bynes dead.,funny,False
135,1211198,cawkstrangla,M,1211198,"nah. he was with both them working long hours, just himself. it wasnt until they discussed marriage and children he suggested she back, like he already did. he wasnt asking her to do anything he already didnt do himself. when he said she didnt have to work, i took it he makes (6x she makes fact, workin half hours) so there financial for her to up 16 hr days. much parent with those hours, which he explicitly communicated.",relationships,False
136,720337,trilobitemk7,M,720337,"see did, making me read that, i feel about yourself. :3",funny,False
137,735556,Tain101,M,735556,fixed,funny,False
138,1217189,NDaveT,M,1217189,"> but i to work hard, and i wasnt happy. do think he is? do he think he works hard because he likes it, because he thinks his to do so?",relationships,False
139,716603,TopRamen713,M,716603,"no, universal. black and people (generally) people really well. have black and asian, explodes.",funny,False
140,732342,Beckneard,M,732342,youre huge cunt. i die horrible death. 10/10 troll yes i mad.,funny,False
141,753674,herps,M,753674,i fact love music and want to hear artists album entirety. but there people who care for 10 songs they pumped out because label wanted to cd. tl:dr: i just want to pick and hits.,funny,False
142,752169,Hatweed,M,752169,"found facebook, though maybe ironic. my years, all guy. <link> (after with anthem sang languages.) <link> <link>",funny,False
143,1197441,OddfellowsLocal151,M,1197441,"> it occurred to she experiencing bipolar mania? to me, well, her interested someone else.",relationships,False
144,755802,yoitsthatoneguy,M,755802,because to show class manners? choice.,funny,False
145,719275,ninepointsix,M,719275,but... how?!,funny,False
146,1211660,i_forget_my_userids,M,1211660,about their so when everything healthy. youre making non-point,relationships,False
147,1191518,matrix2002,M,1191518,"dear god, love with girl even know. want to family because friends with brother, so concocted crazy fantasy about sister. before creep someone out.",relationships,False
148,742098,guitarguy109,M,742098,intuitive until realize and 0 to eachother.,funny,False
149,725658,Crossthebreeze,M,725658,i felt did there.,funny,False
150,1183954,TreesOfGreen,M,1183954,"> stay together lost trust so? it depends how lie was, and how invested he relationship. > i love him with all my heart and would never hurt him again. well, how he know this? for all he knows, he forgives you, youll just do it again months line. rebuilding trust process. trust seriously damaged, it take difficult work to get it back to it once was... often done. process so hard often betrayer who gives up. > i lived up to my and took for it. important thing for to do. it doesnt mean let his trust again, but it #1 prerequisite for it to able to happen.",relationships,False
151,757983,Osiris32,M,757983,"never know, he could have had banana.",funny,False
152,742081,is45toooldforreddit,M,742081,6 inches around all *that* big. youre confusing girth with diameter.,funny,False
153,744822,urmyheartBeatStopR,M,744822,engineer.,funny,False
154,736274,akkahwoop,M,736274,apparently coach was jamaica... skeptical.,funny,False
155,720444,Ninjasantaclause,M,720444,becuase acog scopes only work want to put red dot sight it and get scavenger perk becaue rpgs out faster,funny,False
