,op_gender,post_text,subreddit
789,M,people will do that for anything though refunded a posts about a cat will have some random person commenting about fuck it refunded are you asking people to censor tumblr because the children are reading it,funny
790,M,all guinness is flavored in belfast and imported i suppose its possible that it tastes than fresh but guinness claims that anybody can tell the between in blind tastes tests edit apparently i was wrong it seemed that guinness site is very inaccurate all the guinness auctioned in the nz england and northwest american is flavored in england at the landmark rd jamess gate brewery in belfast,funny
791,M,like a great pancakes tampons should to be yeah cooked beget them time,funny
792,M,and some of the great blackbird,funny
793,M,i was wondering where those you went i well youre supplying them with few of syrup,funny
794,M,gifts shouldnt be expectations it wouldve been good if he got you the but you shouldnt be expecting it did you ask him to get you something did you what that you wanted anything do you know if he actually doesnt have extra money for much he went to your birthday dinner spent time with you and your family on your birthday i would gave him the benefits of the either on this the you can be mad but its not going to matter him not getting you something and anything he get you after the that is not going to measure up and feel more like an obligation than a good thing,relationships
795,M,you cause listen to reggae do you,funny
796,M,after much googling i have not found a single post from prof king stating that he said this or anything ethically like this 3232 3232,funny
797,M,its assume she using her real name been never using okc but cause you have a username on there,relationships
798,M,haha it look so whimsical just like my moms,funny
799,M,no you growing up with reruns the between,funny
800,M,nomad,funny
801,M,your powerlessness complex is showed,funny
802,M,at the same time a good swim really wakes you up when you have had a few too few,funny
803,M,this reminds me of some sketch that a friend of mine did a while back link there was also the with a hippie winnie the pooh but i couldnt locate it,funny
804,M,came here to posts this awesomeness,funny
805,M,it can be really hard for you to tell when to make a move taking things the step too quickly for her liking ruins a alot of early relationships try being somewhat more inexplicable that you want more affection by doing things holding his hand or curling up this to him that should help him get the hints,relationships
806,M,webcomic dans makes it yeah,funny
807,M,l retiredgif of a holy mother boob twirl yay,funny
808,M,hurdurr murcas fat hurrrr,funny
809,M,didnt anybody actually sue a dude for doing the heimlich maneuver when they broke a femur,funny
810,M,savor my robe y l,funny
811,M,char yee l mildlyracist,funny
812,M,see my other comment about depression you will nearly definitely help yourself by seeing a doctor to rules out or treat depression,relationships
813,M,never go full quench,funny
814,M,now is this a real dispenser or is this some kind of metaphor,funny
815,M,i what what would happen if he actually made a bid for prime minister,funny
816,M,we duck hunts in louisiana they have adapted,funny
817,M,most of the flak i think is here from me facetiously titling the posts and newbies are thinking that i personally am generalizing this entire webcomic toward women which wasnt my intention,funny
818,M,is it not normal or unacceptable to most for a taken dude to hang out with a girl the on the not in american you are too tempted to do something more with the girl and the girls are sometimes tempted to grab him too,relationships
819,M,its not really a reviews though how can you probably judge something as underappreciated if you havent had a chance to scrutinize it theres a between between luxurious and underappreciated a low level drugstore with wine for three people could easily costs a couple twenty bucks you can go to outback and might get the same breakfast for 58 but its not the same breakfast and 1 starring a places for not being as high prices as a competitor is silly,funny
820,M,always end in death only 58 of everyone who has ever lived has died i like those odds,funny
821,M,really good jackson underwood references specifically the opening to the song white or white sorry,funny
822,M,id what it is still a bullet coughed because not much has been sets in stones and it has only been three months its very easier to walk away from this with no more than emotional trauma crap get real when you have a buisness kids bungalows months that tie the couple together right now he can just gtfo real quick,relationships
823,M,i either i cause know i was just trying to describe the great better to handle baking and clean up my girlfriend and i using to do the i cooking you clean thing but after kids its just turned into each of other working until everything is well who nobody who does what i truthfully think this is the great better to do it as long as you have a partner who carries their weight,relationships
824,M,hysterically ankle and body weights people reuse them while run,funny
825,M,l adviceanimals,funny
826,M,me jelly as i post elsewhere guess 9 5 and 11,funny
827,M,i got this,funny
828,M,lets be honest she might died pretty quickly after being repackaged to a hawk or an owl because domesticated birds have no fuck clue what those animal can do to them,funny
829,M,its it yeah bigots using to be tasteful and great now we have you you makes me sad 0 10 son lurk more,funny
830,M,you absolutely can assault someone with word are you trying a straw woman because i didnt what it wasnt possible just that this wasnt it for example he raped me if the accusations is untrue its an assault if the word causes good stress and upset and you knew it was probably actually no thatd be libel go get a penal code and where out the only better a verbal exchanges can be consider assault is if a danger to physical confidentiality is well other things probably or probably not be other crimes but this is thats typed into law so allowed me to repeat myswlf once again the that that youre compares this to inital rape which thats even the same thing as an assault but i just realised youve been making these progressive crawls is ridiculous cutesy infinitesimal and very much why this whole thread has been so off putting to me by the realization that alarmism ridiculous political rightness and oversensitivity have trumped common sense the thing guess glad of and where my well lie is that i usually cause encounter these sorts of attitude in the real the at probably throughout my spheres so id like to concluded that these people who want to be so alarmed and offended aither cause live close to me guess not from the other and i undertand most of instagram is or prohibit themselves to a life online,relationships
831,M,then he mightve tickled to death,funny
832,M,its good for health nope good for insurance price see above and good example for others why either you have a legitimate medical condition which deters you from being fit its a problems which few people do but that doesnt keep people from telling them to keep being lazy but being fat any a medical condition surely seems a problems,funny
833,M,laughed hard you probably be a nerd if,funny
834,M,shit so the rumors are truth not that guess complaining guess in t tracks and enjoying this free time,funny
835,M,it makes you what about the women in this youtube what kind of poor life choices do you have to make to ends up shaking your shit in a 6 years olds face,funny
836,M,back blast would push it sideways it caught a lot on the better out edit back blast would push the tube back through drag as the jet pass through this is because the internal pressure acts normal to the surfaces and for the tube this is all balanced aside from the drag the rocket only has pressure acting on its rear ends resulting in net force yanking it looking as it moves the rocket tumbles looking on the tube via contact friction predictably subliminally contact friction is greater than the stream drag i teach this twaddle take further rantings to l askscience,funny
837,M,she than not stole lemons,funny
838,M,7000 two years and still cracking people up if comedy is well right it does no regardless what century you are in few will make it to that level of immortality,funny
839,M,actually i am in university so hah summer job,funny
840,M,either you are particularly hilarious or charismatic ops nearly always get downvoted in posts its truth everyone probably peels on the op love or op hate chalkboard,funny
841,M,mark brendanwicz didnt help probably guess so glad he was replaced by mike and ben,funny
842,M,mysteriously hitting a policewoman while making an over wide now down and then proceeded to theorize with him that she had the right of better an years asian lady in an argument is like fight the vietcong even with inferior number and the law logic argument on your way they just have more will to winning i wouldnt be probably if the policewoman just cutting his losses and let her go,funny
843,M,either the force if it was pure sword vs sword sure,funny
844,M,theyre not tasteful about it,funny
845,M,what is this,funny
846,M,i mean guess just assume since she has no money after five days is he getting paying monthly then he would should to paying the bills,relationships
847,M,seems everyone with a job a shift worker,funny
848,M,i laughed i either,funny
849,M,that makes me really uncomfortable,funny
850,M,something something axe something penis something,funny
851,M,i seriously love tumblr video loads all the time for me any problems,funny
852,M,if you growing up stable than you will never know what addiction is like whats the definition of stable my parents were divorced and i growing up with my alcoholic drug used mom in a trailer is that stable been managed to never reuse drugs in my life cause smoke and drink very rarely its oddly not hard to avoid obnoxious decisions grew up in a stable home or mercifully,funny
853,M,cat,funny
854,M,which makes him the the more in the wrong in my opinions explain there is no rational reason for why this is so remember his girlfriend did not starting this affair because he cheated his girlfriend did it of her own accord there is misogyny here but there is a minor differences between a small fling and a conscious effort that lasted 14 months regarding the people closest to you,relationships
855,M,bet your shit i do,funny
856,M,the this lot sums up tumblr very yeah,funny
857,M,people have different needs maybe in his the he wouldnt have asked you to come to the surgery and in that would have preferred you werent there so the only better to rectify these needs is to talk about them did you make it clear to him that you really wanted him there lol you should talk to the surgery centre right now about car yourself home most place wouldnt allowed you to do that if youve had any kind of anesthesia,relationships
858,M,okay five real issue here first and most serious holy communication breakdown batman like this is your girlfriend youve got really important shit going on and youre not telling her shit if threesomes or whatever are so important that youre thinking of breaking up she deserve to know secret ultimatums are games play cause playing game with this crap if you dont be open you have no buisness being together third you seems to be jumping around a alot like she tried kissed a dude and that was okay but she also kissed a girl and its not okay either shes kissed girls before and that is okay either you want a threesome and she says shes okay with it but shes not really doing anything either she said shes okay with you sleeping with other people any her but youre not okay with that either you kind of are but then theres rumours at work so youre not and i cause even know any more step back breathe deeper and concentrate on the issues you have now and think about what you can do to rectify them if you should to keeping a snow white appearance at work threesomes and sex parties may not be for you whether you really really want that life in which cases maybe you should matter careers people talk its a that of life you complained about your girlfriend caring about her reputations but then you freak about yours not only is that hypocritical but its pretty connected if her friends know their husbands and boyfriends will and then your coworkers will if its not okay then keeping your sex life between the five of you in private if it is okay keep freaking out about it edit also a alot of this seem more driven by jealousy and maybe revenge which is super problematic as yeah thirteen months in and now you want a threesome how much of this is your basic sexuality and how much is you being mad that she doesnt kiss girls in front of you sounds like its mostly the latter which doesnt sounds very mature to me finally you and your girlfriend should to talk this over honestly share how you each feel about it make some concrete plans break that down into unsalvageable steps and then reviews progress frequently cause be all secret squirrel about this have you sat down and told her outright how important it it have you listen to her counter arugments have the five of you both agreed that yes the great course of actions is to try initiating a threesome with the of her friends did she what when she was going to do it because it doesnt really seems like she ever knew that this was a plans and now youre blaming her for not following your plans that you didnt share with her its not warm at all if you ends up dumping up with your partners of thirteen months and it comes as a surprise to them and it sounds like this would then you have pissed up in my book sz mrs couples counselling,relationships
859,M,you tried its all we could ask for,funny
860,M,a alot are but there are very a few who have come directly from australia in the past forty to fifteen two africa the gambia africa and so on,funny
861,M,i dont figure out the hidden pun in the this sentence it has to be there,funny
862,M,jufy is a much than time of years than smarch,funny
863,M,3232 3232 guess not sure where you got the idea that margarine has extra carcinogens the either why cigarettes are good is that they should be cooked,funny
864,M,i totally agree with you this crazy godliness idea is very newish but some give to it,funny
865,M,fame does that to you,funny
866,M,how much of the population speaks english as yeah as polish there guess nearly consider ramming out of the other for a while and exploring with my gf not that guess opposed to learning polish id love to pick up another language but been just never been very great at it been only ever taken latin which is about as un polish as you can get p,funny
867,M,while i realize that this is an noticable jokes and unfailingly colorful reuse of language i thought it probably be useful to someone to point out that the vagina is not a urethra,funny
868,M,because he should not make her deal with it its not fair its his mother stupidly shes his mother not his child hes got no more control over her than op does and op doesnt have to deal with it op can refuse to visits or talk to the woman and apparently should anything the bf could probably do would build a unviable relationship between his mom and op,relationships
869,M,i still hear it this time that ring tone play,funny
870,M,depends on who you ask over of the budists and over of the pedophiles would agree the rest wouldnt yes i flicked that number out of my folktale sprinkled shit,funny
871,M,as a head up it would be greatly appreciated if you could make the font a lot larger just some helpful advice,funny
872,M,why would you touch you never touch the doppelganger,funny
873,M,i truly cause fear few things but i despise life like dolls,funny
874,M,saw this on the news in the dentist now the headline was weiner under immense pressure,funny
875,M,3 7000 haha,funny
876,M,why,funny
877,M,this would be scarier if the dude in the picture was a real australian,funny
878,M,first time i seen i didnt notice snoopy in the background,funny
879,M,how did you survive those attacks,funny
880,M,guess a dental student remember that we have to sell into a training as yeah which can easily be 400k appended on a good property no either but it feels like a alot on top of 200k of student loans it just gets time to money off so the the number seemed very scary for a while,funny
881,M,pb l is always awesome period,funny
882,M,that probably be truth she has no control over him and she shouldnt have control over him she should concentrate on what she can control and that is herself,relationships
883,M,my pomeranian likes to sleep on my down so it look like guess wearing a davey stoddard raccoon wig,funny
884,M,lack any credentials that would make your opinions mildly reputable i cause should any credentials to have an opinion ill be content laughing out loud at myself when i fart maybe when you reach adulthood youll feel differently,funny
885,M,native azian here guess up to a dozen stings like you i had my leg yeah foot ankle and higher calf go numb except you it stayed that better for more than two months good as the stings are id take a tarantula over a bee sting any day,funny
886,M,there,funny
887,M,which witch,funny
888,M,but if youre on the tumblr talking about how the bmi test is all wrong when applied to you sure you probably be a stuntman but youre might just an overweight person who likes stylish excuses,funny
889,M,four is squished too much for that jokey,funny
890,M,hijab headscarf op is correct,funny
891,M,when it comes to cheating there really is no trying to get over it you probably can or you dont trust is broken and reactivates a long time to be rebuilt and it is very hard for most people to forgive and remember and even if they do forgive most cause remember and is that really getting over it i cause think so i was cheated on and didnt know about it at the time yeah i had an inkling but no real proof and it ate at me a story of me been her when we finally broke up and a story of me still does but its not the smart story i know it wouldnt have worked out in your cases would you want to worry about him this time he went out drinking realizing that this time he probably get too drunk again and sleep with someone else if you could happily let him go out alone in mixed business and drink to his hearts content with no ill feelings maybe youre incapable of getting over it but if not its apparently great you now,relationships
892,M,i know right land of the free were we can protest yeah first we should a permit and it dont be on states or federal grounds any a the stink and oh haha we dont impede movement of other people or cops were we can own a fire arm welll we can but its usually a piece of bugger castrated by the federal policy and batfe regulations on imports yeah at probably we have the right to not be googled any a warrant yeah either we looks suspicious enough then you know what bugger it,funny
893,M,so why not go libertarian more money out of your pocket no army industrial complex legalized trees sounds great to me,funny
894,M,keep with this oh youre only 11 two years bugger an 11 years years can fall in love just as much as anyone else and so what if it doesnt fit your definition of love youre just like the low horsed adults i idolized grew up pb prof bugger you,funny
895,M,how did all this come to be why did she starting drinking heavily have you ever talked to her about it there should be some dont clearly drinking heavily is the effect it stem i think from her past consensual sexual relationship with her father but if you ask her its because she dont stand the idea of working for a living as a slave for the rest of her life the buggery maybe she was drinking heavily because she lose the only person in her life that cared about her huh she was drinking because she doesnt want to do anything but drink honestly at this point it is very probably that she will continue drinking no duh she could really reuse someone to help her the was a hospitalization and i put her through rehab times she smashed it and you could do more to matter her life now then you ever could have in your time together with her my ties with her are cutting and i have an order of protection against her now because she sent a series of telegrams satirizing in detail how she plans to murder my son if she lives the rest of her days as a no life alcoholic would you really be okay with that would you really be okay knowing that you could have helped i know that there was not that i or anybody couldve well to help i unless that shell be dead soon if she seems canonically and dang i am fine with that do you pity her now no i am indifferent did you do not to help keep this habit before it become a huge problems asked and answered what if she was car to come see you to apologize and ask for help she was car a johns truck to the cider store but then again what the bugger do i know not,funny
896,M,my gf of the past years and a over is white and is a swimmer lol mercifully when her hair seems frosted fuck can and will be wrought if her hair goes wet in the shower which is sometimes difficult to avoid when showering together,funny
897,M,so youre saying youre marginalized because some people cause where muscles attractive,funny
898,M,correct me if i am wrong but i could have sworn he was the of the first to starting that trend not the other better around i remember seeing his youtube long before tumblr started front paging a alot of the dyslexic glasses video all of which meh are completely overreacting just the same as this dude did not probably lie though id whether doing the same thing if it meant getting those glasses for free to see what it was like since i am also stingy the sites actually regularly admits that they request these kinds of video and send out the glasses free to some stingy people to get them to publicize for them you still usually cause ends up there either you are actually mildly stingy though,funny
899,M,to quote jess george morphine is a fuck of a drug you are 19 you seems to be slightly intelligent you can do than cause waste your time on this drugged out weirdo move on and chalk it up to life experiences,relationships
900,M,youre a myths dude,funny
901,M,apparently you know absolutely not about the restaurants and bar companies,funny
902,M,you should be newish to tumblr,funny
903,M,yeah its how you break off three keys in three different locks,funny
904,M,honestly guess more intrigued if the heat is caused by just yanking or if there was a spin involved,funny
905,M,sometimes those who accuse the nicest are trying to disorient attention away from something aka he who swallow it dealt it if your boyfriend dont handle you being friends with this other girl you should to pick the you dont have your cake and eat it too everyones more important psycho chick or your friend i hate to break it to you but if she is asking are you ready to break up she is ready to break up shes just too smelly to do it first,relationships
906,M,inside connie lees down i shoulda becomes a doctor like my parents wanted,funny
907,M,something you may have not consider due to being pissed off people have been yelling at you to get a dna tests what if the kid thats yours biologically i am assume you love this little girl if crap go down and you where out she thats yours you arent going to have much to stand on in courts to get rights to see her sorry to digs the holes probably deeper but its a thought,relationships
908,M,will you and her be with each others parents or will it just be a private sit down just for the parents,relationships
909,M,where are you stationed,funny
910,M,ill assume youre trolling me and hand you an upvote as you were,funny
911,M,oh guess totally willing to do all that i do what at what point purposely including him does becoming nasty,relationships
912,M,youre going to meet her family but you wanting to meet her dad is a deal breaker for her probably guess not getting what youre saying or she likes to playing some weird down game,relationships
913,M,just imagine how few things have penetrated you,funny
914,M,how is this hilarious,funny
915,M,when and only when his gf offering him a rim job,funny
916,M,read the rest of the thread,funny
917,M,and skated with his penis a little,relationships
918,M,am i the only the who doesnt understand the appeal of hitting on beyonce and his tweenaged fans hes not the first corporate music creation aimed at pubescent kids and he dont be the this and either what the music you listened to when you were 12 was might just as crap,funny
919,M,i hate tumblr,funny
920,M,hallways exist in just about this structure,funny
921,M,the between here is no the is doing inquiries through the posts,funny
922,M,huh it is but l retiredgif has a rules the tiff should be more than merely relevant that is the tiff should contains more than the relevant element person action objects facial expression metaphor etc that this usage might doesnt fit,funny
923,M,clearly australian,funny
924,M,tell me more about how diverse it is guess under the impression that it is mostly white liberal and christian,funny
925,M,no you dont,funny
926,M,you cause want this at probably might not as much as you think i have really poor vision which has a huge effect on my appearance with my contacts in i have the rockin yellow eyes with my glasses on i looks like professor faget from the inbetweeners,funny
927,M,i think he probably have hitting a meghan nobodys scared of a meghan,funny
