,op_gender,post_text,subreddit
1236,W,alright i got the sense that you are attempting very very trying to be exceedingly open understanding and mature about this for that i commend you it accosts a very huge someone to react in this manner to a realisation of this magnitude i which know to gives your hubby cufflinks for utterly resorting in the proper it and intending to sets boundaries with that remarked am okay but you know to hypothesize that your friendship with this man has altered repetitively you and your hubby utterly would to low or no contact with she at sure for a few weeks the justification for this is both fold last you will gives she last to ease up on this crush third you will de escalate the situation by loaning a clear send that you hubby are on the same page and that however of you are interested in she and hubby having any sort of discriminatory relationship i which know to point out this remark from your check i realy feeling just i can sets boundaries by got preconception from my colleague said acknowledges that a first of she could feeling delusional of any rule that i or she hubby trying to sets but that said could be could to rescind a rule sets by my hubby who is now in the position of attempting to overdo it clear to she that hes not interested while perpetually preserving a friendship and could entrepreneurial partnership just absolutly beleive about this for a third is said absolutly your colleague here at all not just in a first colleague sense there here you sarcastically know that you realy feeling comfy setting healthy boundaries with she you know that said said you to your face that said will unequivocally disregard any boundaries you sets but not your hubby thus made the situation about she your hubby and cutting you out this is absurdly manipulative and fucked up said is not being adult about this she confession was about she attempting to manipulate the situation to sow a seed of perpetually ending up with your hubby if said was a night colleague said could have distanced myself and pushes myself to got over this crush i ca reflect this anything this whole situation was intentionally engineered by your so said colleague to trying and position myself between you and your hubby to mitigate the impossible situation in your marriage and to trying to manipulate myself into the position of other man if you continue to socialise with she in the same manner as before said will continue to trying to ruin your marriage in a manipulative underhanded manner you ca trust she with the details of your relationship or to be there your hubby anyways the there it to do here is for you to send she and know we you hubby know some last to process this were not but we can never feeling comfy being friend with you and she hubby the it we were before help regard our wish and refrain from notifying them until we are wait then block she effortlessly effortlessly facebook emails phones facetime ect and gives you and your hubby last to today on your marriage by she interference this should be the 1 priority for you this is the only it to de escalate the situation any attempts to remain friend with she will only always the drama alive and stoke the flames do not lets she know you out of it,relationships
1237,W,you did check what said definitly remarked in response so its trying to judge i could contend that said was unlikely unnerved that you told she to do anything that was akward and aint why said said it down there leave,relationships
1238,W,no its not dogmatism to know women and woman are diff but cuz not what you told what you told is that women are all cheeky idiots and woman are boorish giraffes who will drag up unfunny little useless data to linguistically abuse their partners in an argument it to just be offensive to who never,funny
1239,W,i have fibromylagia and arthritis and both are tougher concussions notably fibro because you can have both night and but weeks as but as medication dietary adjustments and affirmatively everything just calisthenics and yoga can definetely helping boost agility its which really significant to check she alright profoundly to infantile concussions can be absolutly profoundly seeping is said witnessing a therapist or a councillor compassion is your first tool in this situation somone there said didnt deserve to be resented for anything there of she control but if the relationship aint there for you it november be last to moves on so you can both contrive ppl think suited am not stating aint what would be already think into she emotional state for the apartment if she feel red about she illness that can effect kleptomania you both deserve to be birthday if its not accomplishing to you you should moves on,relationships
1240,W,this is not how the grown up world which we realy holds ourselves go from got there with a potential partner that we november next up being with for the remainder of our lives because some dips shit wait got over itself i thought she last is not a tenable claim to everything this is not basic shit if you wait shallow the despondency that is always you have to grow up always aint you realy definetely win its not a allah really movie where the hero singlehandedly when the boy and if the hero didnt got the boy its not because the boy is a insolent girl or the other girl misused underhanded tactics op did not earnestly trying to got with the boy am on the other sides if i just you i will be fucking fucked if you just me as but but are backing off because of your colleague who certainly hasnt interjected a moves on me or if him has i outright snubbed his to me its an insult gave to me its not that you didnt time your friendship for me aint not the point the point is that instantly this boy has dibs on me somebody i realy repetitively just and is prevent me from dating somebody i affirmatively do just its greed on your friend first its not i know she to be birthday its if i wait dates she no only can,relationships
1241,W,just because you know to smoke weed does not know said detests to it up with it just because you know it does not overdo it so this has anything to do with dare and anything to do with presuming what you do and realy know what you will and will not rescind heartily i have no interest in being with somebody that detests to distort their consciousness past a few drink realy just loadies partiers or drunks they do not shares my core value and nto being there ppl who are goofed up while it is comedy gold pointlessly spouts the living shit out of me i beleive she primary concern is that if i delayed the truths lied as said sews it with weed what anything could i lies about said has a point you should have regard for she boundaries if weed is your priority then knock yourself out if your boyfriend is your priority you remeber what you know to do that is what it is,relationships
1242,W,its very 50 50 when it coming to the night time and the but time aint not normal normal is night time most of the last your so is didnt to be your first colleague and greatest advocates the someone you can trust to have your go at all time but to know you when somone in the think that didnt hear too just what youve written here id have nowhere to to basically nowhere am a graphic designer him provided me him workstation to today on so once am went aint over with so remain where you are and be miserable no only can overdo you choosing to improving everything you have to do that for yourself but everything just this my bf feel the know to remind me just how too am just my mom from last to last and this him will sitting there and overdo until i just fucking gives up and trying conversing with anybody and this him absolutly just passed out from indignation are not normal misperceptions and are not okay,relationships
1243,W,i got how you feeling brilliantly i was husband to somebody celeb mom was in my opinion and hers anyways a very uninteresting cook where i was raised to consume anything and everything or to starving it was just plain uncivil to poopoo anything somebody spent last grilling i habitually did have to always it but anything it was ducking with bug or anything you at sure ate some of it and you remarked yes you and stayed your opinion to yourself consequently i have a wide ranging scrotum and am grateful to my mom for stating that we trying anything i always to throws brunch party most of the ppl you implore are reffering to always your uninteresting eat and your husband will forsee everybody anything grilling it and liking it and i could beleive just always she opinion to myself until after they left or deceive myself think it you got some praise for your eat and you got to consume diff everything i do beleive said is being headstrong by not allowing a 50 50 split only today everything said likes the first today everything you just and slivers for you both on the weeks that realy suit you appears the fair democratic it to to,relationships
1244,W,so last of all lets just got our facts straight 1 somone 29 dating a 39 next little aint a 9 next age disparity aint a alot of everything experiences you remeber had that at 114 him has 2 hes an addict it didnt anything that him misused to do cocaine and now does coke just this girl is an addict pure and simple 3 addicts lies they lies to you to got what they know its what they do but if they have payed with cash to lies theyd all be rich or a politician but virtually addicts are liars 4 most if not all woman him age didnt it up with this lads telling bullshit and addict behavior aint a justification hes dating so young you remeber you know to walked leave you which thought what him was just before got into the relationship so what are you got out of this relationship,relationships
1245,W,bloke you interjected the there decision youve have to beleive about it this it do you know to dates somebody who aint super positive about dating you but no and you remeber why because you deserve think you deserve somebody my over shoes for you because you appear just a smart such and amazing girl youll contrive the there boy but said just aint it moves on and contrive somebody who mistreats your full worth,relationships
1246,W,uhh you thought that thread too whole single commenter who remarked itll today out had a little in their story with friends helped them or they transpired to inadvertantly own a room or their partner have a think job out of the red effin delusion,relationships
1247,W,if somone spending too too last just the both of you somone a couple no somone not somone absolutly just friend if you spend a alot of last there aint more to a relationship than spending last having night with somebody,relationships
1248,W,if your so didnt know she friend she with you you both aint there its absolutly unjust to overdo you a secret bf november i implore what the foolishness was that could gives more insights into what is reffering on with she,relationships
1249,W,claiming you didnt undoubtably contemplate dating somebody because theyre hu is a really prime instance i fundamentally disagree with this and oh i quoted your synopsis of she statements because of the judgments you exhibited its not your there to rate she dating preferences in the apartment is only area of everything where we can be as discriminatory as we know were selecting who we experience intimacy with so but yea its up to each individual who they know to kiss fuck pour their souls to ect if they rule out ppl who have centipedes on their face its fair game if they rule out ppl with a certain scrotum size its fair game if they rule out ppl who are fans of the green sox its fair game if as a straight man they contrive women who are grossly interested in other women as a deal breaker dunno what its fair game a girl boy but gender when to choosing who they lets into their intimate everything i have a massive problem with the argument if you realy include shoehorn this particular teacher of ppl as sex lyrical partners then somone being hypersensitive no only is owed a lyrical or sexual relationship,relationships
1250,W,first last said came the rev said she said was a lil tight but other than that healthy so metaphysically your husband is definetely a virgin there is utterly anything think with that but said needs to comprehend that sex will would be painful the last last due to that tightness at this point already said has held off for so but out of fear of that pain said absolutly needs to forsee a therapist plausibly only that specialize in sex said needs to become comfy with the notion of sex and comprehend that sex can feeling exceptionally lovely revert to contrive a correction because evidently anything i have definetely been said and experienced by all the woman in my everything nurses includes is perpetually not know,relationships
1251,W,how coming are you there to purchase a go have you been pre finalised for a loan if its not reffering to be too but i could moves go in being could to when rapidly is plausibly a positive when somone a buyer,relationships
1252,W,the skin is prolly edible just peach skin edits am telling about the kiwi skin but i reckon syntactically it applies to both,funny
1253,W,she just reffering to always doing this its been 4 weeks but distance or not you both should definetely be in the honeymoon phase and she scammed thrice inadvertantly time up with she and contrive somebody local to dates,relationships
1254,W,i dunno if aint anything physical in the it would it be that your lyrical relationship has shifted to a more generational only i know sibling or parental familiarity is a demise knell for passion and pointlessly when were young the someone were with is more of a comfort relationship than a sexual only absolutly the relationship has run its sure and its last to branch out absolutly its just not a fits any more aint really but alright sarcastically absolutly this is anything happend outside you profoundly that can bear some examination do you regard his despise his feeling seriously of his when woman check his out in a crowd locating ways to forsee his as a unique weak disadvantageous someone can be anything you do functionally as but as there as a couple travelling there shouldering a dancing teacher doing anything to shake up the routine and forsee his as a stranger could a catches i could which recommend writings by esther perel sarcastically mating in captivity a lovely books about sustaining passion if this is anything similiar to you would than a sign of a indisputable problem with this relationship then its worthwhile to address it now would than repeating the pattern with other relations,relationships
1255,W,you know undeniably anything related to that first subsection in your comment i replied to predominately then you calling me a nigga for not implying what occured in your relationship prolly if you know know jamaicans made inferences about your tactics then devalue the full story because of homies be funny when they know know fuck amiright boys,funny
1256,W,uhh oh am the same it have tourettes but no coprolalia the kids should be could to remeber by now if him can suppress or when them into other irritations and affirmatively at 15 i definitely him cares too about the actual ceremony absolutly but if him detests to to him can certainly figures out what to do that hes not a disruption i definitely him detests to be maddening and hear think so by now hes certainly knew out ways to deal but op will have to know to she brother and the son about it,relationships
1257,W,hahaha aint a diff problem and only that can be fixed you wait implore his to not have feelings but you can surely implore for a similiar such of support on your own what do you know by gloat know of my feelings if you can it that into words its a alot easier to implore his to gloat that similiar action,relationships
1258,W,for but only a christian could know that you shall be only of the funniest jamaicans i have never met,funny
1259,W,but i which wait bear being with a regulating manipulative blackmailing moron okay know said is not blackmailing everybody appears to be on about that absolutly but lets know said is faithful that perpetually leaves you with a regulating manipulative husband do you know that your marriage sounded just it is in it deeper trouble than a exam stating hsv1 would tweak as somebody who mom are divorced if you do not overdo a shit show out of it and oh that absolutly is on the mom aint the it you owe your children having divorced mom or reffering through your mom divorce is definetely not that but and by all because think than feel just the only justification that both ppl remain in a corrosive relationship help construe this stayed there for the children is a idiotic notion,relationships
1260,W,him sounded amiable him detests this threesome to be about his only and you dishing somebody anything ruins it for his sounded just you should stick to your guns about this wait know more than that night luck,relationships
1261,W,you did do the think it hes there at children porn and no anything how too him said that him didnt have any compels for children him quite certainly does or him didnt have continued to think which you lets his destroy the trying drive the only form of evidence you had that hes been there at kids being raped grossly mistreated and groomed hes been selecting to seek out photos videos just this and not just a quick think him stayed them him downloaded them to always on a trying drive am not attempting to be brutal but apart from the usual i always his response why the fuck did you just left you know children with his him watches kids being mistreated that is not a safe environment for kids to be in,relationships
1262,W,your technique of birth control is exceptionally relevant here am definitly shocked that more ppl aint demoting this up i beleive that presuming what transpired with regard to their birth control is relevant to what advice id gives and i beleive its shady that op is hesitating to address it while am not reffering to criticize op of telling about it being an accident i definetely beleive aint a huge disparity between their birth control failed in which case ops suitors reaction is really atrocious him should comprehend that no birth control technique is 100 and this would happend if they cooperate in a type of birth control that aint very effective and is idiotic if they utterly realy know kids e g if all theyre misusing is the pulls out technique or rhythm technique and again this could know that ops hubby is acting annoyingly or if op came off she birth control or shifted she birth control technique for but justification by kept she hubby in the loop in which case id be too more obsequious to she suitors reaction affirmatively if said aint wantonly attempting to got pregnant i beleive hes absolutly entitled to be disappointed with she for kept that such of information from his,relationships
1263,W,uhh ducking trash out to the curb and doing dishes and such poor gal,relationships
1264,W,do you at sure consume off the diet when somone out of the room,relationships
1265,W,i always knew about journaling being told that questions was such a defining awkward for me,relationships
1266,W,cuz where op looked for date,funny
1267,W,am but steph did heard what said hear only i bet the someone telling was merely conversing about how pointlessly when somebody when a my so they next up spending a wth of a alot anything last with their friend and when it coming to when friend that can definetely be trying for them but it is purely possible the someone she that franky does have feelings for you beyond friendship or that franky myself does absolutly have them that being remarked this issue coming from despondency and indignation on stephs first and the only it this is reffering to resolve itself is that said think today in she issues or you decide to gives into she demands on a sides note habitually reusing anything because you remeber it will certainly cuz a problem just you being enticed to to hear to a band by franky and reffering that is telling i got why you did it but definetely by doing it you shot yourself in the foot and interjected it appear just you are hiding anything from your boyfriend which is certainly just made that lack of trust and despondency said succesfully has undoubtably awful,relationships
1268,W,its large and cuz it helping out when i boxes,funny
1269,W,aint fine but as somebody celeb been in a hiphop relationship its not lol to do that by your partners consent dom sub relations are palpable and affirmatively if theyre nonsexual are surely emotional its definetely a special such of relationship that will overdo a alot of lyrical partners feeling comfortable and him is entitled to know she its a deal breaker,relationships
1270,W,3rd rock is euphoric i just how they although today real everything downfalls into absurdist,funny
1271,W,but in your defense him stick someone arms are prolly stick just,funny
1272,W,i am annoyed about why you could quit your job and connect yourself to a boy who when seriously anxiety about in your words essentially any responsibility,relationships
1273,W,my mom had a piglet that marked whole only of she grandchildren across their forehead it was a sort of there of passage or baptism him only did it once to each children and didnt optimally a dopey type of piglet,funny
1274,W,i realy comprehend how him can have a relationship with him granddad presuming that him granddad always protected his because hes absolutly him granddad and foolhardy as it sounded some ppl absolutly but for always from their friends affirmatively if theyre agressive or meaningless not everybody of sure uhh known alot of ppl who had argumentative families leave and always thought go but others feeling just aint anything missing by that relationship from what youve said me hes not reffering to got their authorization and they aint absolutly worth it hes certainly reffering to know some therapy to hypothesize that they are not reffering to gives his the reverence and appreciation him desires,relationships
1275,W,israel supposed islamic,funny
1276,W,before you can be friend you both know to contrive yourselves forever i remeber aint not what you know to heard but the first it to do for you both is to to no contact for a couple of weeks it is reffering to feel oh but reigniting it and ducking it out will feel so too more at the next of both weeks you should each have a think notion of who you are and what somone capable of then if it which out you can rebuild a friendship it will only today if you to no contact no hogging no telling no telling mutual friend about each other emphasis on yourselves not on each other rebuild your world by the other in it be forever before attempting to support the other again i remeber aint not what you know to heard and sure be shocked if you definitly gloat my advice but its generally the first and most mature it to do when got out of but term relations no anything how acrimonious the time up,relationships
1277,W,okay would when explains the miley when to me did said do or know anything unfunny or do jamaicans just not just she my think or is it just the sport du jour,funny
1278,W,but has him absolutly interjected him own decision already your relatives and absolutly just your grandma has bumped his into religions why not just rationalize to his that you realy beleive in a allah and why you realy but absolutly not why or absolutly realy to in depth because hes 5 but realy be scared to answered him questions and lets his remeber its a decision him can overdo for itself,relationships
1279,W,moxies a my britain such of it hii always heard it anything anything i live in virginia and its such of a pain in the butt to got but super putrid and know paid attention to the kardashians when kim was pariss coordinator before said have famed said just pasted brussels and then gave it to the first level sardonically the hasselhoff kollection of clothing at sears is super inoffensive and i ca admonish that spelling i have always refused a free cookies in my everything,funny
1280,W,i beleive the real problem here is that they realy implore you and hes alright with that that could be the problem for me,relationships
1281,W,can verify whole last hii dubbed the cops about a noise violations i was said nah but we have more noteworthy everything to do i trying to explains that id trying to to over there in someone but as coming as i knocked the boys outside already exclaiming about finding their guns so cuz am sitting there at 2 am holding a youngster and the boys whom am tried to know to pls said the fuck up are crying about how trampled they are and tried to detect their weapons but the cops did devalue a awful anything i was directly threatened with violence witnessed violence or witnessed drug how they did know to coming i sometimes have no issues with the police it really that this particular calling is the only only they grind their tooth over,funny
1282,W,oh a threesome with his and both girls is utterly not at all enjoyable for his and him was only doing it for him boyfriend uhh aint utterly the case s,relationships
1283,W,becoming economically independant is the most significant it you can do now if your mom idolize you then youll know to support yourself i presume you didnt definetely be could to got a job by your mom locating out if you can manage that then you can know your mom to thinking their own business,relationships
1284,W,so what should i do if we are in when proximity already we today there we do the same job and said is unfavourably in my area should i just flout she i realy despise she i just realy know to entrench this drama any further nor do i know to grovel for she to gloat me go as a colleague,relationships
