,op_gender,post_text,subreddit
0,M,it really comes down to the circumstances under which you broke up and your relationship if any afterwards been had exes that things ended fairly yeah with or at probably after some time had passed my so and i went to ones wedding a couple of months ago have been dating the most majestic and beautiful girl i could have ever asked for so youre happy now who give a shit what your ex is doing or who shes doing it with be happy with what youve got and move on definitely sounds like she has ex has been dating a former friend co worker been never understood why this is an issues for people jesus its your ex who give a crap and what buisness of yours if you parted on great terms i what all the great to them if not then great hope to the weirdo,relationships
1,M,s korean tokyo china have tons of boy band i think the one is a boy band so i cause they theyve disappeared i think its much rare in term of popularity in english countries now and most of them are in asia,funny
2,M,those eyes,funny
3,M,you should shades its not my fault if you keeping your volume on maximum,funny
4,M,nope,funny
5,M,yeah whenever he comes back into city you can sleep with him friends with benefits,relationships
6,M,those people are intolerant and i am in no better blaming the women for this its evolutions fault it dictated that men should looks for the physical attributes of a woman in order to determine matter or not she was fit to be a mother now this is pointy with modern medicine and practices mercifully men are more aesthetic driven women respond appropriately and they focused on look its in no better their fault but that doesnt take away from the that that its generally uncommon to where a earthly woman and then when you actually where the they usually cause jut beauty,funny
7,M,a song of ice and fire is the biggest lunch and dress description novels series ever made,funny
8,M,whether its to reawaken him a third to call somene who give a shit that lines is getting dated too good i always guess liked it,relationships
9,M,i wear a 13e and always work it when shoe size comes up and you know what a dude with the feet has let it hang in the air for a moment while they make the seal face then slowly the socks,funny
10,M,you do if you serve selling cider in australia at probably everyone is id ed when auctioning cider,funny
11,M,i publically not facetiously have a phobia of salad dressing this though of this genuinely disgusts me,funny
12,M,i either he has the habit to money for everything and she doesnt like it i think most girls cause like it too,funny
13,M,not a rocket what retired equipment unable to reach mars haha op laughing hurts my soul,funny
14,M,even though she is not associated with the school she still october face charges of used a position of authority to have sex with them which does constitute rape if the person is under age 18,funny
15,M,have you handled anything except 1 notes in the this decades,funny
16,M,its how maintainers see costumers,funny
17,M,theyre both werewolves obviously,funny
18,M,program jesus christ,funny
19,M,the mcondalds manager employees dont ever be a great the in that in the 2 five i took to wrote that i might wasnt sitting here trying to think of the great anology to reuse i either what others are in disagreement with me is the that that meghan paterno and sandusky held a lower importance in life than a minimum wages employees that their part should be umpired more often than others or that their actions have a larger influence on societies i can agree to this to a certain extent the one i was tryign to go with is that i cause care too much about university athletics so if you replace paterno and sandusky with anybody i will still think of them in a positive better sandusky for raping paterno for not doing more or hididing evidence also i get annoyed at hearing the same news part repeatedly there are horrible things going around the the and amazing things going around the the i think the media should spend more time showed other stories and more time on the stories like this about the victims i feel sorry for them no regardless what and they are might have a hard time no regardless if they never hear about the part on the news or if they hear it this day,funny
20,M,itt people thinking they are nice because they cause like douglas jackman,funny
21,M,y b no keeping karma machines,funny
22,M,still do shit they seems to be a rockin more current these days only a week or 2 until the get it now,funny
23,M,could the speaker output be modified can i sell a boxster and make it sound like a tie fighter,funny
24,M,i presume you had a full tank prior,funny
25,M,wheres the girlfriend shaking her down saying i told you,funny
26,M,is it safe to assume you still are,funny
27,M,i have a few lesbian and lesbian friends and the of their greatest accusations when it comes to dating is all the people wanting to experiment they cause want to date them they just want to using them to scratch an itch and then be well if you know this dude has feelings for you maybe you should where someone else to try this out with doing it with him will apparently just complicate things if he even acquiesces to it and matter your friendship you cause have to tell him that you are trying out men its your sex life and no the elses buisness maybe just talk to him about your feelings and your sexuality and see where it go from there cause proposition him for sex to see if you like it or not maybe fuck have some great advice for where you can where great clean you for your first time or maybe fuck offer to help you out himself,relationships
28,M,imagine what kind of achievement youd unlock,funny
29,M,all i could think of was liam,funny
30,M,an america volleyball football in tokyo do they stream game,funny
31,M,it is for phase three,funny
32,M,anybody seeking more info probably also check here titles point age l comnts is this a quick access c fashion d unfortunate 508 4 mos wtf 58 wild clubbin night c 1855 5 mos wtf 216 newish fashion 54 2 mos hilarious 24 these moments waylaid at the stores really crack me up 58 5 mos hilarious 54 potty time pants c 1 1 mo pics 5 is this a thing now 1669 2 mos wtf 657 at the bar her dance credit is full 2 2 mos hilarious 10,funny
33,M,i think this nothing she is targeting the wrong crowd or is she,funny
34,M,what if my down is really the and it dont get all the better down but i can still ejaculate during sex,funny
35,M,yup titles comnts point age l eat your vegetables 3 coms 10 pts 20 dys wtf we all know a girl who likes horses a little too much 15 coms 248 pts 3 mos wtf after photoshopping this i wondered what i have been doing with my life 508 coms 1688 pts 1 yrs wtf my favorite face swap by way 16 coms 258 pts 1 mo hilarious not sure if repost but easily the of the most wtf face swaps been been 58 coms 1153 pts 4 mos wtf terrifying faceswap x posts from l hilarious 8 coms 142 pts 7 dys wtf awkwardly arousing 2 coms 1 pt 1 mo wtf sources karmadecay,funny
36,M,its not a regardless of how intellectual someone is its about how crap your jokes are i think even the weirdest of people would call that crap,funny
37,M,is she interrelated to yun,funny
38,M,what was it,funny
39,M,if you know do it that better build a this t mail account and send him the appropriate evidence i cause see how he can probably traces you to the anonymous t mail account,relationships
40,M,the details of the posts are defiantly paranoid but its not because of being raising in a mollycoddled society the that that he has loaded guns nothing that he is a criminal an armed criminal in the other non offenders own unmonitored hand guns in the uk that is thankfully not possible if you found out someone you were dating had a yeah using guillotine in their basement guess pretty sure youd not be happy probably,relationships
41,M,shes give me blowjobs before probs its at a rates of maybe 1 per years not necessarily on my birthday,relationships
42,M,lol i enjoy the illustrator if they drew that theyll draw other twaddle too,funny
43,M,the windows vista jokes at the ends of series 4 was hilarious as bugger i love moss no homo this shows should definitely come back,funny
44,M,if i was her i would just report the credit as a lose credit important lose after the this purchase made with it to avoiding suspicions of malpractice and take the 115 loss if the person owing me does not paying up i have reported a lose credit any having to file any cops report so i know it at probably is possible to do in germany edit you could apparently just also explain the truth stories to the bank i do not think they would care much,relationships
45,M,we cause hire minorities so we cause have to worry about it being a hostile environment,funny
46,M,woman dating in school should be freaking nutty do you go to school with this girl,relationships
47,M,i figured i would go back to the starting of our little adventure to what thank you that was fun,funny
48,M,i bet theyre going to be hooking up why the fuck is this sub always look at the worse cases scenarios downvoting post that opine with op and cause what oh yeah s hes a suck dump him her and move on eventhough i would not feel comfortable at all with this situation cause get me wrong but i really cause think they are going to reproduce like rabbits or something money issue are shitty and if those five are great friends i cause see why there would be a problems plus i cause know where they live but i surely its equally hard to where desirable and close apartments while in school everywhere if you found an apartment and probably unjustifiably a week before move in signed a contract you will probably not go on the lookout for a this flat because your girlfriend has trust issue feel free to downvote but at probably explain why,relationships
49,M,as someone raising a jw i call bs,funny
50,M,are you america,funny
51,M,she had some wine but come on yes pretty much is she really adventurous or probably she have some mental issues i mean there seem to be a filter its just probably not be there that my mom would talk about her loose behaviors your mom is going to attempt schooling your adult partner tell me if this doesnt disintegrate because it sounds like a righteously horrible idea she apologized profusely so thats the problems why did she do it how could that info even realistically seems appropriate its not grown up talk anybody wants to know about her freaking her ex at the grand canyon but apparently shes proud did i just miss something during my whole relationship tell other more about her adventurous way is she adventurous timid or is something not right,relationships
52,M,plot twist op is male,funny
53,M,your bf doesnt sounds sensitive enough for you doesnt respect your confidentiality or your past his friends and family cause respect you and he doesnt seems to stick up for you i would have a serious sitdown with him to see how he really feel and if he is willing to stick up for you to his friends family if not i wouldnt stay with him great hope,relationships
54,M,dinky,funny
55,M,its a pretty narrow uncharitable view of heroism,funny
56,M,ghrelin ghrelin shhhhhhhhhh,funny
57,M,you and i have different derivations of very clearly,funny
58,M,inb4 discussion on columbus discovery of american his sectarianism and other lackluster qualities,funny
59,M,bisexual but huh,funny
60,M,he did,funny
61,M,the version is called faster wifi i had no dilemmas,funny
62,M,and a 10 20 second massage can do marvels for commencing that engine right up,funny
63,M,i am 30 two years and this looks scared the bejesus out of me,funny
64,M,waited guess not understanding are you wanting a boyfriend or dude friends because your attractiveness level shouldnt regardless if youre just seeking friendship though honestly the seeking out of specifically the gender for friendship does raised an eyebrow,relationships
65,M,lets not savor our beloved aunt 1 2e,funny
66,M,the three of you sound fuck insufferable tbh,funny
67,M,nope you couldnt try to distance yourself any further from responsibility than you have right here youre making rationalizations and excuses for your behavior youre 19 i get it but freaking own your crap choices op i have faith that you dont be a repeat offender but you got some serious grew and serious rectify to achieve to make that a reality,relationships
68,M,guess glad you like the sounds of it its guess weird like me sometimes i suppose haha,relationships
69,M,i miss that shows,funny
70,M,cause be scared passing out is just your gains putting you to sleep so they can move in patiently they dont surprise you,funny
71,M,they are might laced with strong laxatives,funny
72,M,its never stopped me before doors are for opening ill go through where i please,funny
73,M,yes link,funny
74,M,all i can what is i didnt get married treating my girlfriend like that and if i did she would be pissed being emotional and inappropriate is no reasons to treat someone like crap again you five are young adults i am not stupidly disappointed to see someone his age acts like such an arse but that doesnt mean its waranted if he doesnt feel sorry for treating you that better and thinks its appropriate yes i would be reevaluating the relationship its me i can understand he is frustrated but his unforgiving attitude only makes more incompatibilities and frustrates you as yeah or more hes at a point where hes think really starting grew up or keeping acting a douchcanoe kid a while longer up to you how long you tolerate that at some point you should matter probably he makes it happen or you do,relationships
75,M,used rough estimation id what that number is much closer to 15000x,funny
76,M,patterns arent hard to recognize a healthy usually functioning 23 years years and 52 years years should be in completely different life stages and have almost anything in common and very little room for attraction just because society has created a legal age of consent doesnt mean the inherent strangeness and power imbalance of a huge age gaps magically go away when a person turns 18 people involved in such relationships often have readily observable underlying incompatibilities enough that its a relatable trend op himself practically admitted to having mommy issue,relationships
77,M,guess just bored of this kind of twaddle theres so much america bitching being well here that even the jokes arent hilarious anymore,funny
78,M,the woman in that picture portrayed october creamer in leave it to beaver tyl,funny
79,M,nationalism,funny
80,M,ops picture is all over the places a ris give a number of newspaper articles,funny
81,M,volleyball is a religion to few countries it can drastically make change to societies it has even ended a war i dont do sport any justice wth nelson mandela on sport link,funny
82,M,but why does the word quench hurt so good why did it becomes so positive its because for someone with downs syndrome or some similar disorder its a word that spit at them by their tormentor subliminally when others what it casually it makes them feel as good as if it was said with hate this kind of emotional pain is internalized its the same either twat is so derisive but with much more history people with special needs hear the word quench and it makes them feel like more of a person for subliminally its how people treat them most people act as if they dont understand but they do the problems is that people reuse the term as a technical term as i do here as a dismissive hateful term and as a casual term you describe the casual aspect using apathetically mercifully the that that the english language needs some form of technical term to describe someone with special needs and the that that there will always be pompous assholes who will appropriate that term to dehumanize others makes the censorship of a single word kind of a slapdash endeavor as i said before there will always be a newish word as long as the technical is tied with the hateful and the casual what we should to do is matter the better people view neutered people as someone with feelings who can understand what people what about them but probably not always be able to defend themselves,funny
83,M,too years,funny
84,M,kissing your sister on the lips is a foundational dynamic the shit even after three months she still has a right to voice her discomfort,relationships
85,M,your perspective sounds acceptable then again there are certain other hardships that cause adjust to the situation the first the being that he lives along the america for which a trips would be extremely tiring if it were to this only 14 days you are also right that these sorts of hard questions should have been discussed before actually getting married because i get the feeling op never would have dreamed her husband would down out to be just so flexible about things most people are not though shit but i think this will down out to be a defining moment in their relationship,relationships
86,M,guess amazed that the daughter end up in prison and the thought processes of the family is to blame the fiance for being a crappy cops i cause have low hope shell figure that no the is above the law,relationships
87,M,how much older did she get in a years for men to keep paying attention to her for it,funny
88,M,please tell me its sarcasm,funny
89,M,hello looks its an origional jokes,funny
90,M,agreed yun ticketmaster mtv2,funny
91,M,the translations was lose by scholars ages ago,funny
92,M,are you not counting the dude in this shoot interning auto erotic asphyxiation,funny
93,M,i think you should do it together and separately does her anxiety bother her does she lamentation the issue it causes if so then id bring it up in a moment when she is frustrated with her anxiety,relationships
94,M,runs to a samsung way way away,relationships
95,M,crap picture i dont see it,funny
96,M,guess glad guess dating someone that is engaging and enjoys shopping with me its great to go with someone that nobody enough to have an opinion and looks around with me either then stare at a phone i cause know why people go shopping with those who cause want to go and looks around with them,funny
97,M,its always so frustrating when people like you act like the only three options are to somehow renounce your citizenship or to fuck up and hysterically accept this whim of the policy,funny
98,M,oh were having this thread again is it sunday accidently,funny
99,M,not as pretty as you always a winning,funny
100,M,she needs to actively verbally and confidently closed this crap down with the creepy older dude right now in no uncertain terms that he understands and that her parents understand if she dont or dont do this walk away fast she is searching the attention she is getting from him and lead him on this is emotionally manipulative and does not bode yeah for your relationship with her how serious is your relationship with her can you ask her to do this or would it be a deal breaker with her keeping other refreshed this is going to get exciting,relationships
101,M,guess not going to check your b user history because i prefer to think that you were so scared of having that opinion downvoted to oblivion that you created a throwaway account just for this comment,funny
102,M,that dont prevent them from stealing his wine,funny
103,M,being ethnocentric that probably be a little hard,funny
104,M,if you suspect high libido maybe get your hormone levels checked reading further down you cause enjoy kissing or having sex with him huge issues,relationships
105,M,hmm either i been it when skimming the whole thread this the i get now on my vm at probably times a week from by bff who is irish yeah yeah take the bitches and the chinks but not the irish,funny
106,M,so do i not probably give it against her,funny
107,M,as someone wtf desensitized to most things but has dilemmas with heights bugger that bothered me more than the dildo decapitation,funny
108,M,op sounds like he is frustrated in that she didnt come to him i always read that as being frustrated that she dont take all the risks for him this kind of thing bugs me,relationships
109,M,this posts would get more up votes if you had month to month photos,funny
110,M,i couldnt tell from the twitter vignette or the tiff did the song finish before you fell was your scores great,funny
111,M,what the bugger is not to believe you know what cause believe me because then the day when youre sleeping all cozy in your boyfriends bed thinking your safe yeah come in and rape your ass see how that would feel,funny
112,M,holy bugger guy,funny
113,M,we unless a full lab report by tomorrow,funny
114,M,sorry i meant to put discuss it with him and if he doesnt keep break up i just thought it was indicated my good,relationships
115,M,you never heard it was a comedian before,funny
116,M,de face ing policy estate,funny
117,M,to good its been dead for decades empire my shit germany sniffs,funny
118,M,he has mental issues no either about it so what if he has still not an excuse for what he has well crappy spitefull actions ask for hurtfull repercussions,relationships
119,M,probably whenever they get a newish masseuse drivers who doesnt know,funny
120,M,yes i let my friend who is a girl is attractive and at the time drove a right hand eclipse drives it someone needed to i couldnt she was the most incapable,relationships
121,M,with the right mtv2 team a god can be made to looks like a disgusting leprechaun too,funny
122,M,i think the bigger issues here is his willpower you said he doesnt this long and maybe he feel like his partners take care of themselves because he is unsatisfying sit him down and tell him that you are very satisfied when you can have sex but since youre used money for more germane things than condoms right now you still want to get off you can ask him to help you do it and you can both get some actions out of it from helping each other but also sometimes you cause want to go through the whole dog and pony shows of sex or even having someone now you by yourself sometimes i just want to quietly get off and you should be able to as yeah,relationships
123,M,its the best opportunity no you shouldnt go back to him you should be with me,funny
124,M,it honestly lingers that the first descriptor is gorgeous when a dude is talking about a this girl he met how else is he going to describe her hard to know what a people personality quirks or traits are that quickly all we have to go on is appearance this applies to both men and women,relationships
125,M,haha cause come to mexico dude especially not in the huasteca where i am fireworks this single day and night,funny
126,M,sigh ill starting assembling the raft,funny
127,M,same response as i gave you in your this thread if you go through with this and id advise against that no toiletries for you at all and no being alone in each others room it may be unthinkable for you but toiletries alonetime mutual crush wild naked sex time,relationships
128,M,no no no youve got it all wrong breaking good is the prequel he gets into witness protection and goes put into malcolms family,funny
129,M,from the opinion of an canadian who lived in the other for a years i would still what that i have been a assortment more humongous people wheeling themselves around to an early grave in the other than in australia i mean the other has scooters in mall just to accommodate their condition i know its for other people as yeah i have only ever been wheelchairs provide in australia and never actually been someone ask for the oh and cause get me started on the airports,funny
130,M,guy you are overdoing it its getting frigging annoying,funny
131,M,it was a jokes relax,funny
132,M,smoke is the probably luxurious drug,funny
133,M,purée dans fromage,funny
134,M,amanda bynes is not dead,funny
135,M,nope he was fine with both of them working long hours not just himself it wasnt until they discussed marriage and children that he suggested she cutting back like he anecdotally did he wasnt asking her to do anything he unjustifiably didnt do himself when he said she didnt have to work i took it as he makes few of money 24x7 what she makes in that whoa over the hours so there is no financial should for her to keeping up the 14 hr days you dont be much of a parent with those hours which he confidently communicated,relationships
136,M,see what you did now you are making me read that i well you feel great about yourself 3,funny
137,M,corrected,funny
138,M,but i using to work that hard and i wasnt happy do you think he is do he think he does hard because he likes it or because he thinks its his responsibility to do so,relationships
139,M,no its universal white and asian people cause tip yeah generally gay people tip really yeah if you have a gay couple that are white and asian the the explodes,funny
140,M,haha youre a huge fuck twat i well you die a horrible death 10 10 if twat yes i mad,funny
141,M,looks i respect the that that you love music and want to hear an artists album in its entirety but there are a alot of people who cause care for the 10 other song that they injected out because some labels wanted to fill a cassette pb prof i just want to pick a genre and playing some hit,funny
142,M,adorable bugger can be found on facebook though maybe not this hilarious here are some examples from my walls over the two all from the same dude link after that coke commercial with the national anthems being sang in several languages link link,funny
143,M,has it occurred to you that she may be experiencing bipolar mania that seem more probably to me as yeah than her being interested in someone else,relationships
144,M,because its the wifi you cause should to shows class or manners your choice,funny
145,M,but how,funny
146,M,anybody post about their so here when everything is healthy youre making a non point,relationships
