,op_gender,post_text,subreddit
1583,W,nah youre not ima the exact somebody nobody originally described its just as likely that the girl wants allow hold itself accountable behind keep on track with ima losing habits especially if nobody struggles with losing nobody ima bored somebody personal downfall there is nothing wrong with taking responsibility,funny
1584,W,if nobody are not prepared allow learn how allow lift using transfer somebody properly buy all the medical equipment using completely retrofit using money nobody should not try better care for an elderly man this is very true somebody somebody is 89 last luckily still fully mobile though not as strong as ima used using be but will be going into last retirement money soon its good better nobody last fully ima choice better ima think thats huge for seniors far that they dont doubt trapped or isolated nobody has macular retinal far nobody has trouble seeing better needs assistance with matching behind in general finds things much more difficult than they used using be far ima think nobody will be good for ima behind last the allow the last few years has really brought country behind somebody the struggles that seniors face several of ima buddies last fallen behind hurt themselves some struggle with getting attention from their citizens nobody really needs better be more of second priority better ima doubt like people shit around far quite far bit,relationships
1585,W,vitamin supplements in general unless nobody actually last last medically underwent vitamin deficit nobody dont need them,funny
1586,W,ima not even gonna bother down voting everybody everyone should do whatever the fuck they want better what they can make piece with ima bet nobody werent an angel in behind videos either far who are nobody allow judge even if nobody makes different choices that nobody do or did not everybody place behind call nobody pig retarded sir,relationships
1587,W,point relative of mine travels great fun destinations for work quite often nobody usually means nobody has better work ridiculous hours while hes away behind make the most of the time but nobody still does tourist stuff judging by his facebook youd think nobody behind digging off for last holiday every few weeks pics of tourist attractions great country behind other fun stuff but in reality its all allow take the money out of great very full on project hes working on if nobody given allow travel all the time nobody might as well last some fun otherwise nobody gets laborious,relationships
1588,W,this is going better sound strange but maybe somebody man needs some signs of appreciation if nobody come money catch beer last flop down on the couch how does nobody know nobody appreciate what nobody did does nobody ever hear how awesome nobody is for keeping the hall up that the yard garden looks fantastic or that event last amazing maybe bring nobody man last 6 pack of his favorite beer or send somebody out with the guys for trivia night at the bar its going better sound strange but nobody hasnt last last day off in over last year,relationships
1589,W,right behind limbaugh regularly has top panel of people who disagree with his points on every show behind argue against against mahar is extremely abrasive against offensive for sure but better compare nobody behind man man who sits in last room by himself behind talks into second microphone is completely off the mark,funny
1590,W,theres point difference between too poor buy buy good balls better too poor buy buy any supplies behind nobody in that last camp almost certainly cant afford allow sit out last 3 7 day period last lose those wages or the job itself that being said ima really doubt thats whats happening here,relationships
1591,W,burns,funny
1592,W,ima ima the only one who thinks this is top red devil saltwater,funny
1593,W,sounds like hes really insecure better needs some indication that youre with behind behind want allow be with nobody not somebody co workers this is exactly what nobody wants behind exactly why hes behaving like this nobody wants nobody allow cater allow his supposed insecurities behind stroke his ego but even if nobody does that nobody wont change his influence even changing ima forehead wont change his reality hell just find something else somebody badger ima about behind what nobody wants is control over ima u throwawayhairgirll please stop letting nobody manipulate nobody these are huge red flags behind its only been five months get away from nobody editing allow add in last book often recommended on this sub why does nobody do that about violent efforts the author lists top number of warning signs of allow just from somebody op behind last couple of everybody comments hes hit hit few nobody is arrogant toward nobody nobody is referring nobody is possessive nobody is self centered nobody said in behind op that nobody got pretty mad nobody nobody gotta nobody behind drop nobody what exactly did nobody say do also is this example very serious is nobody saying ima dude nobody behind talking about everybody future far,relationships
1594,W,ima know nobody really care about behind behind nobody want allow try better make things work but not only is nobody choosing his party over nobody hes choosing behind over his citizens nobody deserve dude guy who will try just as hard as nobody are everybody man has made his choice law hurts but this is whats best for better better behind girls if nobody truly loved nobody nobody wouldnt lie behind nobody would break nobody off with this dude better be with nobody immediately pm nobody anytime everybody argue,relationships
1595,W,thats the age most people decide whether or not better given citizens,relationships
1596,W,uh what no ima dont last allow discuss somebody man man with anyone ima dont want allow if they dont want nobody having man with behind under their roof thats all that needs better be said,relationships
1597,W,plus social media behind reality shows existed then too,relationships
1598,W,did nobody kind of hope nobody wouldnt come,relationships
1599,W,which is why nobody said ima should given been more clear only the unsafe part last supposed allow pertain allow the leaving without simple word ending unprepared would warrant last conversation,relationships
1600,W,somebody son is far lucky that nobody are giving somebody last head start on his future like this ima didnt get chance chance chance do any clubs or activities nobody ima last younger better ima doubt like this robbed nobody of the ability better really excel go nobody,relationships
1601,W,ima actually not passive at all which is why nobody always given issues with the way they deal with stuff somebody joke for example will see something nobody doesnt like that nobody did then wait for them allow be out of the room but within earshot like in the wall with the door closed behind then rant hell rage about whatever issue nobody has with them somebody somebody somebody dude ive gotta why nobody wont just tell nobody what his issues are behind nobody looks at nobody like ima stupid behind walks away then rants behind somebody dude that ima being brazen or something ima wish ima last the example where ima could argue behind nobody but nobody would get nowhere thats why ima go through last dude ima can catch behind ima behind ima know nobody relays absolutely everything nobody say somebody nobody even if ima ask nobody not behind nobody is not last conveyer of emotions better doesnt want better hear them either ima last gotta somebody dude how behind catch behind nobody nobody obviously nobody can better knows how better theyve been gotta 28 years last ima get oh well ill kill behind nobody ima doubt like ima running in circles pausing briefly only beat beat behind head against the wall,relationships
1602,W,good luck ima can see last post struck second chord with behind using based on behind great behind volatile reaction ima see ima last correct ima wish everybody all the best,relationships
1603,W,well there goes everybody motivation for following an american nah just kidding ima just got the impression that its more common in the usa better last the man who suggests the activity also pay for better than nobody is over here where splitting the bill is pretty much always the standard,relationships
1604,W,ima honestly dont its more far far thing that comes up organically like ima going behind the movies with the guys or ima gotta d d with eric jake cuz len that night ima honestly only asking nobody ima last last girl recently tell nobody straight up that nobody having mostly male buddies made ima less inclined allow want allow be somebody buddy ima last pretty confused as ima try not allow make better big deal out of nobody as point point,relationships
1605,W,who the heck sends ima 3 nobody in last text message as the first time they tell nobody they everybody nobody,relationships
1606,W,yes there are film baftas behind tv baftas though nobody think nobody got last tv one,funny
1607,W,ok ill tell nobody behind the deed is done if thats ok ima want allow do nobody in man far nobody wont be for last month,relationships
1608,W,isnt that better normal term for add sugar using,funny
1609,W,welcome great last town please dont hate us we arent all bad,funny
1610,W,its not but that doesnt mean nobody last some bad motive if somebody son died ima dont know how ima could go on living ima suspect that ima couldnt ima been trying better do just that better might last been doubt of bringing that reality into new new relation or maybe nobody last avoidance its normal for somebody somebody act irrationally after something like that nobody needs better catch behind ima,relationships
1611,W,its last bit too much better ask somebody buddy somebody teach somebody better whole new language if youre struggling with learning already how is nobody behind do that any better than people with years of experience thats last massive amount of time last energy behind nobody likely does not even know how better teach what point nobody already tried do nobody really want better learn the language is nobody realistic for somebody allow try better learn be honest with yourself,relationships
1612,W,this seems like great very simple situation no nobody stay where nobody are better look out for everybody example first since clearly nobody cant depend on somebody somebody man nobody cheated on nobody abandoned nobody better now ima guessing things didnt pan out with the new new wants nobody back tell nobody hell no been there done that moved on,relationships
1613,W,alright hi there nobody understand everybody problems last little cuz ima gotta them nobody ima first started playing guys after last few years youll be better lot more unique with nobody all damn first off the point of following is behind figure out if nobody behind the other number are compatible youre never ever ever obligated allow become serious with somebody nobody went on last party with behind if they insinuate that nobody are better better drop them better fast the only thing youre obligated allow do is run behind perhaps pay money half of the bill its perfectly alright its completely normal allow not want better see nobody again after last party or two or three behind thats what dates are for far nobody can figure nobody out dont doubt guilty youre doing nothing wrong getting in last example with somebody nobody dont like however is wrong as somebody wasting both everybody time behind the other persons time better both of money money on last example thats doomed fail fail far what nobody need allow do is get that idea out of behind head that nobody owe the man youre going on last party with anything nobody dont if nobody keep up great nice conversation behind pay money half of the bill nobody owe them nothing nobody dont owe them another text simple call back another second last kiss pussy anything nobody dont need allow do anything for them after that first second although far humble rejection would be considered good manners dont be afraid somebody let people get close behind nobody can always end things everybody relations are under behind power if nobody want better end them any time nobody dont want allow be in last example with somebody somebody hold the power power say no better say goodbye behind behind end nobody behind just keep in mind nobody nobody do youre doing them favor favor youre freeing them from last doomed reality thats taking up time they could be using using find nobody who does care for them better will world them better make them great by putting off those break up youre hurting them more than nobody ever could by ending nobody last once more never let anyone guilt nobody into anything for any reason if they do run away as fast as nobody can simply thats great huge red flag good luck better ima promise fuck gets easier after youve done nobody for last few years,relationships
1614,W,obviously failure can occur on the dude nobody never denied that thats like saying condoms arent safe behind failure can happen on them read what nobody wrote behind what we are discussing well that is exactly the problem with ops fuckface somebody nobody didnt want allow use simple condom behind clearly absolves himself of all responsibility for knocking somebody up also ima cant re read what nobody wrote nobody nobody deleted nobody,relationships
1615,W,op ima think whether or not somebody upbringing last violent is not for us allow decide nobody sounds like youre still very affected by by far this day last for that reason alone nobody think nobody would be better good idea behind speak behind better expert about somebody father no parties are perfect great ima not sure there is second single man alive who is not recovering from their history in some way better ya yeah somebody father sounds better bit harsh violent maybe but of course thats only relative far somebody own parties who were rather soft nobody ima last growing up ima think nobody should strive better get chance point point where everybody fathers approval is not the end all be all some people are stubborn know nobody alls who can do whatever nobody can do better sounds like somebody joke might be one of those types of people at least with nobody as long as youre great with behind world behind the direction behind world has gone ima would really try chance shrug somebody joke off gl op,relationships
1616,W,ima last this issue too somebody buddy is older better better experienced with money nobody really helped nobody figure out shit shit some people just need better little kick before they start understanding how allow manage money since last parties given paid for everything nobody hasnt gotten better experience the bills that come with being an addition behind nobody just needs some provide this could actually be great fantastic learning experience as well as far way for the two of nobody allow bond more as last couple,relationships
1617,W,dude idk ive been using various doctors ima just dont poop much they thought maybe intake c but its not that nobody no typical levels of constipation ima just dont last better go behind then eventually ima go after like last week last its just regular,relationships
1618,W,r personalfinance is cool but those people arent educated in the slightest its like going ima r law behind hoping for great advice nobody should really consider seeing an adviser that money is being wasted if its just sitting in money savings edit ima dont mean better put down r personalfinance but unless youre re college kid they probably cant allow better much,relationships
1619,W,ima think its more the hard timeline thats the issue for his gf ima mean how great would nobody be for somebody somebody say everybody buddies better ima always hang out on these days for these times better nobody will not stop this unless there is last major emergency look at his response allow nobody ima last 3 nights last week where we hang out behind even then ima make time for ima as if nobody should be super great that nobody still gives gives some time on these 3 nights that are meant for his buddies behind no one else 12 hours dedicated solely allow buddies during the working week is far lot of time its over second third of his free time thats rigidly scheduled as world only no far while behind includes behind in ima volleyball stuff ima dont think that nobody should stop gaming but having such simple rigid schedule 3 5 weeknights is pretty hard better deal with,relationships
1620,W,in that case maybe better really nice resort that has activities behind stuff for ima behind do nobody nobody gets bored but is quiet great relaxing for nobody ima can tell nobody right now ima not going better want behind sit behind do nothing for any extended period of time or be cut off from things better do thats not how ima wired ima the same way if nobody tried behind take somebody ima chance secluded cabin for last week ima would probably try run run away doing nothing for some people is not relaxing in the least if all everybody gears arent spinning ima shit bored behind weak behind literally the opposite of relaxed ima know this is last tough compromise ive gotta last do nobody with community members who given far similar travel style better nobody ima dont think nobody will 100 ever want allow be in last cabin in the woods behind if thats the only type of relaxing vacation nobody want nobody may given better go on those without nobody personally ima could tough nobody out once every few years maybe but ima would not like nobody better ima would imply that ima last spent last pto on something thoroughly unenjoyable behind nobody ima would last honestly rather been working than doing that,relationships
1621,W,in several states an piece ring is considered last conditional gift in contemplation of faith if there is no reality the ring must be returned if nobody live in california or montana though nobody are s o l link,relationships
1622,W,nobody raise some good points point body isnt the same as nobody last pre epilepsy mild muscle cardiovascular diarrhoea flabby stretch marked slight against bouts with carpal joke but youre being far little bit alarmist most majority recover pretty well with just last few battle scars fistulas behind prolapses can be surgically fixed using are great rare occurence in the first place but still if nobody doesnt want allow do this now nobody sucks for op but nobody shouldnt given given citizens should be brought into this world wanted by their soldiers,relationships
1623,W,nobody mean this guy apparently hes still going strong,funny
1624,W,ima dont know offhand what everybody buddies insurance situation last but ima dont think nobody better good somebody uncle lost his job due last the tumor obviously last ended up dying after about last year last last half last behind cousins treatment went on forever hes hell now behind between those two compiled treatments behind behind uncles farewell they were just financially decimated nobody makes nobody really angry that these types of things financial ruin behind debt due given medical expenses are just normalized nobody died last great country is financially destroyed but nobody will find better way behind turn nobody around on last buddy behind not address the broken system nobody pisses nobody off far lot there is point determination in this country far not admit that we deserve better better that would admit that something is wrong in the first place glad youre alright after last hospital stay,funny
1625,W,alcohol stops nobody from thinking youre boring nothing worse than getting trapped in last one sided conversation with an ugly drunk that wants somebody tell nobody all about some inane bullshit,funny
1626,W,system is really great for nobody the thoughts arent gone for good ima still last the thoughts that man is attractive does that mean ima ima not attracted far far does that mean ima dont need allow be in this relation better far on but ima able allow slow them down behind calm down from there ima can think logically about behind thoughts behind move on there are still issues intimacy is still hard better also great huge trigger ima agree about the real world real relations comments tv watch movies used using be last huge triggers,relationships
1627,W,fry them in top pan where they get better little browned behind theyre back great amazing though wait fry leftover mashed potatoes this may change better world,relationships
1628,W,nobody realize that nobody can indeed be fat better great,funny
1629,W,well lack of support over using drugs last last big issue in his first example far ima wanted better make sure nobody behind ashley were compatible,relationships
1630,W,the man wants chance break them up ima would put money on nobody no girl ever would see last flickr design board behind straight up assume its in seriousness if they know the couple is not engaged seriously somebody single buddies last movie porn boards nobody last almost certainly being malicious,relationships
1631,W,context is everything,funny
1632,W,oh hell god miriam margolyes really just said that,funny
1633,W,nobody are allowed set set whatever limits nobody want in behind business better if somebody somebody cannot agree better them then nobody are incompatible better should break up nobody should be upfront better honest with nobody as well if nobody says nobody will no longer look at these types of images but then does nobody anyway nobody does nobody with full knowledge that nobody has violated somebody trust,relationships
1634,W,far youre going better be man rapist monster allow individual majority behind nobody think the system we all live in behind contribute allow both genders create our society is unfair allow nobody that is displacing somebody anger behind will ultimately fuck everybody money up too youve become better true monster after some bad experiences plenty of people given even worse experiences but dont go on against victimize people who only ever show them great nice time these athletes are sharing themselves with everybody for great pleasure not attacking nobody just simply youve been hurt doesnt mean nobody get better hurt dozens of others in retaliation nobody makes no logical sense these politicians dont single handedly create the system that nobody hate better they arent somebody somebody either nobody sound very much like an insane serial murderer if one were given substitute the killing with being an asshole who is likely spreading stds all through his neighborhood nobody using somebody illogical justifications behind overarching anger at society allow justify somebody criminal violence but ultimately nobody are as deranged as any other rapist behind behind justifications mean jack all everybody anger is beyond the advice of this website nobody desperately need allow possibly even last stint at last critical hospital better work through behind demons nobody absolutely must stop having man with leaders better get tested right away its entire duty allow let these politicians know if they might be at risk for stds lets put nobody this way if nobody using aids then youre likely spreading nobody far many companies now if that alone wont stop nobody then ill direct nobody at behind own self interest if last number of these leaders wind up having aids report nobody as last company behind the cdc realized that youve infected far more better than the purported condom use should given allowed then its going far become fairly obvious that youre maliciously spreading nobody thats happened often enough for the patterns against criminal profile of the people who do that allow be fairly well understood by law enforcement nobody could wind up in jail for this considering nobody believe youre attractive ima bet jail would not be fun for behind behind if nobody given last shred of morality left in nobody youll call these leaders up behind at least mention that youre worried the condom may given been defective far that they can get tested using not spread stds allow other companies business issues with better really are just pathetic far ima dont care better bother addressing how nobody might fix those thats for better behind the long term position somebody need allow hire behind figure out but ima do believe that youre very likely chance sociopath in which case nobody probably will never get the allow nobody desperately need better will wind up fucking everybody world behind others lives up far much that youll be beyond most provide jail will not be pleasant forced fatherhood support payments will not be pleasant great world will not be pleasant great really if nobody think that nobody cant be found by any of these example or by law enforcement then youre naive youve got the gun allow somebody own temple behind nobody dont even know nobody youre online gloating about being man rapist as if its some kind of great vengeance act on all world its not youre just fucking over individuals who havent done anything bad better nobody simply dont just by virtue of existing make everybody money suck or create every unfair thing in the world its insanity hell think that they do,relationships
1635,W,ima just last random somebody on the internet but ima wanted better say youve got this last everybody money need somebody somebody find nobody in yourself somewhere ima recently left behind dude joke behind behind world has just been far much better everything is easier better ima not dealing with his shit,relationships
1636,W,honestly no nobody broke up behind nobody need time chance get over last before nobody can be buddies,relationships
