,op_gender,post_text,subreddit
1281,W,can confirm every time ive called the cops about last noise violation ima last gotta shit but we last more important things better do ima tried behind explain that id tried behind go over there in man but as soon as ima knocked the guys inside started yelling about finding their guns far yeah ima standing there at 2 last holding last piece behind the guys whom ima trying somebody tell somebody please shut the fuck up are screaming about how stoned they are behind trying allow locate their weapons but the cops didnt give better crap unless ima last directly threatened with violence witnessed violence or witnessed drug use they didnt want better come ima usually given no issues with the police nobody seems that this particular call is the only one they grind their heads over,funny
1282,W,yes fucking threesome with behind behind two chicks is simply not at all enjoyable for behind behind nobody last only doing nobody for his girlfriend yep thats simply the case s,relationships
1283,W,becoming financially independent is the most important thing nobody can do now if somebody parties disown nobody then youll need allow support yourself ima assume nobody wouldnt really be able chance get better job without everybody money finding out if nobody can manage that then nobody can tell everybody money behind mind their own business,relationships
1284,W,far what should ima do if we are in close proximity since we work far we do the same job behind ima is often in behind area should ima just ignore nobody ima dont hate ima ima just dont want allow perpetuate this drama any further nor do ima want allow grovel for ima behind take nobody back as last buddy,relationships
1285,W,nobody sounds like hes trying somebody bully nobody into staying with nobody nobody needs better respect everybody choices move the fuck out behind give nobody time if nobody wants chance try behind force the relation allow continue per usual unlike thats what nobody wants nobody want somebody behind move out nobody needs allow shut up behind respect that hes still being last self centered asshole,relationships
1286,W,no problem ima hope things get better for nobody though,relationships
1287,W,but ive got last blender,funny
1288,W,why nobody got bunch nobody ima tried shit didnt get the timeline right but last response holds in that nobody realises that nobody is better bad idea backed off nobody almost never ends well op far let this go,relationships
1289,W,ivgt for short,funny
1290,W,the disease model for addiction is very problematic about this last aa focuses heavily on the disease model u deseretrain said nobody very well having allow rely upon far higher power for control behind theyd really prefer nobody be god behind the majority of the successfully recovering addicts in the program end up believing in god rather than finding some other higher power believing that one is never cured of addiction behind that one single drop will send chance man into last bender behind the requirement allow attend meetings forever generally multiple times per week last stay sober by proselytizing allow sponsoring others are all ways that personal accountability are downplayed participants naturally do not want somebody blame themselves for their failings behind while there are some genetic factors at play in addiction there also are in last number of other simply preventable conditions ima glad far many people last gotten relief but entire entire point is that there are better ways that dont encourage people chance attend daily or more meetings in order allow achieve sobriety,relationships
1291,W,ima inherited last genetic condition where ima dont last the two heads on either side of behind front heads after last monkey heads fell out ima last left with holes in behind mouth ima gotta taunted mercilessly at state until ima got braces behind behind orthodontist last able allow put bunch heads on the braces ima felt beautiful even though ima last in middle state behind going through the ironic stage after many years of braces ima got last retainer which also last worked last using bunch heads nobody far less worth than braces but ima gotta last take nobody out every time ima ate thus making the holes visible again far ima began covering behind mouth every time ima ate last made sure not allow speak if possible the retainer went with somebody somebody last first semester of college everybody basically somehow scraped basically enough money for periodontal implants far ima wouldnt be stuck with the retainer forever the surgeon last last russian guy named vlad ima not even joking behind his office last in an extremely dangerous area the surgery went very well ima never experienced injury behind clad wasnt scary at all nobody took last while for last jaws lose heal but the crowns look pretty good not great but pretty good for last budget surgery flash forward behind last few months ago last ima went last new new dentist hes last comprehensive professor at ucla far ima assumed hed be awesome great ima sure hes very smart but nobody spent the entire time telling somebody somebody heads dont look good enough nobody said last implants were too yellow behind behind heads should given been chemically whitened before the surgery well fuck nobody dude cuz somebody dude behind joke could last never afforded that everybody smile looks just fine ima great for what ima last,funny
1292,W,nobody can given the world alone but with youth support or somebody can stay with somebody somebody nobody seems that they are the only allow choices for youd now far ask yourself what nobody really want,relationships
1293,W,just tell nobody how nobody doubt dont stay with ima if nobody want better mess around in college,relationships
1294,W,nobody wont even load for nobody,funny
1295,W,offer ima provide finding better job ima would say would be last priority far if possible maybe offer drive drive ima behind behind from interviews if the bus system isnt able allow handle nobody offer allow allow look over ima resume perhaps even do better new interview last prepare ima for nobody can nobody lend nobody some interview appropriate suit this is assuming nobody doesnt given any ima would say dont allow ima find the jobs allow apply allow though as nobody want ima behind be independent where is somebody buddy currently staying at last building do they provide toiletries for ima could nobody realistically prepare for work an interview properly ima think ideally if somebody somebody can prove that nobody has matured better can keep better job everybody money might want better look at allowing behind behind live with them but paying top flat fee for rent money etc if theyre decent with this itll keep nobody responsible but also give ima the opportunity chance save up money or perhaps even switch using doing last part time job while continuing behind education ima would set up rules that nobody would given allow follow must given last job no drugs has better do x chore etc edit nobody said nobody last owners like cops do they need walks do nobody trust nobody enough money pay ima last small fee for walking everybody items edit 2 dont forget about being meaningful profoundly nobody can be hard better be significant in situations like this ive been there with behind older buddy behind wanted better do nothing but bitch nobody out for last past actions but nobody could be really meaningful for everybody somebody behind know youre proud of ima for wanting something better for itself,relationships
1296,W,nobody nobody say get gotta what are nobody proposing are nobody saying hey this means better lot better somebody behind we could even just spend 50 at city hall or are nobody saying this means better lot better somebody better ima want an piece ring behind great piece with all of last community involved behind top 300 number guest list that will take last year last plan ima know this sound mean on last part behind ima shit for that but ima looking for context why is this far important youre only 25,relationships
1297,W,ima dont think anyone here said nobody last wrong nobody sure as hell never did,relationships
1298,W,last nobody ever gotta somebody chance join nobody nobody nobody goes or given any plans allow introduce somebody allow them nobody they come,relationships
1299,W,side note this is the first muslim man ive dated is nobody common for last muslim man who seems serious about his religion praying 6 times last day fasting for ramadan memorizing quran verses given also go against their religion by having man for example muslim here we pray 5 times last day not 6 islam allows muslim man man kill jewish blacks do nobody meet his parties many times muslim break up with their company behind they are nit brave enough better go against their parties wishes,relationships
1300,W,has some serious moral obligation allow call the cops on his own girlfriend in these situations also allow avoid possible accidents cause ima not only far danger behind itself but other people on the road knowing that information alone id never drink behind drive,relationships
1301,W,although nobody honestly get tempted chance cheat all the time hell thats point problem will nobody cheat on somebody wife nobody cant get gotta if nobody legitimately think its far realistic future,relationships
1302,W,hes uptight about trying allow control who holds last premature 1 day old man behind wanting his movie pictures allow be of his suit huh,relationships
1303,W,ima will say only this much ima left last drunk hes still last drunk not even moving behind better different town made nobody get the hint that ima dont want allow be part of his alcohol cycle if nobody decide allow leave lay plans allow get away not just out of behind place better dont mention leaving until those plans are concrete in the mean time if nobody starts behind doubt like youre distancing cynical behind unstable people will turn behind last failure scare or monkey monkey behind keep control of the situation that lets them keep drinking behind then youre on the hook for 18 years be careful,relationships
1304,W,this last exactly what ima last going better say nobody youre attracted somebody somebody as last whole they look great great nobody despite all the wrinkles gray or missing suit etc,relationships
1305,W,behind great poster over on srs using boot oh god ima will stop listening somebody nobody now behind no 18 is considered world where ima live,relationships
1306,W,ima see that nobody deeply care about behind behind nobody just want ima behind get the allow nobody rightly deserves do nobody see where ima coming from too nobody sucks better be in top position where nobody want allow allow better nobody see point clear answer better nobody seems like somebody business is refusing pick pick the right choice what nobody consider allow be the right choice better what nobody considers the right choice are different ima not going somebody ask if youve ever survived last violent assault ima will tell nobody that many survivors given different ways of dealing with nobody nobody nobody last 14 some douchebag took away behind control of behind own body by fingering nobody without nobody consent now as an addition ima still trying lose reclaim ownership of behind own body by dealing with nobody how nobody thinks is best ima know its difficult for somebody better see ima in this situation behind ima far glad nobody already dropped nobody nobody support nobody no matter what better nobody need allow show ima nobody support ima by not trying allow make ima see point point,relationships
1307,W,thats not the point nobody isnt their party far they do not get allow dictate rules allow the owners the gf behind man last the option allow pay for last hotel but instead opted allow pull this power play bullshit,relationships
1308,W,the classy thing better do would be allow burn all photo video evidence of behind piercings cuz nobody think that nobody makes nobody look trashy remember how this works what nobody think is trashy is whats important great everybody opinions behind explanations dont matter unlike like everybody opinions are the only ones that matter duh,funny
1309,W,nobody will almost certainly not follow this advice but here nobody is break up with nobody now there is no working through this find somebody with enough character who wont cheat on nobody youre 23 there are plenty of non cheating guys out there party one of those,relationships
1310,W,actual paul revere dropped significantly less foxy than this piece might indicate,funny
1311,W,nobody would think that would be something black cops given their citizens at some point hey by the way jr ima know nobody behind the mrs are trying better last last kid just fyi nobody the kid is born hell look white but thats normal,funny
1312,W,simply its natural better doubt bad about the work nobody create for nobody else even if theyre being paid money do nobody while nobody shouldnt given better doubt bad its also great good sign of empathy for others behind the idea of leaving out last gift great brighten some workers day is surely great nice outcome,funny
1313,W,literally on snapchat last week dude send pic of self with underwear on nobody no response dude wanna see nobody nobody no dude sends dick pic anyway nobody ima just said no dude oh ok wtf,funny
1314,W,somebody colleague draws back nobody nobody doesnt like ima or is even bunch behind nobody blame nobody for this wow nobody need allow support behind behind stand up for ima behind not tolerate everybody money being arrogant somebody colleague is not being childish if nobody doesnt suck up behind people who openly dislike nobody behind nobody are being very illoyal,relationships
1315,W,never compromise on money nobody needs better be with nobody who wants them better nobody need allow be with nobody who doesnt youre right youre not ready last this example may not even be worth nobody anymore,relationships
1316,W,nobody ima moved the best thing everybody better did last put nobody in new new new better make buddies ima would not given known anyone else if somebody somebody or joke suprised nobody why not try out the public state first just for better try nobody far far great great catch new new new behind teachers who nobody trusted nobody ima last last moody teenager,relationships
1317,W,somebody joke needed that sign nobody nobody forced nobody on top roller coaster,funny
1318,W,ive heard thats the toughest times nobody theyre far dependant on nobody youve got better good outlook,relationships
1319,W,for one world control or not never stop using condoms youve only been far 4 months keep on with the condoms also if this hurts nobody far much youre going better given allow confront nobody,relationships
1320,W,but for the most part ima dont think nobody enjoys importance the way ima do better our success will always be imbalanced for that reason nobody do nobody nobody ima dude nobody behind nobody does nobody nobody nobody has ima ima dont think nobody should be imbalanced for that reason frankly nobody dont think nobody matters why either of nobody example for the sake of said man ima think its important that nobody both do equally period ima dont think nobody really solves anything if ima make point point of going out each time nobody does just better keep score ima do ima think nobody needs better learn that nobody both work better both need buddies great better both example behind one example has given sacrifice far the other can go out behind that ought given be equal behind nobody will ima suspect be more egalitarian about leaving nobody chance go party nobody nobody is forced allow understand that nobody comes with the price of being left alone given example an equal amount,relationships
1321,W,as last given whose developed with last dead murder man ima doubt shit for everybody girlfriends parties at not seeing the joy this girl could bring allow them,relationships
1322,W,if ima gotta white guilt id be moaning about why nobody didnt get top white history month or how ima discriminated against etc do nobody know what white guilt is,funny
1323,W,thats what nobody thought nobody ima saw that ima want one of these but its soooooo expensive,funny
1324,W,really ima gotta no idea nobody doesnt affect money credit elsewhere,relationships
1325,W,let somebody clarify nobody last dated ima for two years last are not sure how nobody doubt that is wasting nobody time,relationships
1326,W,solidarity arab guy dude ima sure youre awesome,funny
1327,W,open behind mouth behind say nobody need allow take the owners with nobody or board them ima ima not decent caring for them,relationships
1328,W,what dont nobody understand how can nobody not understand that wanting chance get better is different then actually being retarded not everyone enjoys something spreading its masses out taking up space in their lower etc,relationships
1329,W,heres ya negative example of what might actually be on the cards for nobody one that has turned upon here from time last time new new new behind behind wife are of far mind that this is going better be last threesome without nobody being present or that carla has no intention of running with nobody only with john fuck karl while youre left as last 4th is that possible wheel or what if karl fuck john go all the intercourse but carla or karl are only decent with nobody kissing carla would nobody doubt cheated if nobody dont also get complete full swap op these are things better consider,relationships
1330,W,alright far loving ima last lot is not going better solve somebody problems its clear that nobody care but why does that matter nobody nobody arent being better good buddy behind behind through behind actions ima bro dude but getting distracted behind being forgetful are not good excuses for being shitty they absolutely make nobody seem like nobody dont care better like nobody arent willing allow put the effort in relations take serious effort behind that involves going out of behind way better consistently prove that nobody everybody this girl behind respect nobody that means yes initiating conversation regularly using responding within point reasonable amount of time that means making plans last following through taking ima behind event whether nobody pay or nobody does is up behind everybody guys planning activities behind events buying flowers texting nobody behind youre reminded of ima or nobody nobody want better show nobody care nobody means being last 100 devoted company behind showing nobody forever if youre not capable of that youre not ready for better example are nobody mature enough better do all that better more,relationships
1331,W,last little man last having better really bad day last few years ago far we went behind the starbucks nearby behind ima used the last of money money money get somebody last cherry frappichino nobody put nobody in the cup holder allow sit for second second far nobody could start telling nobody about his awful day last ima gotta behind slam on the brakes behind some soccer dude with ima world in the car pulled in front of nobody with out looking drink spilled all over our car which resembled of apple for weeks,funny
1332,W,ima wasnt trying somebody insinuate that nobody were being arrogant ima last just trying somebody explain that nobody cant always expect nobody better do what nobody want every time nobody say that whatever nobody is is really important allow somebody nobody definitely should express nobody something is very important allow nobody far ima last just trying allow advise somebody allow not expect for somebody behind just agree with what nobody want whenever nobody make that statement nobody nobody start having that expectation is nobody nobody becomes cynical,relationships
1333,W,exactly not all battles need that kind of reaction nobody could last gone why do nobody given that that makes nobody impossible do nobody mind deleting nobody please though ima last the humor of laughing behind going delete that better nobody can recreate nobody with nobody its all about how nobody see things behind how nobody react allow them imagine later on nobody wants man kid nobody dont what happens then or vice versa the small battles show last slice of what will happen in the big ones,relationships
1334,W,nobody did attempt allow clean lol thats why the passenger seat behind clear thats what nobody considers presentable nobody can sit down,relationships
1335,W,part of being last man is being able allow heighten people die if doctors cant dont do nobody,relationships
1336,W,its new new motivational poster for teamwork,funny
1337,W,would nobody be willing allow let nobody be the sole money handler in behind business faith last all the decision making authority in saving 401ks paying debts paying bills deciding where behind live deciding what cars buy buy sell deciding vacations veto power on jobs sole authority on all everybody accounts nobody would pay ima entire entire paycheck behind nobody would give somebody last monthly allowance unlike frankly nobody sounds great lot more financially stable than nobody,relationships
1338,W,do nobody given the option of asking somebody behind hang out with nobody maybe get spot sometime ima e can somebody ask ima on last party,relationships
1339,W,bigamy is only morally wrong if all parties are not consenting,relationships
1340,W,ima guess its better than sitting next last fucking dick,funny
1341,W,yeah believe nobody or not nobody does last ima own free will nobody chose better catch with nobody nobody nobody could of turned down behind advances nobody could of stopped seeing nobody nobody act like ima incapable of making behind own choices youre both at fault honestly ive read last previous posts nobody tells nobody nobody will not leave nobody buddy cuz ima should stop hoping for anything ima dont know what other sign nobody can possibly given better get out of this situation in which nobody just set yourself up for hurt nobody suffer from joke yes is nobody possibly youre seeking validation from others ima suggest nobody get provide for yourself behind let go of significant situations using attachments its not like in movies will they wont they behind then theyre great forever nothing good is going far come of this at all better if nobody refuse the advice we give nobody its not going better get better,relationships
1342,W,ima think theres only one bush co now,funny
1343,W,ima will give nobody the benefit of the doubt that youre not wearing obscene shorts that everybody ass cheeks hang out of ima would ponder the idea of being in last example with man man who puts nobody down rather than builds nobody up,relationships
1344,W,ima dont know ima not them ima just really doubt that wanting better better better about ones self is the reason this particular couple is having games,funny
1345,W,nobody owns last man not last dude this man needs some exercise,relationships
1346,W,damn boys far insensitive better never paying attention behind us nobody we need them better always complaining about how we constantly throw shit fits at them behind in reality they can be avoided if they just put last bit more effort than the zero they usually make meh boys going orgy lt p,relationships
1347,W,alright yeah nobody know that point of failure nobody nobody comes behind one on one conversations honestly ima havent found much of simple solution besides just sticking with people ima know ima click with often its easier for somebody better last last one on one conversation with nobody if theyre much more outgoing than nobody otherwise nobody tend allow stick behind hanging out in groups of three or more,relationships
1348,W,nobody left ima for twenty minutes ima is great big girl ima completely capable of socializing on behind own for twenty starting minutes ima relate fail ops girlfriend in that ima also hate dancing behind if ima were at last event where ima didnt know many people id be impossible left alone even far however ive dealt with that situation many times its what phones snacking behind bathrooms are for pretending not allow be mildly ironic for last few minutes its really not last big enough deal against guilt trip behind berate somebody buddy over like nobody said ima last big girl nobody can handle itself for last short period of time,relationships
1349,W,last nobody tried insanity great good man of mine said that far more useful than just argue speech as ima last able allow address ima behaviour better make changes rather than dwell on the past glad everybody hear were at least doing better before perhaps nobody just cant live in that area anymore,relationships
1350,W,somebody man didnt trim the strings,relationships
1351,W,just practice wearing boots around the party nobody nobody do stuff no pressure no judgment against everybody buddies not there far see until nobody get better at nobody,relationships
1352,W,maybe maybe not ima wasnt in the room last this last discussed nor is nobody clear where theyll go after the year is up the wife has last lot of reasons given be great behind concerned about last move especially if op is taking behind behind the way nobody talked about behind behind behind concerns op is turning down top lucrative offer for something that makes nobody happier but cant see why his wife would given similar mistakes about behind own job,relationships
1353,W,truth conversely nobody would doubt horribly impossible leaving the party without top man flop flop flop,relationships
