,op_gender,post_text,subreddit
0,M,it really comes down to the circumstances under which you broke up and your relationship if any afterwards ive had exes that things ended relatively well with or at least after some time had passed my so and i went to ones wedding a couple of years ago have been dating the most magnificent and beautiful girl i could have ever asked for so youre happy now who gives a fuck what your ex is doing or who shes doing it with be happy with what youve got and move on certainly sounds like she has ex has been dating a former friend co worker ive never understood why this is an issue for people jesus its your ex who gives a shit and what business of yours if you parted on good terms i say all the best to them if not then good luck to the bloke,relationships
1,M,s korea japan china have tons of boy bands i think one direction is a boy band so i dont they theyve disappeared i think its much rare in term of popularity in english countries now and most of them are in asia,funny
2,M,those eyes,funny
3,M,you need shades its not my fault if you keep your volume on maximum,funny
4,M,nope,funny
5,M,well whenever he comes back into town you can sleep with him friends with benefits,relationships
6,M,those people are ignorant and i am in no way blaming the women for this its evolutions fault it dictated that men should look for the physical attributes of a woman in order to determine whether or not she was fit to be a mother today this is pointless with modern medicine and practices however men are more aesthetic driven women respond appropriately and they focus on looks its in no way their fault but that doesnt take away from the fact that its generally uncommon to find a worldly woman and then when you actually find one they usually dont radiate beauty,funny
7,M,a song of ice and fire is the greatest food and dress description novel series ever made,funny
8,M,unless its to give him a quarter to call somene who gives a fuck that line is getting dated too bad i always kinda liked it,relationships
9,M,i wear a 13e and always work it when shoe size comes up and you know what a guy with big feet has let it hang in the air for a moment while they make the seal face then slowly big socks,funny
10,M,you do if you serve sell liquor in canada at least everyone is id ed when buying liquor,funny
11,M,i legitimately not sarcastically have a phobia of salad dressing this though of this genuinely disgusts me,funny
12,M,i guess he has the habit to pay for everything and she doesnt like it i think most girls dont like it too,funny
13,M,not a rocket exactly retired equipment unable to reach mars dammit op laughing hurts my soul,funny
14,M,even though she is not associated with the school she still may face charges of using a position of authority to have sex with them which does constitute rape if the person is under age 18,funny
15,M,have you handled anything besides 1 notes in the last decade,funny
16,M,its how programmers see costumers,funny
17,M,theyre both vampires obviously,funny
18,M,program jesus christ,funny
19,M,the mcondalds manager employee wont ever be a good one in fact in the 2 minutes i took to wrote that i probably wasnt sitting here trying to think of the best anology to use i guess what others are in disagreement with me is the fact that joe paterno and sandusky held a higher importance in life than a minimum wage employee that their story should be played more often than others or that their actions have a bigger influence on society i can agree to this to a certain extent the direction i was tryign to go with is that i dont care too much about college college so if you replace paterno and sandusky with anyone i will still think of them in a negative way sandusky for raping paterno for not doing more or hididing evidence also i get annoyed at hearing the same news story repeatedly there are horrible things going around the world and amazing things going around the world i think the media should spend more time showing other stories and less time on big stories like this about the victims i feel sorry for them no matter what and they are probably have a hard time no matter if they never hear about the story on the news or if they hear it every day,funny
20,M,itt people thinking they are cool because they dont like douglas adams,funny
21,M,y u no keep karma machine,funny
22,M,still do tho they seem to be a lil more current these days only a week or 2 until the get it now,funny
23,M,could the speaker speaker be modified can i buy a prius and make it sound like a tie fighter,funny
24,M,i presume you had a full tank prior,funny
25,M,wheres the wife shaking her head saying i told you,funny
26,M,is it safe to assume you still are,funny
27,M,i have a few gay and lesbian friends and one of their biggest complaints when it comes to dating is all the people wanting to experiment they dont want to date them they just want to use them to scratch an itch and then be done if you know this guy has feelings for you maybe you should find someone else to try this out with doing it with him will probably just complicate things if he even agrees to it and change your friendship you dont have to tell him that you are trying out men its your sex life and no one elses business maybe just talk to him about your feelings and your sexuality and see where it goes from there dont proposition him for sex to see if you like it or not maybe hell have some good advice for where you can find good clean guys for your first time or maybe hell offer to help you out himself,relationships
28,M,imagine what kind of achievement youd unlock,funny
29,M,all i could think of was kevin,funny
30,M,an american college college in japan do they stream things,funny
31,M,it is for phase two,funny
32,M,anyone seeking more info might also check here title points age r comnts is this a easy access b fashion c unfortunate 334 4 lol wtf 59 wild clubbin night b 1855 5 lol wtf 216 new fashion 76 2 wee funny 24 these moments captured at the supermarkets really crack me up 60 5 wee funny 23 potty time pants b 1 1 mo pics 5 is this a thing now 1669 2 lol wtf 683 at the bar her dance card is full 2 2 wee funny 10,funny
33,M,i think this means she is targeting the wrong audience or is she,funny
34,M,what if my head is really big and it cant get all the way down but i can still ejaculate during sex,funny
35,M,yup title comnts points age r eat your vegetables 3 coms 10 mins 20 dys wtf we all know a girl who likes horses a little too much 15 coms 243 mins 3 lol wtf after photoshopping this i wondered what i have been doing with my life 503 coms 1688 mins 1 yr wtf my favorite face swap by far 16 coms 196 mins 1 mo funny not sure if repost but easily one of the most wtf face swaps ive seen 74 coms 1153 mins 4 lol wtf terrifying faceswap x post from r funny 8 coms 198 mins 7 dys wtf awkwardly arousing 2 coms 1 pt 1 mo wtf source karmadecay,funny
36,M,its not a matter of how intellectual someone is its about how shitty your jokes are i think even the smartest of people would call that shitty,funny
37,M,is she related to mao,funny
38,M,what was it,funny
39,M,if you wanna do it that way create a new g mail account and send him the necessary evidence i dont see how he can possibly trace you to the anonymous g mail account,relationships
40,M,the details of the post are indeed paranoid but its not because of being raised in a mollycoddled society the fact that he has loaded guns means that he is a criminal an armed criminal in the us non criminals own unsecured hand guns in the uk that is literally not possible if you found out someone you were dating had a well used guillotine in their basement im pretty sure youd not be happy either,relationships
41,M,shes given me blowjobs before buts its at a rate of maybe 1 per year not necessarily on my birthday,relationships
42,M,lol i enjoy the artist if they drew that theyll draw other stuff too,funny
43,M,the windows vista joke at the end of series 4 was funny as fuck i love purple no homo this show should definitely come back,funny
44,M,if i was her i would just report the card as a lost card important lost after the last purchase made with it to avoid suspicion of fraud and take the 120 loss if the person owing me does not pay up i have reported a lost card without having to file any police report so i know it at least is possible to do in sweden edit you could probably just also explain the true story to the bank i do not think they would care much,relationships
45,M,we dont hire minorities so we dont have to worry about it being a hostile environment,funny
46,M,man dating in highschool must be fucking nutty do you go to school with this girl,relationships
47,M,i figured i would go back to the beginning of our little adventure to say thank you that was fun,funny
48,M,i bet theyre going to be hooking up why the hell is this sub always looking at the worst case scenario downvoting posts that argue with op and dont say oh well s hes a dick dump him her and move on eventhough i would not feel comfortable at all with this situation dont get me wrong but i really dont think they are going to reproduce like rabbits or something money issues are legit and if those two are best friends i dont see why there would be a problem plus i dont know where they live but i reckon its equally hard to find affordable and close apartments while in college everywhere if you found an apartment and possibly already a week before move in signed a opportunity you will certainly not go on the lookout for a new flat because your gf has trust issues feel free to downvote but at least explain why,relationships
49,M,as someone raised a jw i call bs,funny
50,M,are you american,funny
51,M,she had some wine but come on yeah pretty much is she really adventurous or might she have some mental issue i mean there seems to be a filter thats just might not be there that my mom would talk about her loose behaviors your mom is going to attempt schooling your adult partner tell me if this doesnt explode because it sounds like a righteously horrible idea she apologized profusely so whats the problem why did she do it how could that information even remotely seem appropriate its not grown up talk nobody wants to know about her fucking her ex at the grand canyon but apparently shes proud did i just miss something during my whole relationship tell us more about her adventurous side is she adventurous naive or is something not right,relationships
52,M,plot twist op is male,funny
53,M,your bf doesnt sound sensitive enough for you doesnt respect your privacy or your past his friends and family dont respect you and he doesnt seem to stick up for you i would have a serious sitdown with him to see how he really feels and if he is willing to stick up for you to his friends family if not i wouldnt stay with him good luck,relationships
54,M,jumbo,funny
55,M,thats a pretty narrow uncharitable view of heroism,funny
56,M,shh shh shhhhhhhhhh,funny
57,M,you and i have different definitions of very clearly,funny
58,M,inb4 discussion on columbus discovery of america his racism and other lackluster qualities,funny
59,M,bisexual but yeah,funny
60,M,he did,funny
61,M,the version is called faster internet i had no problems,funny
62,M,and a 10 20 minute massage can do wonders for starting that thing right up,funny
63,M,i am 30 years old and this look scared the bejesus out of me,funny
64,M,wait im not understanding are you wanting a boyfriend or guy friends because your attractiveness level shouldnt matter if youre just seeking friendship though honestly the seeking out of specifically one gender for friendship does raise an eyebrow,relationships
65,M,lets not forget our beloved aunt 1 02,funny
66,M,the two of you sound fucking insufferable tbh,funny
67,M,yea you couldnt try to distance yourself any further from responsibility than you have right here youre making justifications and excuses for your behavior youre 19 i get it but fucking own your shit choices op i have faith that you wont be a repeat offender but you got some serious growing and serious resolve to achieve to make that a reality,relationships
68,M,im glad you like the sound of it its kinda weird like me sometimes i suppose haha,relationships
69,M,i miss that show,funny
70,M,dont be scared passing out is just your gains putting you to sleep so they can move in peacefully they wanna surprise you,funny
71,M,they are probably laced with strong laxatives,funny
72,M,thats never stopped me before doors are for opening ill go through where i please,funny
73,M,yes link,funny
74,M,all i can say is i didnt get married treating my wife like that and if i did she would be pissed being emotional and inappropriate is no reason to treat someone like shit again you two are young adults i am not exactly surprised to see someone his age act like such an ass but that doesnt mean its waranted if he doesnt feel sorry for treating you that way and thinks its appropriate yeah i would be reevaluating the relationship thats me i can understand he is frustrated but his unforgiving attitude only makes more problems and frustrates you as well or more hes at a point where hes gonna really start growing up or keep acting a douchcanoe kid a while longer up to you how long you tolerate that at some point you need change either he makes it happen or you do,relationships
75,M,using rough estimation id say that number is much closer to 15000x,funny
76,M,patterns arent hard to recognize a healthy normally functioning 20 year old and 52 year old should be in completely different life stages and have virtually nothing in common and very little room for attraction just because society has created a legal age of consent doesnt mean the inherent strangeness and power imbalance of a massive age gap magically go away when a person turns 18 people involved in such relationships often have easily observable underlying problems enough that its a recognizable trend op himself basically admitted to having mommy issues,relationships
77,M,im just bored of this kind of stuff theres so much american bashing being done here that even the jokes arent funny anymore,funny
78,M,the woman in that picture portrayed june cleaver in leave it to beaver tyl,funny
79,M,nationalism,funny
80,M,ops image is all over the place a ris gives a number of newspaper articles,funny
81,M,soccer is a religion to many countries it can drastically make changes to society it has even ended a war i cant do sports any justice heres nelson mandela on sports link,funny
82,M,but why does the word retard hurt so bad why did it become so negative its because for someone with downs syndrome or some similar disorder its a word that spit at them by their tormentors thus when others say it casually it makes them feel as bad as if it was said with hate this kind of emotional pain is internalized its the same reason nigger is so vitriolic but with much more history people with special needs hear the word retard and it makes them feel like less of a person for indeed thats how people treat them most people act as if they cant understand but they do the problem is that people use the term as a technical term as i do here as a dismissive hateful term and as a casual term you describe the casual aspect used apathetically however the fact that the english language needs some form of technical term to describe someone with special needs and the fact that there will always be sadistic assholes who will appropriate that term to dehumanize others makes the censorship of a single word kind of a pointless endeavor as i said before there will always be a new word as long as the technical is tied with the hateful and the casual what we need to do is change the way people view retarded people as someone with feelings who can understand what people say about them but might not always be able to defend themselves,funny
83,M,too old,funny
84,M,kissing your sister on the lips is a fundamental dynamic the fuck even after four months she still has a right to voice her discomfort,relationships
85,M,your viewpoint sounds reasonable then again there are certain other realities that dont adjust to the situation the first one being that he lives across the country for which a trip would be extremely tiring if it were to last only 3 days you are also right that these sorts of hard questions should have been discussed before actually getting married because i get the feeling op never would have dreamed her husband would turn out to be just so rigid about things most people are not though stuff but i think this will turn out to be a defining moment in their relationship,relationships
86,M,im amazed that the daughter ends up in jail and the thought process of the family is to blame the fiance for being a shitty cop i dont have high hopes shell figure that no one is above the law,relationships
87,M,how much older did she get in a year for men to stop paying attention to her for it,funny
88,M,please tell me thats sarcasm,funny
89,M,hey look its an original joke,funny
90,M,agreed fu viacom directv,funny
91,M,the translation was lost by scholars ages ago,funny
92,M,are you not counting the guy in every shot practising auto erotic asphyxiation,funny
93,M,i think you should do it together and separately does her anxiety bother her does she lament the issues it causes if so then id bring it up in a moment when she is frustrated with her anxiety,relationships
94,M,run to a galaxy far far away,relationships
95,M,shitty picture i cant see it,funny
96,M,im glad im dating someone that is engaging and enjoys shopping with me its good to go with someone that cares enough to have an opinion and look around with me rather then stare at a phone i dont know why people go shopping with those who dont want to go and look around with them,funny
97,M,its always so frustrating when people like you act like the only two options are to somehow renounce your citizenship or to shut up and blindly accept every whim of the responsibility,funny
98,M,oh were having this thread again is it tuesday already,funny
99,M,not as pretty as you always a winner,funny
100,M,she needs to actively verbally and explicitly shut this shit down with the creepy older guy right now in no uncertain terms that he understands and that her parents understand if she cant or wont do this walk away fast she is digging the attention she is getting from him and leading him on this is emotionally manipulative and does not bode well for your relationship with her how serious is your relationship with her can you ask her to do this or would it be a deal breaker with her keep us updated this is going to get interesting,relationships
101,M,im not going to check your u user history because i prefer to think that you were so scared of having that opinion downvoted to oblivion that you created a throwaway account just for this comment,funny
102,M,that wont prevent them from stealing his beer,funny
103,M,being agnostic that might be a little hard,funny
104,M,if you suspect low libido perhaps get your hormone levels checked reading further down you dont enjoy kissing or having sex with him big issue,relationships
105,M,hmm unless i missed it when skimming the whole thread this one i get left on my vm at least twice a week from by bff who is irish alright well take the niggers and the chinks but not the irish,funny
106,M,so do i not gonna hold it against her,funny
107,M,as someone whos desensitized to most things but has issues with heights fuck that bothered me more than the chainsaw decapitation,funny
108,M,op sounds like he is frustrated in that she wont come to him i always read that as being frustrated that she wont take all the risk for him this type of thing bugs me,relationships
109,M,this post would get more up votes if you had month to month photos,funny
110,M,i couldnt tell from the youtube clip or the gif did the song finish before you fell was your score good,funny
111,M,what the fuck is not to believe you know what dont believe me because then one day when youre sleeping all cozy in your boyfriends bed thinking your safe well come in and rape your asses see how that would feel,funny
112,M,holy shit dude,funny
113,M,we expect a full lab report by tomorrow,funny
114,M,sorry i meant to put discuss it with him and if he doesnt stop break up i just thought it was implied my bad,relationships
115,M,you never heard it was a comedian before,funny
116,M,de face ing property property,funny
117,M,to bad its been dead for centuries empire my ass england sucks,funny
118,M,he has mental problems no doubt about it so what if he has still not an excuse for what he has done shitty spitefull actions ask for hurtfull repercussions,relationships
119,M,possibly whenever they get a new paperboy driver who doesnt know,funny
120,M,yes i let my friend who is a girl is attractive and at the time drove a right hand eclipse drive it someone needed to i couldnt she was the most capable,relationships
121,M,with the right office way a god can be made to look like a disgusting monster too,funny
122,M,i think the larger issue here is his stamina you said he doesnt last long and maybe he feels like his partners take care of themselves because he is unsatisfactory sit him down and tell him that you are very satisfied when you can have sex but since youre using money for more pertinent things than condoms right now you still want to get off you can ask him to help you do it and you can both get some action out of it from helping each other but also sometimes you dont want to go through the whole dog and pony show of sex or even having someone watch you by yourself sometimes i just want to quietly get off and you should be able to as well,relationships
123,M,thats the perfect opportunity no you shouldnt go back to him you should be with me,funny
124,M,it honestly sucks that the first descriptor is gorgeous when a guy is talking about a new girl he met how else is he going to describe her hard to know what a persons personality quirks or traits are that quickly all we have to go on is appearance this applies to both men and women,relationships
125,M,haha dont come to mexico man especially not in the huasteca where i am fireworks every single day and night,funny
126,M,sigh ill start assembling the raft,funny
127,M,same response as i gave you in your last thread if you go through with this and id advise against that no booze for you at all and no being alone in each others room it may be unthinkable for you but booze alonetime mutual crush wild naked sex time,relationships
128,M,no no no youve got it all wrong breaking bad is the prequel he goes into witness protection and gets put into malcolms family,funny
129,M,from the opinion of an australian who lived in the us for a year i would still say that i have seen a multitude more humongous people wheeling themselves around to an early grave in the us than in australia i mean the us has scooters in malls just to accommodate their condition i know its for other people as well i have only ever seen wheelchairs provided in australia and never actually seen someone ask for one oh and dont get me started on the airports,funny
130,M,dude you are overdoing it its getting frigging annoying,funny
131,M,it was a joke relax,funny
132,M,weed is the least expensive drug,funny
133,M,omelette du fromage,funny
134,M,amanda bynes is not dead,funny
135,M,nah he was fine with both of them working long hours not just himself it wasnt until they discussed marriage and children that he suggested she cut back like he already did he wasnt asking her to do anything he already didnt do himself when he said she didnt have to work i took it as he makes plenty of money 6x what she makes in fact workin half the hours so there is no financial need for her to keep up the 16 hr days you cant be much of a parent with those hours which he explicitly communicated,relationships
136,M,see what you did now you are making me read that i hope you feel good about yourself 3,funny
137,M,fixed,funny
138,M,but i used to work that hard and i wasnt happy do you think he is do he think he works hard because he likes it or because he thinks its his responsibility to do so,relationships
139,M,no its universal black and asian people dont tip well generally gay people tip really well if you have a gay couple that are black and asian the world explodes,funny
140,M,wow youre a huge fucking cunt i hope you die a horrible death 10 10 if troll yes i mad,funny
141,M,look i respect the fact that you love music and want to hear an artists album in its entirety but there are a lot of people who dont care for the 10 other songs that they pumped out because some label wanted to fill a cd tl dr i just want to pick a genre and play some hits,funny
142,M,stupid shit can be found on facebook though maybe not this ironic here are some examples from my wall over the years all from the same guy link after that coke commercial with the national anthem being sang in multiple languages link link,funny
143,M,has it occurred to you that she may be experiencing bipolar mania that seemed more likely to me as well than her being interested in someone else,relationships
144,M,because its the internet you dont need to show class or manners your choice,funny
145,M,but how,funny
146,M,nobody posts about their so here when everything is healthy youre making a non point,relationships
147,M,dear god you cant be in love with a girl you dont even know you want to be in the family because you are good friends with the brother so you concocted this crazy fantasy about the sister stop before you creep someone out,relationships
148,M,yeah its counter intuitive until you realize the speed of the road and the speed of the surface of your tire is 0 relative to eachother,funny
149,M,i felt what you did there,funny
