,op_gender,post_text,subreddit
819,M,thats not really a review though how can you possibly judge something as overpriced if you havent had a chance to evaluate it theres a difference between expensive and overpriced a high level steakhouse with wine for two people could easily cost a couple hundred bucks you can go to outback and probably get the same meal for 60 but its not the same meal and 1 starring a place for not being as low price as a competitor is silly,funny
820,M,always ends in death only 94 of everyone who has ever lived has died i like those odds,funny
821,M,really bad michael james reference specifically the opening to the song black or white sorry,funny
822,M,id say it is still a bullet dodged because not much has been set in stone and it has only been four months its very easy to walk away from this with no more than emotional trauma shit gets real when you have a business kids houses years that tie the couple together right now he can just gtfo real quick,relationships
823,M,i guess i dont know i was just trying to describe the best way to handle cooking and clean up my wife and i used to do the i cook you clean thing but after kids its just turned into each of us working until everything is done who cares who does what i truthfully think this is the best way to do it as long as you have a partner who carries their weight,relationships
824,M,basically ankle and body weights people use them while running,funny
825,M,r adviceanimals,funny
826,M,me jelly as i posted elsewhere im 9 5 and 11,funny
827,M,i got this,funny
828,M,lets be honest she probably died pretty quickly after being released to a hawk or an owl because domesticated birds have no fucking clue what those animal can do to them,funny
829,M,thats it well trolls used to be subtle and good now we have you guys makes me sad 0 10 son lurk more,funny
830,M,you absolutely can assault someone with words are you attempting a straw man because i didnt say it wasnt possible just that this wasnt it for example he raped me if the accusation is false thats an assault if the words cause great stress and upset and you knew it was likely actually no thatd be libel go get a penal code and find out the only way a verbal exchange can be considered assault is if a threat to physical integrity is done other things might or might not be other crimes but this is whats coded into law so allow me to repeat myswlf once again the fact that youre comparing this to actual rape which isnt even the same thing as an assault but i just realised youve been making these progressive jumps is ridiculous alarmist hyperbolic and very much why this whole thread has been so off putting to me by the realisation that alarmism ridiculous political correctness and oversensitivity have trumped common sense one thing im glad of and where my hope lies is that i usually dont encounter these sorts of attitudes in the real world at least within my spheres so id like to conclude that these people who want to be so alarmed and offended aither dont live close to me im not from the us and i undertand most of reddit is or restrict themselves to a life online,relationships
831,M,then he mightve choked to death,funny
832,M,its bad for health nope bad for insurance prices see above and bad example for others why unless you have a legitimate medical condition which prevents you from being fit its a problem which many people do but that doesnt stop people from telling them to stop being lazy but being fat without a medical condition certainly isnt a problem,funny
833,M,laughed hard you might be a geek if,funny
834,M,damn so the rumors are true not that im complaining im in t track and enjoying this free time,funny
835,M,it makes you wonder about the women in this video what kind of poor life choices do you have to make to end up shaking your ass in a 6 year olds face,funny
836,M,back blast would push it backwards it caught a bit on the way out edit back blast would push the tube back through drag as the jet passes through this is because the internal pressure acts normal to the surface and for the tube this is all balanced aside from the drag the rocket only has pressure acting on its rear end resulting in net force pushing it forward as it moves the rocket pushes forward on the tube via contact friction evidently thus contact friction is greater than the stream drag i teach this stuff take further criticisms to r askscience,funny
837,M,she better not steal lemons,funny
838,M,100 years old and still cracking people up if comedy is done right it works no matter what century you are in few will make it to that level of immortality,funny
839,M,actually i am in college so hah summer job,funny
840,M,unless you are particularly funny or charismatic ops almost always get downvoted in comments its true everyone either hops on the op love or op hate bandwagon,funny
841,M,mark brendanwicz didnt help either im so glad he was replaced by chris and ben,funny
842,M,nearly hit a policeman while making an over wide left turn and then proceeded to argue with him that she had the right of way an old asian lady in an argument is like fighting the vietcong even with superior numbers and the law logic arguments on your side they just have more will to hope i wouldnt be surprised if the cop just cut his losses and let her go,funny
843,M,except the force if it was pure sword vs sword sure,funny
844,M,theyre not subtle about it,funny
845,M,what is this,funny
846,M,i mean im just assuming since she has no money after two days is he getting paid monthly then he would need to pay the bills,relationships
847,M,isnt everyone with a job a shift worker,funny
848,M,i laughed i guess,funny
849,M,that makes me really uncomfortable,funny
850,M,something something axe something penis something,funny
851,M,i seriously love youtube videos load all the time for me without problem,funny
852,M,if you grew up stable than you will never know what addiction is like whats the definition of stable my parents were divorced and i grew up with my alcoholic drug using mom in a trailer is that stable ive managed to never use drugs in my life dont smoke and drink very rarely its surprisingly not hard to avoid stupid decisions growing up in a stable home or otherwise,funny
853,M,cat,funny
854,M,which makes him the one more in the wrong in my opinion explain there is no rational justification for why this is so remember his wife did not start this affair because he cheated his wife did it of her own accord there is hypocrisy here but there is a major difference between a small fling and a conscious effort that lasted 5 years involving the people closest to you,relationships
855,M,bet your ass i do,funny
856,M,the last bit sums up reddit quite well,funny
857,M,people have different needs maybe in his world he wouldnt have asked you to come to the surgery and in fact would have preferred you werent there so the only way to resolve these needs is to talk about them did you make it clear to him that you really wanted him there btw you should talk to the surgery center right now about driving yourself home most places wont allow you to do that if youve had any sort of anesthesia,relationships
858,M,okay two real issues here first and most serious holy communication breakdown batman like this is your wife youve got really important stuff going on and youre not telling her stuff if threesomes or whatever are so important that youre thinking of breaking up she deserves to know secret ultimatums are way playing dont play things with this shit if you cant be open you have no business being together second you seem to be jumping around a lot like she tried kissed a guy and that was okay but she also kissed a girl and thats not okay except shes kissed girls before and that is okay except you want a threesome and she says shes okay with it but shes not really doing anything except she said shes okay with you sleeping with other people without her but youre not okay with that except you kind of are but then theres rumours at work so youre not and i dont even know any more step back breathe deep and focus on the problems you have now and think about what you can do to solve them if you need to keep a snow white appearance at work threesomes and sex parties may not be for you unless you really really want that life in which case maybe you should change careers people talk its a fact of life you complain about your wife caring about her reputation but then you freak about yours not only is that hypocritical but its pretty linked if her friends know their husbands and boyfriends will and then your colleagues will if thats not okay then keep your sex life between the two of you in private if it is okay stop freaking out about it edit also a lot of this seems more driven by jealousy and maybe revenge which is super problematic as well thirteen years in and now you want a threesome how much of this is your basic sexuality and how much is you being mad that she doesnt kiss girls in front of you sounds like its mostly the latter which doesnt sound very mature to me ultimately you and your wife need to talk this over honestly share how you each feel about it make some concrete plans break that down into actionable steps and then review progress regularly dont be all secret squirrel about this have you sat down and told her outright how important it it have you listened to her counter arugments have the two of you both agreed that yes the best course of action is to try initiating a threesome with one of her friends did she say when she was going to do it because it doesnt really seem like she ever knew that this was a plan and now youre blaming her for not following your plan that you didnt share with her thats not cool at all if you end up dumping up with your partners of thirteen years and it comes as a surprise to them and it sounds like this would then you have fucked up in my book tl dr couples counselling,relationships
859,M,you tried thats all we could ask for,funny
860,M,a lot are but there are quite a few who have come directly from africa in the past ten to twenty years ghana the gambia nigeria and so on,funny
861,M,i cant figure out the hidden pun in the last sentence it has to be there,funny
862,M,jufy is a much better time of year than smarch,funny
863,M,3232 3232 im not sure where you got the idea that tobacco has extra carcinogens the reason why cigarettes are bad is that they must be smoked,funny
864,M,i totally agree with you this crazy rapture idea is very new but some hold to it,funny
865,M,fame does that to you,funny
866,M,how much of the population speaks english as well as german there im almost considering ditching out of the us for a while and exploring with my girlfriend not that im opposed to learning german id love to pick up another language but ive just never been very good at it ive only ever taken latin which is about as un german as you can get p,funny
867,M,while i realize that this is an obvious joke and purely colorful use of language i thought it might be useful to someone to point out that the vagina is not a sphincter,funny
868,M,because he should not make her deal with it its not fair its his mother exactly shes his mother not his child hes got no more control over her than op does and op doesnt have to deal with it op can refuse to visit or talk to the woman and probably should nothing the bf could possibly do would create a viable relationship between his mom and op,relationships
869,M,i still hear it every time that ring tone plays,funny
870,M,depends on who you ask half of the budists and half of the atheists would agree the rest wouldnt yes i pulled that number out of my anecdote sprinkled ass,funny
871,M,as a heads up it would be greatly appreciated if you could make the font a bit bigger just some helpful advice,funny
872,M,why would you touch you never touch the doppelganger,funny
873,M,i truly dont fear many things but i despise life like dolls,funny
874,M,saw this on the news in the dentist today the headline was weiner under immense pressure,funny
875,M,3 seven wow,funny
876,M,why,funny
877,M,this would be funnier if the guy in the picture was a real canadian,funny
878,M,first time i watched i didnt notice snoopy in the background,funny
879,M,how did you survive those attacks,funny
880,M,im a dental student remember that we have to buy into a practice as well which can easily be 400k added on a great investment no doubt but it feels like a lot on top of 200k of student loans it just takes time to pay off so the big number seems very scary for a while,funny
881,M,pb j is always awesome period,funny
882,M,that might be true she has no control over him and she shouldnt have control over him she should focus on what she can control and that is herself,relationships
883,M,my pomeranian likes to sleep on my head so it looks like im wearing a davey crockett raccoon hat,funny
884,M,lack any credentials that would make your opinions somewhat credible i dont need any credentials to have an opinion ill be content laughing out loud at myself when i fart maybe when you reach adulthood youll feel differently,funny
885,M,native azian here im up to a dozen stings like you i had my leg well foot ankle and lower calf go numb unlike you it stayed that way for more than three months bad as the stings are id take a scorpion over a bee sting any day,funny
886,M,there,funny
887,M,which witch,funny
888,M,but if youre on the reddit talking about how the bmi test is all wrong when applied to you sure you might be a bodybuilder but youre probably just an overweight person who likes sophisticated excuses,funny
889,M,six is waaay too much for that shite,funny
890,M,hijab niqab op is correct,funny
891,M,when it comes to cheating there really is no trying to get over it you either can or you cant trust is broken and takes a long time to be rebuilt and it is very hard for most people to forgive and forget and even if they do forgive most dont forget and is that really getting over it i dont think so i was cheated on and didnt know about it at the time well i had an inkling but no real proof and it ate at me a part of me missed her when we eventually broke up and a part of me still does but thats not the smart part i know it wouldnt have worked out in your case would you want to worry about him every time he goes out drinking fearing that this time he might get too drunk again and sleep with someone else if you could happily let him go out alone in mixed company and drink to his hearts content with no ill feelings maybe youre capable of getting over it but if not its probably best you left,relationships
892,M,i know right land of the free were we can protest well first we need a permit and it cant be on state or federal grounds without a big stink and oh yeah we cant impede movement of other people or police were we can own a fire arm welll we can but its usually a piece of shit castrated by the federal spending and batfe regulations on imports well at least we have the right to not be searched without a warrant well unless we look suspicious enough then you know what fuck it,funny
893,M,so why not go libertarian less money out of your pocket no military industrial complex legalized trees sounds good to me,funny
894,M,stop with this oh youre only 11 years old shit an 11 year old can fall in love just as much as anybody else and so what if it doesnt fit your definition of love youre just like the high horsed adults i despised growing up tl dr fuck you,funny
895,M,how did all this come to be why did she start drinking heavily have you ever talked to her about it there must be some cause clearly drinking heavily is the effect it stems i think from her past consensual sexual relationship with her father but if you ask her its because she cant stand the idea of working for a living as a slave for the rest of her life the dui maybe she was drinking heavily because she lost the only person in her life that cared about her nah she was drinking because she doesnt want to do anything but drink honestly at this point it is very likely that she will continue drinking no duh she could really use someone to help her the was a hospitalization and i put her through rehab twice she blew it and you could do more to change her life now then you ever could have in your time together with her my ties with her are cut and i have an order of protection against her now because she sent a series of emails describing in detail how she plans to murder my son if she lives the rest of her days as a no life alcoholic would you really be okay with that would you really be okay knowing that you could have helped i know that there was nothing that i or anyone couldve done to help i expect that shell be dead soon if she isnt already and ya i am fine with that do you pity her now no i am indifferent did you do nothing to help stop this habit before it became a huge problem asked and answered what if she was driving to come see you to apologize and ask for help she was driving a johns car to the liquor store but then again what the fuck do i know nothing,funny
896,M,my girlfriend of the past year and a half is black and is a swimmer lol however when her hair isnt braided hell can and will be wrought if her hair gets wet in the shower which is sometimes difficult to avoid when showering together,funny
897,M,so youre saying youre oppressed because some people dont find muscles attractive,funny
898,M,correct me if i am wrong but i could have sworn he was one of the first to start that trend not the other way around i remember seeing his video long before reddit started front paging a lot of the colorblind glasses videos all of which btw are completely overreacting just the same as this guy did not gonna lie though id consider doing the same thing if it meant getting those glasses for free to see what it was like since i am also colorblind the site actually regularly admits that they request these kinds of videos and send out the glasses free to some colorblind people to get them to advertise for them you still usually dont end up there unless you are actually somewhat colorblind though,funny
899,M,to quote rick james cocaine is a hell of a drug you are 20 you seem to be somewhat intelligent you can do better dont waste your time on this drugged out asshole move on and chalk it up to life experience,relationships
900,M,youre a myth man,funny
901,M,apparently you know absolutely nothing about the restaurant and bar industry,funny
902,M,you must be new to reddit,funny
903,M,ok thats how you break off two keys in two different locks,funny
904,M,honestly im more intrigued if the heat is caused by just pushing or if there was a spin involved,funny
905,M,sometimes those who accuse the loudest are trying to deflect attention away from something aka he who smelt it dealt it if your girlfriend cant handle you being friends with this other girl you need to pick one you cant have your cake and eat it too whos more important psycho chick or your friend i hate to break it to you but if she is asking are you ready to break up she is ready to break up shes just too cowardly to do it first,relationships
906,M,inside stan lees head i shoulda become a doctor like my parents wanted,funny
907,M,something you may have not considered due to being pissed off people have been yelling at you to get a dna test what if the kid isnt yours biologically i am assuming you love this little girl if shit goes down and you find out she isnt yours you arent going to have much to stand on in court to get rights to see her sorry to dig the hole possibly deeper but its a thought,relationships
908,M,will you and her be with each others parents or will it just be a private sit down just for the parents,relationships
909,M,where are you stationed,funny
910,M,ill assume youre trolling me and hand you an upvote as you were,funny
911,M,oh im totally willing to do all that i do wonder at what point purposely excluding him does become nasty,relationships
912,M,youre going to meet her family but you wanting to meet her dad is a deal breaker for her either im not getting what youre saying or she likes to play some weird head things,relationships
913,M,just imagine how many things have penetrated you,funny
914,M,how is this funny,funny
915,M,when and only when his girlfriend offers him a job job,funny
916,M,read the rest of the thread,funny
917,M,and played with his penis a little,relationships
918,M,am i the only one who doesnt understand the appeal of kicking on bieber and his tweenaged guys hes not the first corporate music creation aimed at pubescent kids and he wont be the last and guess what the music you listened to when you were 12 was probably just as shitty,funny
919,M,i hate reddit,funny
920,M,hallways exist in just about every structure,funny
921,M,the difference here is no one is doing investigations through the comments,funny
922,M,yeah it is but r retiredgif has a rule the gif must be more than merely relevant that is the gif must contain more than one relevant element person action object facial expression metaphor etc that this usage probably doesnt fit,funny
923,M,clearly canadian,funny
924,M,tell me more about how diverse it is im under the impression that it is mostly white conservative and christian,funny
925,M,no you wont,funny
926,M,you dont want this at least probably not as much as you think i have really poor vision which has a huge effect on my appearance with my contacts in i have big ol blue eyes with my glasses on i look like professor bunsen from the muppets,funny
927,M,i think he might have hit a jeffrey nobodys scared of a jeffrey,funny
928,M,i dont need to read any further than the oi bl cut ties and keep it that way at best he is confused and has issues to work out as much history as you have he is not good relationship material and its unfortunate you became collateral damage because of it go and find a stable guy and let him work out his own problems,relationships
929,M,that is bull guys dumb down the need a whole lot so it runs on a lot of systems not just on the most hardcore ass rigs by default it cant be better when was the last time you played a way where every tree and building was unique and you could see the hairs grass leaves animal fuzzy stuff etc of the characters gently swaying in the wind etc did you accidentally watch a cam version instead of an ipod version,funny
930,M,i would think the military has someone that could help you with this i bet youre not the first to go through it try and be civil apologize for blowing up in anger and hopefully it will get better if youre enlisted your hands are probably tied right now for custody but do the best you can and when things change maybe you will have better circumstances to get your kids best wishes it sucks but sounds like a break was the best thing,relationships
931,M,yes d,funny
932,M,theres a magical thing called google,funny
933,M,i know i am going to sound like a douche here but snowboarding is easy you should be able to carve your very first day on a board and you should be able to carve well after 2 or 3 days on a board if you are consistently board sliding down runs even blacks you arent trying hard enough,funny
934,M,worked in harry potter why not real life,funny
935,M,this is tubing evolved,funny
936,M,i think you are reading too much into this there could be a host of reasons that they didnt include you in the initial invite including that they forgot you say its a large family so i can totally see someone rushing to get all of this done and not realizing that your bf had a gf and then attempting to rectify the situation with a follow up email so i say rsvp and go to the wedding,relationships
937,M,tough,funny
938,M,to be or not to be that is the question whether tis nobler in the mind to suffer the slings and arrows of outrageous fortune or to take arms against a sea of troubles and by opposing end them to die to sleep no more and by a sleep to say we end the heartache and the thousand natural shocks that flesh is heir to tis a consummation devoutly to be wished to die to sleep to sleep perchance to dream ay theres the rub for in that sleep of death what dreams may come when we have shuffled off this mortal coil must give us pause theres the respect that makes calamity of so long life for who would bear the whips and scorns of time th oppressors wrong the proud mans contumely the pangs of disprized love the laws delay the insolence of office and the spurns that patient merit of th unworthy takes when he himself might his quietus make with a bare bodkin who would fardels bear to grunt and sweat under a weary life but that the dread of something after death the undiscovered country from whose bourn no traveler returns puzzles the will and makes us rather bear those ills we have than fly to others that we know not of thus conscience does make cowards of us all and thus the native hue of present is sicklied oer with the pale cast of thought and enterprises of great pitch and moment with this regard their currents turn awry and lose the name of action soft you now the fair ophelia nymph in thy orisons be all my sins remembered mark twain,funny
939,M,hi im x how have things been going with your way keep it work related to start to break the ice only she knows why she is looking at you and you will only know if you put the effort in to talk to her,relationships
940,M,wheres your head at,funny
941,M,im fat are you calling me lazy because youre wrong fat lazy and no ive never seen anyone being stereotyped as dumb vain or arrogant for being burly the only things ive seen them stereotyped as being are strong or macho neither of those are bad,funny
942,M,is it impossible for a woman to have prostate cancer i was unaware,funny
943,M,how much is a decent architect paid by the way just curious,funny
